t,frame,name,conf,score,decision,reason
21.705,394,class57,0.303,0.152,DISCARD,low_score
21.759,395,class16,0.862,0.431,DISCARD,low_score
21.759,395,class59,0.302,0.151,DISCARD,low_score
21.813,396,class16,0.873,0.437,DISCARD,low_score
21.868,397,class16,0.863,0.432,DISCARD,low_score
21.868,397,class59,0.351,0.176,DISCARD,low_score
21.922,398,class16,0.717,0.359,DISCARD,low_score
21.922,398,class15,0.27,0.135,DISCARD,low_score
21.976,399,class16,0.833,0.417,DISCARD,low_score
21.976,399,class59,0.423,0.212,DISCARD,low_score
22.03,400,class16,0.852,0.426,DISCARD,low_score
22.03,400,class57,0.258,0.129,DISCARD,low_score
22.084,401,class16,0.847,0.423,DISCARD,low_score
22.084,401,class57,0.564,0.282,DISCARD,low_score
22.138,402,class16,0.587,0.293,DISCARD,low_score
22.138,402,class57,0.267,0.133,DISCARD,low_score
22.192,403,class16,0.688,0.344,DISCARD,low_score
22.246,404,class16,0.84,0.42,DISCARD,low_score
22.3,405,class16,0.818,0.409,DISCARD,low_score
22.3,405,class57,0.295,0.148,DISCARD,low_score
22.354,406,class16,0.428,0.214,DISCARD,low_score
22.354,406,class17,0.317,0.159,DISCARD,low_score
22.408,407,class16,0.793,0.397,DISCARD,low_score
22.462,408,class16,0.912,0.456,KEEP,priority+bandwidth_ok
22.516,409,class16,0.889,0.444,DISCARD,low_score
22.57,410,class16,0.87,0.435,DISCARD,low_score
22.624,411,class16,0.847,0.423,DISCARD,low_score
22.678,412,class16,0.886,0.443,DISCARD,low_score
22.732,413,class16,0.862,0.431,DISCARD,low_score
22.786,414,class16,0.762,0.381,DISCARD,low_score
22.839,415,class16,0.893,0.447,DISCARD,low_score
22.893,416,class16,0.882,0.441,DISCARD,low_score
22.947,417,class16,0.908,0.454,KEEP,priority+bandwidth_ok
23.001,418,class16,0.916,0.458,KEEP,priority+bandwidth_ok
23.055,419,class16,0.91,0.455,KEEP,priority+bandwidth_ok
23.109,420,class16,0.909,0.455,KEEP,priority+bandwidth_ok
23.163,421,class16,0.914,0.457,KEEP,priority+bandwidth_ok
23.219,422,class16,0.903,0.451,KEEP,priority+bandwidth_ok
23.273,423,class16,0.822,0.411,DISCARD,low_score
23.326,424,class16,0.776,0.388,DISCARD,low_score
23.38,425,class16,0.828,0.414,DISCARD,low_score
23.435,426,class16,0.878,0.439,DISCARD,low_score
23.488,427,class16,0.892,0.446,DISCARD,low_score
23.542,428,class16,0.709,0.355,DISCARD,low_score
23.542,428,class21,0.374,0.187,DISCARD,low_score
23.596,429,class16,0.863,0.432,DISCARD,low_score
23.65,430,class16,0.893,0.447,DISCARD,low_score
23.704,431,class16,0.892,0.446,DISCARD,low_score
23.704,431,class57,0.349,0.174,DISCARD,low_score
23.758,432,class16,0.904,0.452,KEEP,priority+bandwidth_ok
23.758,432,class57,0.436,0.218,DISCARD,low_score
23.812,433,class16,0.905,0.453,KEEP,priority+bandwidth_ok
23.812,433,class59,0.431,0.216,DISCARD,low_score
23.812,433,class57,0.415,0.207,DISCARD,low_score
23.866,434,class16,0.905,0.452,KEEP,priority+bandwidth_ok
23.866,434,class59,0.446,0.223,DISCARD,low_score
23.866,434,class57,0.402,0.201,DISCARD,low_score
23.92,435,class16,0.905,0.452,KEEP,priority+bandwidth_ok
23.974,436,class16,0.909,0.455,KEEP,priority+bandwidth_ok
23.974,436,class59,0.288,0.144,DISCARD,low_score
24.029,437,class16,0.911,0.455,KEEP,priority+bandwidth_ok
24.029,437,class57,0.411,0.206,DISCARD,low_score
24.029,437,class59,0.376,0.188,DISCARD,low_score
24.083,438,class16,0.894,0.447,DISCARD,low_score
24.137,439,class16,0.908,0.454,KEEP,priority+bandwidth_ok
24.137,439,class59,0.47,0.235,DISCARD,low_score
24.191,440,class16,0.916,0.458,KEEP,priority+bandwidth_ok
24.191,440,class59,0.45,0.225,DISCARD,low_score
24.245,441,class16,0.906,0.453,KEEP,priority+bandwidth_ok
24.245,441,class59,0.532,0.266,DISCARD,low_score
24.299,442,class16,0.91,0.455,KEEP,priority+bandwidth_ok
24.299,442,class59,0.525,0.263,DISCARD,low_score
24.353,443,class16,0.921,0.46,KEEP,priority+bandwidth_ok
24.353,443,class59,0.657,0.328,DISCARD,low_score
24.407,444,class16,0.896,0.448,DISCARD,low_score
24.407,444,class59,0.61,0.305,DISCARD,low_score
24.407,444,class57,0.268,0.134,DISCARD,low_score
24.462,445,class16,0.903,0.452,KEEP,priority+bandwidth_ok
24.462,445,class59,0.72,0.36,DISCARD,low_score
24.516,446,class16,0.899,0.45,DISCARD,low_score
24.516,446,class59,0.785,0.393,DISCARD,low_score
24.57,447,class16,0.904,0.452,DISCARD,bandwidth
24.57,447,class59,0.794,0.397,DISCARD,low_score
24.626,448,class16,0.905,0.453,DISCARD,bandwidth
24.626,448,class59,0.829,0.414,DISCARD,low_score
24.68,449,class59,0.903,0.451,DISCARD,bandwidth
24.68,449,class16,0.903,0.451,DISCARD,bandwidth
24.734,450,class16,0.927,0.464,DISCARD,bandwidth
24.734,450,class59,0.818,0.409,DISCARD,low_score
24.788,451,class16,0.925,0.462,DISCARD,bandwidth
24.788,451,class59,0.83,0.415,DISCARD,low_score
24.843,452,class16,0.917,0.459,DISCARD,bandwidth
24.843,452,class59,0.686,0.343,DISCARD,low_score
24.897,453,class16,0.904,0.452,DISCARD,bandwidth
24.897,453,class59,0.73,0.365,DISCARD,low_score
24.951,454,class16,0.91,0.455,DISCARD,bandwidth
24.951,454,class59,0.628,0.314,DISCARD,low_score
25.005,455,class16,0.901,0.451,DISCARD,bandwidth
25.005,455,class59,0.534,0.267,DISCARD,low_score
25.005,455,class57,0.292,0.146,DISCARD,low_score
25.059,456,class16,0.903,0.451,DISCARD,bandwidth
25.059,456,class59,0.6,0.3,DISCARD,low_score
25.113,457,class16,0.914,0.457,DISCARD,bandwidth
25.113,457,class59,0.648,0.324,DISCARD,low_score
25.167,458,class16,0.917,0.459,DISCARD,bandwidth
25.167,458,class59,0.701,0.35,DISCARD,low_score
25.221,459,class16,0.918,0.459,DISCARD,bandwidth
25.221,459,class59,0.737,0.369,DISCARD,low_score
25.286,460,class16,0.909,0.454,DISCARD,bandwidth
25.286,460,class59,0.722,0.361,DISCARD,low_score
25.34,461,class16,0.922,0.461,DISCARD,bandwidth
25.34,461,class59,0.578,0.289,DISCARD,low_score
25.394,462,class16,0.915,0.457,DISCARD,bandwidth
25.394,462,class59,0.642,0.321,DISCARD,low_score
25.448,463,class16,0.913,0.457,DISCARD,bandwidth
25.448,463,class59,0.655,0.327,DISCARD,low_score
25.503,464,class16,0.918,0.459,DISCARD,bandwidth
25.503,464,class59,0.719,0.359,DISCARD,low_score
25.557,465,class16,0.909,0.455,DISCARD,bandwidth
25.557,465,class59,0.759,0.38,DISCARD,low_score
25.611,466,class16,0.909,0.454,DISCARD,bandwidth
25.611,466,class59,0.669,0.334,DISCARD,low_score
25.665,467,class16,0.901,0.451,DISCARD,bandwidth
25.665,467,class59,0.641,0.32,DISCARD,low_score
25.719,468,class16,0.903,0.451,DISCARD,bandwidth
25.719,468,class59,0.651,0.326,DISCARD,low_score
25.773,469,class16,0.893,0.446,DISCARD,low_score
25.773,469,class59,0.746,0.373,DISCARD,low_score
25.828,470,class16,0.888,0.444,DISCARD,low_score
25.828,470,class59,0.577,0.288,DISCARD,low_score
25.828,470,class57,0.277,0.138,DISCARD,low_score
25.882,471,class16,0.888,0.444,DISCARD,low_score
25.882,471,class59,0.548,0.274,DISCARD,low_score
25.937,472,class16,0.901,0.45,DISCARD,bandwidth
25.937,472,class59,0.646,0.323,DISCARD,low_score
25.992,473,class16,0.907,0.453,DISCARD,bandwidth
25.992,473,class59,0.559,0.28,DISCARD,low_score
26.045,474,class16,0.896,0.448,DISCARD,low_score
26.045,474,class59,0.494,0.247,DISCARD,low_score
26.099,475,class16,0.899,0.45,DISCARD,low_score
26.099,475,class59,0.737,0.369,DISCARD,low_score
26.154,476,class16,0.907,0.453,DISCARD,bandwidth
26.154,476,class59,0.65,0.325,DISCARD,low_score
26.208,477,class16,0.894,0.447,DISCARD,low_score
26.208,477,class59,0.704,0.352,DISCARD,low_score
26.262,478,class16,0.899,0.45,DISCARD,low_score
26.262,478,class59,0.689,0.345,DISCARD,low_score
26.316,479,class16,0.882,0.441,DISCARD,low_score
26.316,479,class59,0.585,0.293,DISCARD,low_score
26.37,480,class16,0.898,0.449,DISCARD,low_score
26.37,480,class59,0.53,0.265,DISCARD,low_score
26.425,481,class16,0.927,0.464,DISCARD,bandwidth
26.425,481,class59,0.593,0.296,DISCARD,low_score
26.479,482,class16,0.905,0.453,DISCARD,bandwidth
26.479,482,class59,0.655,0.327,DISCARD,low_score
26.533,483,class16,0.914,0.457,DISCARD,bandwidth
26.533,483,class59,0.571,0.285,DISCARD,low_score
26.587,484,class16,0.921,0.461,DISCARD,bandwidth
26.587,484,class59,0.544,0.272,DISCARD,low_score
26.641,485,class16,0.899,0.45,DISCARD,low_score
26.641,485,class59,0.559,0.28,DISCARD,low_score
26.695,486,class16,0.864,0.432,DISCARD,low_score
26.695,486,class59,0.701,0.35,DISCARD,low_score
26.749,487,class16,0.921,0.46,DISCARD,bandwidth
26.749,487,class59,0.712,0.356,DISCARD,low_score
26.803,488,class16,0.876,0.438,DISCARD,low_score
26.803,488,class59,0.689,0.345,DISCARD,low_score
26.803,488,class56,0.5,0.25,DISCARD,low_score
26.857,489,class16,0.886,0.443,DISCARD,low_score
26.857,489,class56,0.756,0.378,DISCARD,low_score
26.857,489,class59,0.544,0.272,DISCARD,low_score
26.911,490,class16,0.852,0.426,DISCARD,low_score
26.911,490,class56,0.703,0.351,DISCARD,low_score
26.911,490,class59,0.681,0.34,DISCARD,low_score
26.966,491,class16,0.917,0.459,DISCARD,bandwidth
26.966,491,class56,0.755,0.377,DISCARD,low_score
26.966,491,class59,0.573,0.286,DISCARD,low_score
27.02,492,class16,0.893,0.446,DISCARD,low_score
27.02,492,class56,0.749,0.375,DISCARD,low_score
27.02,492,class59,0.471,0.235,DISCARD,low_score
27.074,493,class16,0.885,0.442,DISCARD,low_score
27.074,493,class56,0.749,0.375,DISCARD,low_score
27.074,493,class59,0.421,0.21,DISCARD,low_score
27.129,494,class16,0.883,0.442,DISCARD,low_score
27.129,494,class56,0.769,0.385,DISCARD,low_score
27.129,494,class59,0.639,0.319,DISCARD,low_score
27.183,495,class16,0.867,0.434,DISCARD,low_score
27.183,495,class59,0.815,0.408,DISCARD,low_score
27.183,495,class56,0.761,0.38,DISCARD,low_score
27.237,496,class16,0.846,0.423,DISCARD,low_score
27.237,496,class59,0.769,0.385,DISCARD,low_score
27.237,496,class56,0.449,0.225,DISCARD,low_score
27.237,496,class57,0.419,0.209,DISCARD,low_score
27.292,497,class59,0.832,0.416,DISCARD,low_score
27.292,497,class16,0.794,0.397,DISCARD,low_score
27.292,497,class56,0.442,0.221,DISCARD,low_score
27.347,498,class16,0.734,0.367,DISCARD,low_score
27.347,498,class59,0.529,0.265,DISCARD,low_score
27.347,498,class56,0.469,0.234,DISCARD,low_score
27.401,499,class16,0.773,0.387,DISCARD,low_score
27.401,499,class57,0.482,0.241,DISCARD,low_score
27.401,499,class59,0.382,0.191,DISCARD,low_score
27.401,499,class56,0.264,0.132,DISCARD,low_score
27.457,500,class16,0.862,0.431,DISCARD,low_score
27.457,500,class59,0.633,0.317,DISCARD,low_score
27.457,500,class56,0.308,0.154,DISCARD,low_score
27.511,501,class16,0.848,0.424,DISCARD,low_score
27.511,501,class56,0.798,0.399,DISCARD,low_score
27.511,501,class59,0.676,0.338,DISCARD,low_score
27.511,501,class56,0.314,0.157,DISCARD,low_score
27.565,502,class16,0.886,0.443,DISCARD,low_score
27.565,502,class56,0.804,0.402,DISCARD,low_score
27.565,502,class56,0.469,0.234,DISCARD,low_score
27.62,503,class56,0.826,0.413,DISCARD,low_score
27.62,503,class16,0.797,0.398,DISCARD,low_score
27.62,503,class56,0.488,0.244,DISCARD,low_score
27.62,503,class57,0.287,0.143,DISCARD,low_score
27.62,503,class56,0.286,0.143,DISCARD,low_score
27.674,504,class16,0.728,0.364,DISCARD,low_score
27.674,504,class56,0.717,0.359,DISCARD,low_score
27.674,504,class56,0.34,0.17,DISCARD,low_score
27.674,504,class59,0.258,0.129,DISCARD,low_score
27.729,505,class16,0.848,0.424,DISCARD,low_score
27.729,505,class56,0.433,0.217,DISCARD,low_score
27.783,506,class16,0.739,0.369,DISCARD,low_score
27.783,506,class15,0.4,0.2,DISCARD,low_score
27.783,506,class45,0.368,0.184,DISCARD,low_score
27.783,506,class56,0.36,0.18,DISCARD,low_score
27.783,506,class57,0.32,0.16,DISCARD,low_score
27.783,506,class56,0.281,0.141,DISCARD,low_score
27.783,506,class15,0.261,0.13,DISCARD,low_score
27.783,506,class56,0.255,0.127,DISCARD,low_score
27.839,507,class16,0.864,0.432,DISCARD,low_score
27.839,507,class56,0.648,0.324,DISCARD,low_score
27.839,507,class56,0.392,0.196,DISCARD,low_score
27.839,507,class57,0.302,0.151,DISCARD,low_score
27.893,508,class16,0.835,0.418,DISCARD,low_score
27.893,508,class0,0.595,0.298,DISCARD,low_score
27.893,508,class56,0.553,0.276,DISCARD,low_score
27.893,508,class57,0.329,0.164,DISCARD,low_score
27.893,508,class15,0.258,0.129,DISCARD,low_score
27.948,509,class16,0.84,0.42,DISCARD,low_score
27.948,509,class56,0.463,0.231,DISCARD,low_score
28.002,510,class56,0.72,0.36,DISCARD,low_score
28.002,510,class16,0.621,0.31,DISCARD,low_score
28.002,510,class56,0.451,0.226,DISCARD,low_score
28.002,510,class57,0.335,0.167,DISCARD,low_score
28.002,510,class56,0.297,0.149,DISCARD,low_score
28.057,511,class16,0.916,0.458,DISCARD,bandwidth
28.057,511,class56,0.763,0.382,DISCARD,low_score
28.057,511,class56,0.44,0.22,DISCARD,low_score
28.057,511,class56,0.305,0.152,DISCARD,low_score
28.057,511,class60,0.254,0.127,DISCARD,low_score
28.111,512,class16,0.784,0.392,DISCARD,low_score
28.111,512,class56,0.726,0.363,DISCARD,low_score
28.111,512,class56,0.44,0.22,DISCARD,low_score
28.111,512,class56,0.307,0.154,DISCARD,low_score
28.111,512,class56,0.302,0.151,DISCARD,low_score
28.111,512,class56,0.285,0.143,DISCARD,low_score
28.166,513,class16,0.883,0.442,DISCARD,low_score
28.166,513,class56,0.758,0.379,DISCARD,low_score
28.166,513,class56,0.409,0.205,DISCARD,low_score
28.166,513,class56,0.269,0.134,DISCARD,low_score
28.221,514,class16,0.891,0.446,DISCARD,low_score
28.221,514,class56,0.728,0.364,DISCARD,low_score
28.221,514,class56,0.525,0.263,DISCARD,low_score
28.221,514,class56,0.402,0.201,DISCARD,low_score
28.221,514,class56,0.307,0.154,DISCARD,low_score
28.221,514,class56,0.304,0.152,DISCARD,low_score
28.276,515,class16,0.838,0.419,DISCARD,low_score
28.276,515,class56,0.715,0.358,DISCARD,low_score
28.276,515,class56,0.504,0.252,DISCARD,low_score
28.276,515,class56,0.409,0.205,DISCARD,low_score
28.276,515,class56,0.293,0.146,DISCARD,low_score
28.331,516,class16,0.751,0.375,DISCARD,low_score
28.331,516,class56,0.51,0.255,DISCARD,low_score
28.331,516,class59,0.435,0.217,DISCARD,low_score
28.331,516,class56,0.274,0.137,DISCARD,low_score
28.385,517,class16,0.775,0.387,DISCARD,low_score
28.385,517,class56,0.593,0.296,DISCARD,low_score
28.385,517,class59,0.446,0.223,DISCARD,low_score
28.385,517,class56,0.382,0.191,DISCARD,low_score
28.385,517,class56,0.36,0.18,DISCARD,low_score
28.385,517,class56,0.304,0.152,DISCARD,low_score
28.385,517,class57,0.259,0.13,DISCARD,low_score
28.385,517,class56,0.254,0.127,DISCARD,low_score
28.441,518,class56,0.852,0.426,DISCARD,low_score
28.441,518,class16,0.838,0.419,DISCARD,low_score
28.441,518,class59,0.671,0.335,DISCARD,low_score
28.441,518,class56,0.396,0.198,DISCARD,low_score
28.441,518,class56,0.308,0.154,DISCARD,low_score
28.441,518,class56,0.288,0.144,DISCARD,low_score
28.441,518,class56,0.277,0.138,DISCARD,low_score
28.441,518,class56,0.261,0.13,DISCARD,low_score
28.496,519,class16,0.851,0.425,DISCARD,low_score
28.496,519,class56,0.78,0.39,DISCARD,low_score
28.496,519,class56,0.419,0.209,DISCARD,low_score
28.496,519,class56,0.367,0.184,DISCARD,low_score
28.496,519,class57,0.283,0.141,DISCARD,low_score
28.551,520,class16,0.857,0.428,DISCARD,low_score
28.551,520,class56,0.849,0.424,DISCARD,low_score
28.551,520,class56,0.413,0.207,DISCARD,low_score
28.551,520,class56,0.335,0.167,DISCARD,low_score
28.551,520,class57,0.317,0.159,DISCARD,low_score
28.606,521,class16,0.793,0.397,DISCARD,low_score
28.606,521,class56,0.763,0.382,DISCARD,low_score
28.606,521,class56,0.376,0.188,DISCARD,low_score
28.606,521,class57,0.269,0.134,DISCARD,low_score
28.606,521,class56,0.255,0.128,DISCARD,low_score
28.66,522,class16,0.868,0.434,DISCARD,low_score
28.66,522,class56,0.854,0.427,DISCARD,low_score
28.66,522,class59,0.443,0.221,DISCARD,low_score
28.66,522,class56,0.405,0.202,DISCARD,low_score
28.66,522,class56,0.381,0.191,DISCARD,low_score
28.66,522,class56,0.34,0.17,DISCARD,low_score
28.66,522,class56,0.339,0.169,DISCARD,low_score
28.717,523,class56,0.859,0.429,DISCARD,low_score
28.717,523,class16,0.633,0.317,DISCARD,low_score
28.717,523,class56,0.512,0.256,DISCARD,low_score
28.717,523,class56,0.332,0.166,DISCARD,low_score
28.717,523,class56,0.304,0.152,DISCARD,low_score
28.717,523,class59,0.293,0.147,DISCARD,low_score
28.774,524,class56,0.89,0.445,DISCARD,low_score
28.774,524,class16,0.861,0.43,DISCARD,low_score
28.774,524,class56,0.553,0.276,DISCARD,low_score
28.774,524,class56,0.479,0.239,DISCARD,low_score
28.774,524,class56,0.264,0.132,DISCARD,low_score
28.829,525,class56,0.854,0.427,DISCARD,low_score
28.829,525,class16,0.834,0.417,DISCARD,low_score
28.829,525,class56,0.384,0.192,DISCARD,low_score
28.829,525,class59,0.373,0.186,DISCARD,low_score
28.829,525,class56,0.35,0.175,DISCARD,low_score
28.829,525,class56,0.328,0.164,DISCARD,low_score
28.829,525,class59,0.327,0.163,DISCARD,low_score
28.829,525,class56,0.311,0.155,DISCARD,low_score
28.884,526,class56,0.838,0.419,DISCARD,low_score
28.884,526,class56,0.574,0.287,DISCARD,low_score
28.884,526,class16,0.553,0.276,DISCARD,low_score
28.884,526,class56,0.349,0.174,DISCARD,low_score
28.884,526,class56,0.343,0.172,DISCARD,low_score
28.884,526,class56,0.314,0.157,DISCARD,low_score
28.884,526,class56,0.298,0.149,DISCARD,low_score
28.94,527,class56,0.883,0.442,DISCARD,low_score
28.94,527,class56,0.429,0.215,DISCARD,low_score
28.94,527,class56,0.387,0.193,DISCARD,low_score
28.94,527,class56,0.374,0.187,DISCARD,low_score
28.94,527,class56,0.342,0.171,DISCARD,low_score
28.94,527,class56,0.293,0.147,DISCARD,low_score
28.995,528,class56,0.877,0.438,DISCARD,low_score
28.995,528,class56,0.365,0.182,DISCARD,low_score
28.995,528,class56,0.29,0.145,DISCARD,low_score
29.049,529,class56,0.854,0.427,DISCARD,low_score
29.049,529,class56,0.683,0.341,DISCARD,low_score
29.049,529,class59,0.626,0.313,DISCARD,low_score
29.049,529,class56,0.484,0.242,DISCARD,low_score
29.049,529,class60,0.413,0.207,DISCARD,low_score
29.049,529,class56,0.348,0.174,DISCARD,low_score
29.049,529,class56,0.333,0.166,DISCARD,low_score
29.049,529,class56,0.308,0.154,DISCARD,low_score
29.104,530,class56,0.862,0.431,DISCARD,low_score
29.104,530,class56,0.568,0.284,DISCARD,low_score
29.104,530,class56,0.424,0.212,DISCARD,low_score
29.104,530,class56,0.365,0.182,DISCARD,low_score
29.104,530,class60,0.351,0.176,DISCARD,low_score
29.104,530,class56,0.296,0.148,DISCARD,low_score
29.104,530,class56,0.288,0.144,DISCARD,low_score
29.104,530,class56,0.261,0.131,DISCARD,low_score
29.16,531,class56,0.889,0.444,DISCARD,low_score
29.16,531,class60,0.595,0.297,DISCARD,low_score
29.16,531,class56,0.49,0.245,DISCARD,low_score
29.16,531,class56,0.397,0.199,DISCARD,low_score
29.16,531,class56,0.389,0.194,DISCARD,low_score
29.16,531,class56,0.386,0.193,DISCARD,low_score
29.16,531,class56,0.358,0.179,DISCARD,low_score
29.16,531,class56,0.3,0.15,DISCARD,low_score
29.16,531,class56,0.294,0.147,DISCARD,low_score
29.16,531,class57,0.257,0.128,DISCARD,low_score
29.215,532,class56,0.878,0.439,DISCARD,low_score
29.215,532,class56,0.751,0.375,DISCARD,low_score
29.215,532,class56,0.587,0.293,DISCARD,low_score
29.215,532,class60,0.57,0.285,DISCARD,low_score
29.215,532,class56,0.431,0.216,DISCARD,low_score
29.215,532,class56,0.419,0.209,DISCARD,low_score
29.27,533,class56,0.875,0.437,DISCARD,low_score
29.27,533,class56,0.611,0.306,DISCARD,low_score
29.27,533,class60,0.57,0.285,DISCARD,low_score
29.27,533,class56,0.506,0.253,DISCARD,low_score
29.27,533,class56,0.492,0.246,DISCARD,low_score
29.27,533,class56,0.442,0.221,DISCARD,low_score
29.325,534,class56,0.812,0.406,DISCARD,low_score
29.325,534,class56,0.581,0.291,DISCARD,low_score
29.325,534,class56,0.482,0.241,DISCARD,low_score
29.325,534,class60,0.413,0.207,DISCARD,low_score
29.325,534,class56,0.412,0.206,DISCARD,low_score
29.325,534,class57,0.303,0.152,DISCARD,low_score
29.325,534,class56,0.297,0.148,DISCARD,low_score
29.38,535,class56,0.849,0.424,DISCARD,low_score
29.38,535,class56,0.688,0.344,DISCARD,low_score
29.38,535,class56,0.521,0.261,DISCARD,low_score
29.38,535,class60,0.478,0.239,DISCARD,low_score
29.38,535,class56,0.467,0.233,DISCARD,low_score
29.38,535,class60,0.348,0.174,DISCARD,low_score
29.38,535,class60,0.304,0.152,DISCARD,low_score
29.38,535,class56,0.264,0.132,DISCARD,low_score
29.436,536,class56,0.85,0.425,DISCARD,low_score
29.436,536,class56,0.61,0.305,DISCARD,low_score
29.436,536,class60,0.444,0.222,DISCARD,low_score
29.436,536,class56,0.415,0.207,DISCARD,low_score
29.436,536,class56,0.355,0.177,DISCARD,low_score
29.436,536,class56,0.326,0.163,DISCARD,low_score
29.436,536,class57,0.316,0.158,DISCARD,low_score
29.436,536,class56,0.287,0.143,DISCARD,low_score
29.436,536,class56,0.274,0.137,DISCARD,low_score
29.491,537,class56,0.842,0.421,DISCARD,low_score
29.491,537,class56,0.56,0.28,DISCARD,low_score
29.491,537,class56,0.508,0.254,DISCARD,low_score
29.491,537,class56,0.461,0.231,DISCARD,low_score
29.491,537,class60,0.393,0.197,DISCARD,low_score
29.491,537,class60,0.325,0.163,DISCARD,low_score
29.491,537,class56,0.262,0.131,DISCARD,low_score
29.491,537,class56,0.252,0.126,DISCARD,low_score
29.546,538,class56,0.86,0.43,DISCARD,low_score
29.546,538,class56,0.789,0.395,DISCARD,low_score
29.546,538,class56,0.613,0.307,DISCARD,low_score
29.546,538,class56,0.556,0.278,DISCARD,low_score
29.546,538,class56,0.482,0.241,DISCARD,low_score
29.546,538,class60,0.358,0.179,DISCARD,low_score
29.601,539,class56,0.853,0.426,DISCARD,low_score
29.601,539,class56,0.576,0.288,DISCARD,low_score
29.601,539,class56,0.512,0.256,DISCARD,low_score
29.601,539,class56,0.486,0.243,DISCARD,low_score
29.601,539,class60,0.413,0.207,DISCARD,low_score
29.601,539,class56,0.358,0.179,DISCARD,low_score
29.656,540,class56,0.833,0.417,DISCARD,low_score
29.656,540,class60,0.616,0.308,DISCARD,low_score
29.656,540,class56,0.558,0.279,DISCARD,low_score
29.656,540,class56,0.502,0.251,DISCARD,low_score
29.656,540,class56,0.453,0.227,DISCARD,low_score
