t,frame,name,conf,score,decision,reason
89.142,1634,class59,0.916,0.458,KEEP,priority+bandwidth_ok
89.142,1634,class16,0.648,0.324,DISCARD,low_score
89.196,1635,class59,0.895,0.447,DISCARD,low_score
89.196,1635,class16,0.348,0.174,DISCARD,low_score
89.25,1636,class59,0.885,0.442,DISCARD,low_score
89.25,1636,class16,0.453,0.227,DISCARD,low_score
89.303,1637,class59,0.899,0.45,DISCARD,low_score
89.303,1637,class16,0.488,0.244,DISCARD,low_score
89.303,1637,class73,0.257,0.128,DISCARD,low_score
89.358,1638,class59,0.891,0.446,DISCARD,low_score
89.358,1638,class16,0.498,0.249,DISCARD,low_score
89.412,1639,class59,0.868,0.434,DISCARD,low_score
89.412,1639,class16,0.465,0.232,DISCARD,low_score
89.412,1639,class73,0.294,0.147,DISCARD,low_score
89.467,1640,class59,0.87,0.435,DISCARD,low_score
89.467,1640,class16,0.698,0.349,DISCARD,low_score
89.467,1640,class57,0.421,0.21,DISCARD,low_score
89.467,1640,class60,0.288,0.144,DISCARD,low_score
89.521,1641,class59,0.879,0.44,DISCARD,low_score
89.521,1641,class16,0.715,0.358,DISCARD,low_score
89.521,1641,class60,0.297,0.149,DISCARD,low_score
89.576,1642,class59,0.887,0.444,DISCARD,low_score
89.576,1642,class16,0.725,0.362,DISCARD,low_score
89.576,1642,class60,0.359,0.18,DISCARD,low_score
89.63,1643,class59,0.851,0.425,DISCARD,low_score
89.63,1643,class16,0.803,0.402,DISCARD,low_score
89.684,1644,class59,0.885,0.442,DISCARD,low_score
89.684,1644,class16,0.808,0.404,DISCARD,low_score
89.684,1644,class60,0.256,0.128,DISCARD,low_score
89.738,1645,class59,0.885,0.442,DISCARD,low_score
89.738,1645,class16,0.784,0.392,DISCARD,low_score
89.738,1645,class60,0.357,0.178,DISCARD,low_score
89.793,1646,class59,0.878,0.439,DISCARD,low_score
89.793,1646,class16,0.826,0.413,DISCARD,low_score
89.847,1647,class59,0.883,0.442,DISCARD,low_score
89.847,1647,class16,0.808,0.404,DISCARD,low_score
89.847,1647,class60,0.307,0.154,DISCARD,low_score
89.901,1648,class59,0.871,0.435,DISCARD,low_score
89.901,1648,class16,0.789,0.395,DISCARD,low_score
89.901,1648,class60,0.307,0.154,DISCARD,low_score
89.955,1649,class59,0.761,0.38,DISCARD,low_score
89.955,1649,class16,0.696,0.348,DISCARD,low_score
90.009,1650,class59,0.709,0.355,DISCARD,low_score
90.009,1650,class16,0.665,0.333,DISCARD,low_score
90.009,1650,class60,0.31,0.155,DISCARD,low_score
