t,frame,name,conf,score,decision,reason
65.545,1201,class39,0.333,0.166,DISCARD,low_score
65.611,1202,class69,0.51,0.255,DISCARD,low_score
65.611,1202,class39,0.289,0.145,DISCARD,low_score
65.665,1203,class69,0.583,0.292,DISCARD,low_score
65.665,1203,class39,0.277,0.138,DISCARD,low_score
65.771,1205,class71,0.333,0.166,DISCARD,low_score
65.826,1206,class70,0.564,0.282,DISCARD,low_score
65.826,1206,class69,0.514,0.257,DISCARD,low_score
65.826,1206,class69,0.263,0.131,DISCARD,low_score
65.826,1206,class45,0.254,0.127,DISCARD,low_score
65.88,1207,class70,0.417,0.208,DISCARD,low_score
65.88,1207,class69,0.385,0.192,DISCARD,low_score
65.88,1207,class69,0.383,0.192,DISCARD,low_score
66.089,1211,class69,0.376,0.188,DISCARD,low_score
66.089,1211,class70,0.349,0.174,DISCARD,low_score
66.089,1211,class45,0.267,0.134,DISCARD,low_score
66.144,1212,class70,0.556,0.278,DISCARD,low_score
66.144,1212,class69,0.492,0.246,DISCARD,low_score
66.144,1212,class45,0.345,0.173,DISCARD,low_score
66.198,1213,class69,0.508,0.254,DISCARD,low_score
66.198,1213,class70,0.436,0.218,DISCARD,low_score
66.198,1213,class45,0.411,0.206,DISCARD,low_score
66.252,1214,class69,0.389,0.194,DISCARD,low_score
66.305,1215,class72,0.354,0.177,DISCARD,low_score
66.359,1216,class72,0.715,0.358,DISCARD,low_score
66.359,1216,class69,0.423,0.211,DISCARD,low_score
66.359,1216,class45,0.27,0.135,DISCARD,low_score
66.414,1217,class72,0.806,0.403,DISCARD,low_score
66.414,1217,class69,0.274,0.137,DISCARD,low_score
66.414,1217,class45,0.254,0.127,DISCARD,low_score
66.468,1218,class72,0.598,0.299,DISCARD,low_score
66.468,1218,class69,0.372,0.186,DISCARD,low_score
66.468,1218,class69,0.256,0.128,DISCARD,low_score
66.522,1219,class72,0.83,0.415,DISCARD,low_score
66.522,1219,class69,0.367,0.183,DISCARD,low_score
66.576,1220,class72,0.806,0.403,DISCARD,low_score
66.63,1221,class72,0.424,0.212,DISCARD,low_score
66.63,1221,class69,0.279,0.14,DISCARD,low_score
66.684,1222,class72,0.396,0.198,DISCARD,low_score
66.738,1223,class72,0.299,0.15,DISCARD,low_score
66.843,1225,class72,0.274,0.137,DISCARD,low_score
66.897,1226,class71,0.378,0.189,DISCARD,low_score
66.951,1227,class72,0.453,0.227,DISCARD,low_score
66.951,1227,class71,0.264,0.132,DISCARD,low_score
67.005,1228,class72,0.572,0.286,DISCARD,low_score
67.058,1229,class72,0.646,0.323,DISCARD,low_score
67.112,1230,class72,0.726,0.363,DISCARD,low_score
67.166,1231,class72,0.502,0.251,DISCARD,low_score
67.231,1232,class72,0.676,0.338,DISCARD,low_score
67.286,1233,class72,0.693,0.346,DISCARD,low_score
67.34,1234,class72,0.756,0.378,DISCARD,low_score
67.394,1235,class72,0.835,0.418,DISCARD,low_score
67.449,1236,class72,0.748,0.374,DISCARD,low_score
67.502,1237,class72,0.709,0.355,DISCARD,low_score
67.556,1238,class72,0.587,0.293,DISCARD,low_score
67.61,1239,class72,0.658,0.329,DISCARD,low_score
67.663,1240,class72,0.291,0.145,DISCARD,low_score
67.717,1241,class72,0.521,0.261,DISCARD,low_score
67.771,1242,class72,0.711,0.355,DISCARD,low_score
67.825,1243,class72,0.311,0.155,DISCARD,low_score
67.93,1245,class72,0.635,0.318,DISCARD,low_score
67.984,1246,class72,0.329,0.165,DISCARD,low_score
68.038,1247,class39,0.48,0.24,DISCARD,low_score
68.038,1247,class72,0.376,0.188,DISCARD,low_score
68.092,1248,class72,0.651,0.326,DISCARD,low_score
68.146,1249,class72,0.598,0.299,DISCARD,low_score
68.146,1249,class39,0.257,0.128,DISCARD,low_score
68.2,1250,class72,0.426,0.213,DISCARD,low_score
68.254,1251,class68,0.672,0.336,DISCARD,low_score
68.254,1251,class72,0.488,0.244,DISCARD,low_score
68.254,1251,class39,0.27,0.135,DISCARD,low_score
68.308,1252,class68,0.387,0.193,DISCARD,low_score
68.362,1253,class68,0.808,0.404,DISCARD,low_score
68.362,1253,class39,0.324,0.162,DISCARD,low_score
68.362,1253,class39,0.297,0.149,DISCARD,low_score
68.416,1254,class68,0.465,0.232,DISCARD,low_score
68.416,1254,class39,0.296,0.148,DISCARD,low_score
68.416,1254,class39,0.275,0.138,DISCARD,low_score
68.471,1255,class39,0.34,0.17,DISCARD,low_score
68.732,1260,class39,0.311,0.155,DISCARD,low_score
69.052,1266,class62,0.405,0.203,DISCARD,low_score
69.052,1266,class39,0.289,0.145,DISCARD,low_score
69.466,1274,class59,0.321,0.16,DISCARD,low_score
69.675,1278,class62,0.385,0.192,DISCARD,low_score
69.73,1279,class62,0.611,0.306,DISCARD,low_score
69.783,1280,class62,0.564,0.282,DISCARD,low_score
69.837,1281,class62,0.363,0.181,DISCARD,low_score
69.837,1281,class62,0.356,0.178,DISCARD,low_score
69.891,1282,class62,0.722,0.361,DISCARD,low_score
69.945,1283,class62,0.558,0.279,DISCARD,low_score
69.945,1283,class68,0.252,0.126,DISCARD,low_score
70.0,1284,class62,0.508,0.254,DISCARD,low_score
70.053,1285,class62,0.518,0.259,DISCARD,low_score
70.107,1286,class62,0.455,0.228,DISCARD,low_score
70.107,1286,class39,0.258,0.129,DISCARD,low_score
70.161,1287,class62,0.428,0.214,DISCARD,low_score
70.161,1287,class62,0.387,0.193,DISCARD,low_score
70.215,1288,class62,0.396,0.198,DISCARD,low_score
70.269,1289,class62,0.477,0.238,DISCARD,low_score
70.324,1290,class62,0.294,0.147,DISCARD,low_score
70.378,1291,class62,0.502,0.251,DISCARD,low_score
70.378,1291,class62,0.251,0.125,DISCARD,low_score
70.484,1293,class62,0.4,0.2,DISCARD,low_score
70.484,1293,class72,0.266,0.133,DISCARD,low_score
70.548,1294,class62,0.568,0.284,DISCARD,low_score
70.706,1297,class56,0.508,0.254,DISCARD,low_score
70.706,1297,class68,0.306,0.153,DISCARD,low_score
70.759,1298,class68,0.296,0.148,DISCARD,low_score
70.813,1299,class56,0.331,0.166,DISCARD,low_score
70.813,1299,class62,0.308,0.154,DISCARD,low_score
70.867,1300,class59,0.283,0.141,DISCARD,low_score
70.867,1300,class59,0.27,0.135,DISCARD,low_score
70.921,1301,class56,0.413,0.207,DISCARD,low_score
70.921,1301,class72,0.266,0.133,DISCARD,low_score
70.975,1302,class56,0.327,0.163,DISCARD,low_score
70.975,1302,class72,0.25,0.125,DISCARD,low_score
71.029,1303,class56,0.457,0.229,DISCARD,low_score
71.029,1303,class68,0.4,0.2,DISCARD,low_score
71.083,1304,class56,0.438,0.219,DISCARD,low_score
71.083,1304,class68,0.317,0.159,DISCARD,low_score
71.083,1304,class72,0.291,0.145,DISCARD,low_score
71.137,1305,class56,0.525,0.263,DISCARD,low_score
71.137,1305,class68,0.277,0.138,DISCARD,low_score
71.191,1306,class56,0.583,0.292,DISCARD,low_score
71.245,1307,class56,0.554,0.277,DISCARD,low_score
71.245,1307,class59,0.281,0.141,DISCARD,low_score
71.299,1308,class56,0.381,0.191,DISCARD,low_score
71.354,1309,class56,0.579,0.29,DISCARD,low_score
71.354,1309,class62,0.302,0.151,DISCARD,low_score
71.408,1310,class56,0.434,0.217,DISCARD,low_score
71.408,1310,class72,0.26,0.13,DISCARD,low_score
71.462,1311,class56,0.498,0.249,DISCARD,low_score
71.566,1313,class56,0.33,0.165,DISCARD,low_score
71.62,1314,class56,0.482,0.241,DISCARD,low_score
71.62,1314,class56,0.332,0.166,DISCARD,low_score
71.62,1314,class59,0.268,0.134,DISCARD,low_score
71.72,1315,class62,0.761,0.38,DISCARD,low_score
71.72,1315,class62,0.379,0.19,DISCARD,low_score
71.72,1315,class39,0.312,0.156,DISCARD,low_score
71.72,1315,class39,0.27,0.135,DISCARD,low_score
71.776,1316,class62,0.752,0.376,DISCARD,low_score
71.776,1316,class39,0.251,0.125,DISCARD,low_score
71.83,1317,class62,0.837,0.418,DISCARD,low_score
71.83,1317,class39,0.307,0.154,DISCARD,low_score
71.884,1318,class62,0.83,0.415,DISCARD,low_score
71.884,1318,class39,0.26,0.13,DISCARD,low_score
71.938,1319,class62,0.798,0.399,DISCARD,low_score
71.938,1319,class39,0.331,0.166,DISCARD,low_score
71.938,1319,class62,0.265,0.133,DISCARD,low_score
71.993,1320,class62,0.755,0.377,DISCARD,low_score
72.047,1321,class62,0.712,0.356,DISCARD,low_score
72.047,1321,class39,0.296,0.148,DISCARD,low_score
72.047,1321,class39,0.254,0.127,DISCARD,low_score
72.101,1322,class62,0.72,0.36,DISCARD,low_score
72.101,1322,class39,0.342,0.171,DISCARD,low_score
72.101,1322,class39,0.257,0.128,DISCARD,low_score
72.156,1323,class62,0.742,0.371,DISCARD,low_score
72.156,1323,class62,0.442,0.221,DISCARD,low_score
72.156,1323,class39,0.367,0.183,DISCARD,low_score
72.21,1324,class62,0.777,0.389,DISCARD,low_score
72.21,1324,class39,0.486,0.243,DISCARD,low_score
72.21,1324,class39,0.338,0.169,DISCARD,low_score
72.264,1325,class62,0.804,0.402,DISCARD,low_score
72.264,1325,class39,0.402,0.201,DISCARD,low_score
72.264,1325,class62,0.329,0.165,DISCARD,low_score
72.318,1326,class62,0.65,0.325,DISCARD,low_score
72.318,1326,class62,0.343,0.172,DISCARD,low_score
72.373,1327,class62,0.644,0.322,DISCARD,low_score
72.373,1327,class62,0.257,0.128,DISCARD,low_score
72.427,1328,class62,0.554,0.277,DISCARD,low_score
72.427,1328,class62,0.434,0.217,DISCARD,low_score
72.481,1329,class62,0.461,0.231,DISCARD,low_score
72.535,1330,class62,0.78,0.39,DISCARD,low_score
72.535,1330,class62,0.411,0.206,DISCARD,low_score
72.535,1330,class39,0.283,0.141,DISCARD,low_score
72.589,1331,class62,0.768,0.384,DISCARD,low_score
72.644,1332,class62,0.797,0.398,DISCARD,low_score
72.697,1333,class62,0.698,0.349,DISCARD,low_score
72.697,1333,class39,0.324,0.162,DISCARD,low_score
72.697,1333,class62,0.258,0.129,DISCARD,low_score
72.751,1334,class62,0.776,0.388,DISCARD,low_score
72.751,1334,class45,0.26,0.13,DISCARD,low_score
72.751,1334,class39,0.257,0.128,DISCARD,low_score
72.806,1335,class62,0.653,0.327,DISCARD,low_score
72.806,1335,class62,0.335,0.167,DISCARD,low_score
72.86,1336,class62,0.453,0.227,DISCARD,low_score
72.86,1336,class45,0.302,0.151,DISCARD,low_score
72.86,1336,class39,0.278,0.139,DISCARD,low_score
72.914,1337,class62,0.57,0.285,DISCARD,low_score
72.968,1338,class62,0.482,0.241,DISCARD,low_score
73.022,1339,class62,0.568,0.284,DISCARD,low_score
73.076,1340,class62,0.479,0.239,DISCARD,low_score
73.076,1340,class39,0.326,0.163,DISCARD,low_score
73.13,1341,class62,0.662,0.331,DISCARD,low_score
73.185,1342,class62,0.621,0.31,DISCARD,low_score
73.239,1343,class62,0.521,0.261,DISCARD,low_score
73.293,1344,class62,0.398,0.199,DISCARD,low_score
73.293,1344,class62,0.317,0.159,DISCARD,low_score
73.347,1345,class62,0.471,0.235,DISCARD,low_score
73.347,1345,class39,0.389,0.194,DISCARD,low_score
73.347,1345,class39,0.338,0.169,DISCARD,low_score
73.401,1346,class62,0.523,0.262,DISCARD,low_score
73.401,1346,class39,0.307,0.154,DISCARD,low_score
73.401,1346,class62,0.254,0.127,DISCARD,low_score
73.456,1347,class62,0.688,0.344,DISCARD,low_score
73.456,1347,class62,0.43,0.215,DISCARD,low_score
73.456,1347,class39,0.356,0.178,DISCARD,low_score
73.456,1347,class39,0.352,0.176,DISCARD,low_score
73.51,1348,class62,0.642,0.321,DISCARD,low_score
73.564,1349,class62,0.624,0.312,DISCARD,low_score
73.564,1349,class39,0.255,0.128,DISCARD,low_score
73.619,1350,class62,0.486,0.243,DISCARD,low_score
73.619,1350,class62,0.304,0.152,DISCARD,low_score
73.673,1351,class62,0.398,0.199,DISCARD,low_score
73.727,1352,class62,0.537,0.269,DISCARD,low_score
73.78,1353,class45,0.316,0.158,DISCARD,low_score
73.78,1353,class62,0.285,0.142,DISCARD,low_score
73.834,1354,class62,0.4,0.2,DISCARD,low_score
73.941,1356,class62,0.39,0.195,DISCARD,low_score
73.994,1357,class62,0.404,0.202,DISCARD,low_score
74.05,1358,class62,0.432,0.216,DISCARD,low_score
74.104,1359,class62,0.696,0.348,DISCARD,low_score
74.158,1360,class62,0.523,0.262,DISCARD,low_score
74.212,1361,class62,0.593,0.296,DISCARD,low_score
74.266,1362,class62,0.314,0.157,DISCARD,low_score
74.32,1363,class62,0.56,0.28,DISCARD,low_score
74.374,1364,class62,0.516,0.258,DISCARD,low_score
74.428,1365,class62,0.699,0.35,DISCARD,low_score
74.482,1366,class62,0.681,0.34,DISCARD,low_score
74.535,1367,class62,0.558,0.279,DISCARD,low_score
74.59,1368,class62,0.389,0.194,DISCARD,low_score
74.59,1368,class62,0.251,0.125,DISCARD,low_score
74.643,1369,class62,0.696,0.348,DISCARD,low_score
74.697,1370,class62,0.642,0.321,DISCARD,low_score
74.697,1370,class62,0.356,0.178,DISCARD,low_score
74.751,1371,class62,0.773,0.387,DISCARD,low_score
74.805,1372,class62,0.469,0.234,DISCARD,low_score
74.858,1373,class62,0.4,0.2,DISCARD,low_score
74.912,1374,class62,0.453,0.227,DISCARD,low_score
74.966,1375,class62,0.428,0.214,DISCARD,low_score
75.02,1376,class62,0.417,0.208,DISCARD,low_score
75.074,1377,class62,0.525,0.263,DISCARD,low_score
75.337,1382,class62,0.335,0.167,DISCARD,low_score
75.562,1386,class62,0.324,0.162,DISCARD,low_score
75.67,1388,class2,0.257,0.128,DISCARD,low_score
75.67,1388,class2,0.255,0.128,DISCARD,low_score
75.67,1388,class2,0.251,0.125,DISCARD,low_score
75.724,1389,class56,0.308,0.154,DISCARD,low_score
75.724,1389,class2,0.267,0.134,DISCARD,low_score
75.882,1392,class2,0.428,0.214,DISCARD,low_score
75.882,1392,class2,0.329,0.165,DISCARD,low_score
75.882,1392,class60,0.268,0.134,DISCARD,low_score
75.936,1393,class2,0.4,0.2,DISCARD,low_score
75.936,1393,class2,0.302,0.151,DISCARD,low_score
75.936,1393,class2,0.27,0.135,DISCARD,low_score
75.99,1394,class39,0.516,0.258,DISCARD,low_score
76.045,1395,class39,0.48,0.24,DISCARD,low_score
76.045,1395,class60,0.253,0.127,DISCARD,low_score
76.099,1396,class39,0.521,0.261,DISCARD,low_score
76.099,1396,class62,0.363,0.181,DISCARD,low_score
76.153,1397,class41,0.274,0.137,DISCARD,low_score
76.206,1398,class2,0.319,0.16,DISCARD,low_score
76.26,1399,class45,0.368,0.184,DISCARD,low_score
76.26,1399,class39,0.321,0.16,DISCARD,low_score
76.314,1400,class39,0.402,0.201,DISCARD,low_score
76.314,1400,class45,0.385,0.192,DISCARD,low_score
76.314,1400,class2,0.316,0.158,DISCARD,low_score
76.368,1401,class39,0.415,0.207,DISCARD,low_score
76.368,1401,class2,0.376,0.188,DISCARD,low_score
76.368,1401,class2,0.277,0.138,DISCARD,low_score
76.423,1402,class45,0.423,0.211,DISCARD,low_score
76.423,1402,class39,0.419,0.209,DISCARD,low_score
76.423,1402,class62,0.407,0.204,DISCARD,low_score
76.477,1403,class39,0.577,0.289,DISCARD,low_score
76.477,1403,class62,0.326,0.163,DISCARD,low_score
76.477,1403,class45,0.317,0.159,DISCARD,low_score
76.532,1404,class39,0.63,0.315,DISCARD,low_score
76.532,1404,class45,0.459,0.23,DISCARD,low_score
76.532,1404,class41,0.361,0.181,DISCARD,low_score
76.586,1405,class39,0.484,0.242,DISCARD,low_score
76.586,1405,class62,0.417,0.208,DISCARD,low_score
76.586,1405,class45,0.34,0.17,DISCARD,low_score
76.586,1405,class41,0.333,0.166,DISCARD,low_score
76.64,1406,class39,0.553,0.276,DISCARD,low_score
76.64,1406,class45,0.535,0.268,DISCARD,low_score
76.694,1407,class39,0.52,0.26,DISCARD,low_score
76.694,1407,class45,0.428,0.214,DISCARD,low_score
76.694,1407,class62,0.368,0.184,DISCARD,low_score
76.748,1408,class39,0.533,0.267,DISCARD,low_score
76.748,1408,class45,0.479,0.239,DISCARD,low_score
76.748,1408,class41,0.396,0.198,DISCARD,low_score
76.748,1408,class62,0.345,0.173,DISCARD,low_score
76.803,1409,class45,0.479,0.239,DISCARD,low_score
76.803,1409,class39,0.417,0.208,DISCARD,low_score
76.803,1409,class41,0.411,0.206,DISCARD,low_score
76.857,1410,class39,0.598,0.299,DISCARD,low_score
76.857,1410,class45,0.533,0.267,DISCARD,low_score
76.857,1410,class41,0.461,0.231,DISCARD,low_score
76.857,1410,class62,0.295,0.148,DISCARD,low_score
76.912,1411,class45,0.504,0.252,DISCARD,low_score
76.912,1411,class62,0.471,0.235,DISCARD,low_score
76.912,1411,class39,0.467,0.233,DISCARD,low_score
76.912,1411,class41,0.326,0.163,DISCARD,low_score
76.966,1412,class45,0.479,0.239,DISCARD,low_score
76.966,1412,class39,0.447,0.224,DISCARD,low_score
76.966,1412,class41,0.359,0.18,DISCARD,low_score
77.021,1413,class45,0.574,0.287,DISCARD,low_score
77.021,1413,class39,0.564,0.282,DISCARD,low_score
77.021,1413,class41,0.383,0.192,DISCARD,low_score
77.074,1414,class45,0.646,0.323,DISCARD,low_score
77.074,1414,class39,0.633,0.317,DISCARD,low_score
77.074,1414,class41,0.484,0.242,DISCARD,low_score
77.074,1414,class62,0.256,0.128,DISCARD,low_score
77.129,1415,class45,0.657,0.328,DISCARD,low_score
77.129,1415,class39,0.641,0.32,DISCARD,low_score
77.129,1415,class41,0.453,0.227,DISCARD,low_score
77.129,1415,class62,0.394,0.197,DISCARD,low_score
77.184,1416,class45,0.698,0.349,DISCARD,low_score
77.184,1416,class39,0.665,0.333,DISCARD,low_score
77.184,1416,class41,0.44,0.22,DISCARD,low_score
77.238,1417,class45,0.701,0.35,DISCARD,low_score
77.238,1417,class39,0.615,0.308,DISCARD,low_score
77.238,1417,class77,0.447,0.224,DISCARD,low_score
77.238,1417,class41,0.278,0.139,DISCARD,low_score
77.238,1417,class62,0.272,0.136,DISCARD,low_score
77.293,1418,class45,0.657,0.328,DISCARD,low_score
77.293,1418,class39,0.61,0.305,DISCARD,low_score
77.293,1418,class62,0.572,0.286,DISCARD,low_score
77.293,1418,class41,0.417,0.208,DISCARD,low_score
77.347,1419,class39,0.655,0.327,DISCARD,low_score
77.347,1419,class45,0.604,0.302,DISCARD,low_score
77.347,1419,class41,0.428,0.214,DISCARD,low_score
77.347,1419,class62,0.31,0.155,DISCARD,low_score
77.402,1420,class45,0.644,0.322,DISCARD,low_score
77.402,1420,class39,0.617,0.308,DISCARD,low_score
77.402,1420,class41,0.39,0.195,DISCARD,low_score
77.402,1420,class62,0.387,0.193,DISCARD,low_score
77.457,1421,class45,0.722,0.361,DISCARD,low_score
77.457,1421,class41,0.525,0.263,DISCARD,low_score
77.457,1421,class39,0.52,0.26,DISCARD,low_score
77.457,1421,class62,0.269,0.134,DISCARD,low_score
77.511,1422,class45,0.715,0.358,DISCARD,low_score
77.511,1422,class62,0.577,0.289,DISCARD,low_score
77.511,1422,class41,0.482,0.241,DISCARD,low_score
77.511,1422,class39,0.43,0.215,DISCARD,low_score
77.565,1423,class62,0.736,0.368,DISCARD,low_score
77.565,1423,class45,0.672,0.336,DISCARD,low_score
77.565,1423,class39,0.498,0.249,DISCARD,low_score
77.565,1423,class77,0.365,0.182,DISCARD,low_score
77.62,1424,class39,0.686,0.343,DISCARD,low_score
77.62,1424,class62,0.635,0.318,DISCARD,low_score
77.62,1424,class45,0.632,0.316,DISCARD,low_score
77.62,1424,class77,0.417,0.208,DISCARD,low_score
77.675,1425,class45,0.711,0.355,DISCARD,low_score
77.675,1425,class41,0.512,0.256,DISCARD,low_score
77.675,1425,class39,0.432,0.216,DISCARD,low_score
77.675,1425,class62,0.326,0.163,DISCARD,low_score
77.675,1425,class77,0.323,0.161,DISCARD,low_score
77.729,1426,class45,0.63,0.315,DISCARD,low_score
77.729,1426,class39,0.619,0.309,DISCARD,low_score
77.729,1426,class39,0.514,0.257,DISCARD,low_score
77.729,1426,class77,0.5,0.25,DISCARD,low_score
77.729,1426,class41,0.488,0.244,DISCARD,low_score
77.729,1426,class62,0.308,0.154,DISCARD,low_score
77.784,1427,class45,0.683,0.341,DISCARD,low_score
77.784,1427,class39,0.679,0.34,DISCARD,low_score
77.784,1427,class41,0.484,0.242,DISCARD,low_score
77.839,1428,class45,0.689,0.345,DISCARD,low_score
77.839,1428,class39,0.336,0.168,DISCARD,low_score
77.839,1428,class41,0.286,0.143,DISCARD,low_score
77.893,1429,class45,0.743,0.372,DISCARD,low_score
77.893,1429,class41,0.484,0.242,DISCARD,low_score
77.893,1429,class39,0.35,0.175,DISCARD,low_score
77.947,1430,class45,0.714,0.357,DISCARD,low_score
77.947,1430,class39,0.417,0.208,DISCARD,low_score
77.947,1430,class41,0.354,0.177,DISCARD,low_score
77.947,1430,class45,0.281,0.141,DISCARD,low_score
77.947,1430,class62,0.277,0.138,DISCARD,low_score
78.002,1431,class45,0.657,0.328,DISCARD,low_score
78.002,1431,class39,0.596,0.298,DISCARD,low_score
78.002,1431,class77,0.365,0.182,DISCARD,low_score
78.002,1431,class41,0.359,0.18,DISCARD,low_score
78.002,1431,class45,0.317,0.159,DISCARD,low_score
78.002,1431,class62,0.258,0.129,DISCARD,low_score
78.002,1431,class45,0.255,0.128,DISCARD,low_score
78.057,1432,class45,0.709,0.355,DISCARD,low_score
78.057,1432,class39,0.672,0.336,DISCARD,low_score
78.057,1432,class45,0.434,0.217,DISCARD,low_score
78.057,1432,class41,0.272,0.136,DISCARD,low_score
78.057,1432,class39,0.267,0.134,DISCARD,low_score
78.057,1432,class77,0.258,0.129,DISCARD,low_score
78.111,1433,class45,0.684,0.342,DISCARD,low_score
78.111,1433,class39,0.585,0.293,DISCARD,low_score
78.111,1433,class45,0.424,0.212,DISCARD,low_score
78.111,1433,class41,0.356,0.178,DISCARD,low_score
78.111,1433,class69,0.331,0.166,DISCARD,low_score
78.111,1433,class45,0.316,0.158,DISCARD,low_score
78.166,1434,class45,0.779,0.389,DISCARD,low_score
78.166,1434,class39,0.639,0.319,DISCARD,low_score
78.166,1434,class45,0.482,0.241,DISCARD,low_score
78.166,1434,class41,0.376,0.188,DISCARD,low_score
78.221,1435,class45,0.739,0.369,DISCARD,low_score
78.221,1435,class39,0.684,0.342,DISCARD,low_score
78.221,1435,class45,0.533,0.267,DISCARD,low_score
78.221,1435,class41,0.291,0.145,DISCARD,low_score
78.275,1436,class45,0.635,0.318,DISCARD,low_score
78.275,1436,class39,0.617,0.308,DISCARD,low_score
78.275,1436,class45,0.48,0.24,DISCARD,low_score
78.275,1436,class41,0.372,0.186,DISCARD,low_score
78.275,1436,class45,0.354,0.177,DISCARD,low_score
78.275,1436,class77,0.272,0.136,DISCARD,low_score
78.33,1437,class45,0.577,0.289,DISCARD,low_score
78.33,1437,class39,0.496,0.248,DISCARD,low_score
78.33,1437,class41,0.48,0.24,DISCARD,low_score
78.33,1437,class45,0.264,0.132,DISCARD,low_score
78.385,1438,class45,0.633,0.317,DISCARD,low_score
78.385,1438,class45,0.436,0.218,DISCARD,low_score
78.385,1438,class39,0.39,0.195,DISCARD,low_score
78.385,1438,class41,0.381,0.191,DISCARD,low_score
78.385,1438,class45,0.374,0.187,DISCARD,low_score
78.385,1438,class45,0.264,0.132,DISCARD,low_score
78.44,1439,class45,0.635,0.318,DISCARD,low_score
78.44,1439,class39,0.576,0.288,DISCARD,low_score
78.44,1439,class45,0.502,0.251,DISCARD,low_score
78.494,1440,class45,0.642,0.321,DISCARD,low_score
78.494,1440,class39,0.633,0.317,DISCARD,low_score
78.494,1440,class45,0.438,0.219,DISCARD,low_score
78.494,1440,class41,0.314,0.157,DISCARD,low_score
78.494,1440,class45,0.274,0.137,DISCARD,low_score
78.549,1441,class39,0.679,0.34,DISCARD,low_score
78.549,1441,class45,0.455,0.228,DISCARD,low_score
78.549,1441,class45,0.329,0.165,DISCARD,low_score
78.603,1442,class39,0.646,0.323,DISCARD,low_score
