t,frame,name,conf,score,decision,reason
37.126,816,class26,0.438,0.219,DISCARD,low_score
37.126,816,class45,0.254,0.127,DISCARD,low_score
37.211,818,class56,0.893,0.446,KEEP,priority+bandwidth_ok
37.211,818,class26,0.585,0.293,DISCARD,low_score
37.211,818,class56,0.467,0.233,DISCARD,low_score
37.297,820,class56,0.833,0.417,KEEP,priority+bandwidth_ok
37.297,820,class56,0.585,0.293,DISCARD,low_score
37.297,820,class26,0.547,0.273,DISCARD,low_score
37.297,820,class28,0.521,0.261,DISCARD,low_score
37.297,820,class45,0.252,0.126,DISCARD,low_score
37.382,822,class56,0.781,0.391,KEEP,priority+bandwidth_ok
37.382,822,class28,0.662,0.331,DISCARD,low_score
37.382,822,class56,0.585,0.293,DISCARD,low_score
37.466,824,class56,0.803,0.402,KEEP,priority+bandwidth_ok
37.466,824,class28,0.667,0.334,DISCARD,low_score
37.466,824,class72,0.359,0.18,DISCARD,low_score
37.466,824,class60,0.334,0.167,DISCARD,low_score
37.466,824,class56,0.285,0.143,DISCARD,low_score
37.55,826,class56,0.743,0.372,KEEP,priority+bandwidth_ok
37.55,826,class28,0.523,0.262,DISCARD,low_score
37.55,826,class26,0.469,0.234,DISCARD,low_score
37.55,826,class72,0.404,0.202,DISCARD,low_score
37.634,828,class56,0.686,0.343,DISCARD,low_score
37.634,828,class28,0.684,0.342,DISCARD,low_score
37.634,828,class26,0.469,0.234,DISCARD,low_score
37.634,828,class45,0.409,0.205,DISCARD,low_score
37.634,828,class72,0.328,0.164,DISCARD,low_score
37.719,830,class28,0.734,0.367,KEEP,priority+bandwidth_ok
37.719,830,class56,0.43,0.215,DISCARD,low_score
37.719,830,class72,0.306,0.153,DISCARD,low_score
37.803,832,class28,0.686,0.343,DISCARD,low_score
37.803,832,class72,0.549,0.274,DISCARD,low_score
37.887,834,class56,0.516,0.258,DISCARD,low_score
37.887,834,class26,0.506,0.253,DISCARD,low_score
37.887,834,class28,0.444,0.222,DISCARD,low_score
37.971,836,class56,0.644,0.322,DISCARD,low_score
37.971,836,class28,0.633,0.317,DISCARD,low_score
38.057,838,class56,0.838,0.419,KEEP,priority+bandwidth_ok
38.057,838,class26,0.465,0.232,DISCARD,low_score
38.057,838,class60,0.402,0.201,DISCARD,low_score
38.057,838,class28,0.262,0.131,DISCARD,low_score
38.141,840,class56,0.877,0.438,KEEP,priority+bandwidth_ok
38.141,840,class28,0.622,0.311,DISCARD,low_score
38.225,842,class56,0.897,0.448,KEEP,priority+bandwidth_ok
38.225,842,class28,0.269,0.134,DISCARD,low_score
38.311,844,class56,0.901,0.451,KEEP,priority+bandwidth_ok
38.311,844,class56,0.37,0.185,DISCARD,low_score
38.311,844,class26,0.324,0.162,DISCARD,low_score
38.311,844,class56,0.319,0.16,DISCARD,low_score
38.396,846,class56,0.908,0.454,KEEP,priority+bandwidth_ok
38.396,846,class26,0.502,0.251,DISCARD,low_score
38.396,846,class0,0.439,0.219,DISCARD,low_score
38.396,846,class56,0.273,0.136,DISCARD,low_score
38.396,846,class28,0.26,0.13,DISCARD,low_score
38.48,848,class56,0.871,0.435,KEEP,priority+bandwidth_ok
38.48,848,class28,0.516,0.258,DISCARD,low_score
38.564,850,class56,0.818,0.409,KEEP,priority+bandwidth_ok
38.651,852,class56,0.595,0.297,DISCARD,low_score
38.735,854,class56,0.789,0.395,KEEP,priority+bandwidth_ok
38.735,854,class56,0.284,0.142,DISCARD,low_score
38.819,856,class56,0.784,0.392,KEEP,priority+bandwidth_ok
38.903,858,class56,0.453,0.227,DISCARD,low_score
38.987,860,class56,0.381,0.191,DISCARD,low_score
39.154,864,class62,0.277,0.138,DISCARD,low_score
39.238,866,class71,0.314,0.157,DISCARD,low_score
39.238,866,class58,0.307,0.154,DISCARD,low_score
39.322,868,class56,0.271,0.136,DISCARD,low_score
39.408,870,class56,0.398,0.199,DISCARD,low_score
39.574,874,class71,0.323,0.161,DISCARD,low_score
39.992,884,class0,0.639,0.319,DISCARD,low_score
40.159,888,class61,0.333,0.166,DISCARD,low_score
40.244,890,class72,0.428,0.214,DISCARD,low_score
40.244,890,class72,0.299,0.15,DISCARD,low_score
40.508,896,class72,0.451,0.226,DISCARD,low_score
40.593,898,class61,0.396,0.198,DISCARD,low_score
40.678,900,class61,0.683,0.341,DISCARD,low_score
40.762,902,class61,0.529,0.265,DISCARD,low_score
40.847,904,class61,0.539,0.269,DISCARD,low_score
40.932,906,class0,0.582,0.291,DISCARD,low_score
41.433,918,class73,0.639,0.319,DISCARD,low_score
41.433,918,class41,0.385,0.192,DISCARD,low_score
41.518,920,class41,0.317,0.159,DISCARD,low_score
41.518,920,class60,0.265,0.133,DISCARD,low_score
41.605,922,class41,0.77,0.385,KEEP,priority+bandwidth_ok
41.605,922,class60,0.414,0.207,DISCARD,low_score
41.605,922,class67,0.28,0.14,DISCARD,low_score
41.691,924,class41,0.479,0.239,DISCARD,low_score
41.776,926,class41,0.553,0.276,DISCARD,low_score
41.86,928,class41,0.385,0.192,DISCARD,low_score
41.86,928,class60,0.272,0.136,DISCARD,low_score
41.945,930,class41,0.527,0.264,DISCARD,low_score
41.945,930,class73,0.409,0.205,DISCARD,low_score
41.945,930,class41,0.286,0.143,DISCARD,low_score
42.029,932,class73,0.402,0.201,DISCARD,low_score
42.029,932,class56,0.329,0.164,DISCARD,low_score
42.113,934,class73,0.394,0.197,DISCARD,low_score
42.113,934,class41,0.374,0.187,DISCARD,low_score
42.113,934,class56,0.323,0.162,DISCARD,low_score
42.198,936,class41,0.508,0.254,DISCARD,low_score
42.198,936,class41,0.447,0.224,DISCARD,low_score
42.198,936,class73,0.368,0.184,DISCARD,low_score
42.198,936,class73,0.277,0.138,DISCARD,low_score
42.288,938,class41,0.701,0.35,KEEP,priority+bandwidth_ok
42.288,938,class56,0.595,0.297,DISCARD,low_score
42.288,938,class73,0.504,0.252,DISCARD,low_score
42.288,938,class71,0.5,0.25,DISCARD,low_score
42.288,938,class41,0.409,0.205,DISCARD,low_score
42.373,940,class71,0.671,0.335,DISCARD,low_score
42.373,940,class39,0.545,0.272,DISCARD,low_score
42.373,940,class41,0.545,0.272,DISCARD,low_score
42.373,940,class73,0.446,0.223,DISCARD,low_score
42.373,940,class73,0.338,0.169,DISCARD,low_score
42.373,940,class39,0.321,0.16,DISCARD,low_score
42.458,942,class73,0.615,0.308,DISCARD,low_score
42.458,942,class71,0.349,0.174,DISCARD,low_score
42.458,942,class39,0.349,0.174,DISCARD,low_score
42.458,942,class71,0.331,0.166,DISCARD,low_score
42.458,942,class39,0.28,0.14,DISCARD,low_score
42.543,944,class71,0.671,0.335,DISCARD,low_score
42.543,944,class39,0.484,0.242,DISCARD,low_score
42.543,944,class56,0.469,0.234,DISCARD,low_score
42.543,944,class56,0.42,0.21,DISCARD,low_score
42.543,944,class73,0.372,0.186,DISCARD,low_score
42.543,944,class73,0.297,0.148,DISCARD,low_score
42.631,946,class71,0.734,0.367,KEEP,priority+bandwidth_ok
42.715,948,class71,0.558,0.279,DISCARD,low_score
42.715,948,class73,0.461,0.231,DISCARD,low_score
42.715,948,class41,0.423,0.211,DISCARD,low_score
42.715,948,class39,0.404,0.202,DISCARD,low_score
42.715,948,class41,0.361,0.181,DISCARD,low_score
42.715,948,class71,0.345,0.173,DISCARD,low_score
42.715,948,class39,0.283,0.141,DISCARD,low_score
42.8,950,class73,0.396,0.198,DISCARD,low_score
42.8,950,class39,0.306,0.153,DISCARD,low_score
42.8,950,class41,0.302,0.151,DISCARD,low_score
42.971,954,class41,0.34,0.17,DISCARD,low_score
42.971,954,class56,0.327,0.163,DISCARD,low_score
43.056,956,class41,0.392,0.196,DISCARD,low_score
43.056,956,class56,0.347,0.173,DISCARD,low_score
43.056,956,class56,0.342,0.171,DISCARD,low_score
43.056,956,class60,0.316,0.158,DISCARD,low_score
43.056,956,class73,0.294,0.147,DISCARD,low_score
43.141,958,class56,0.843,0.421,KEEP,priority+bandwidth_ok
43.141,958,class60,0.404,0.202,DISCARD,low_score
43.141,958,class41,0.347,0.173,DISCARD,low_score
43.141,958,class73,0.336,0.168,DISCARD,low_score
43.141,958,class73,0.301,0.15,DISCARD,low_score
43.141,958,class73,0.28,0.14,DISCARD,low_score
43.232,960,class56,0.912,0.456,DISCARD,bandwidth
43.232,960,class41,0.624,0.312,DISCARD,low_score
43.232,960,class60,0.521,0.261,DISCARD,low_score
43.316,962,class56,0.82,0.41,DISCARD,bandwidth
43.316,962,class41,0.66,0.33,DISCARD,low_score
43.316,962,class60,0.42,0.21,DISCARD,low_score
43.401,964,class56,0.823,0.412,DISCARD,bandwidth
43.401,964,class60,0.612,0.306,DISCARD,low_score
43.401,964,class45,0.269,0.134,DISCARD,low_score
43.49,966,class56,0.901,0.45,DISCARD,bandwidth
43.49,966,class60,0.697,0.348,DISCARD,low_score
43.49,966,class41,0.492,0.246,DISCARD,low_score
43.574,968,class56,0.911,0.455,DISCARD,bandwidth
43.574,968,class60,0.736,0.368,DISCARD,bandwidth
43.574,968,class41,0.667,0.334,DISCARD,low_score
43.574,968,class41,0.43,0.215,DISCARD,low_score
43.659,970,class56,0.742,0.371,DISCARD,bandwidth
43.659,970,class60,0.537,0.269,DISCARD,low_score
43.659,970,class41,0.335,0.167,DISCARD,low_score
43.745,972,class56,0.822,0.411,DISCARD,bandwidth
43.745,972,class60,0.602,0.301,DISCARD,low_score
43.83,974,class56,0.838,0.419,DISCARD,bandwidth
43.83,974,class60,0.511,0.255,DISCARD,low_score
43.83,974,class41,0.275,0.138,DISCARD,low_score
43.83,974,class56,0.254,0.127,DISCARD,low_score
43.914,976,class56,0.863,0.432,DISCARD,bandwidth
43.914,976,class60,0.539,0.269,DISCARD,low_score
43.914,976,class41,0.535,0.268,DISCARD,low_score
43.914,976,class60,0.31,0.155,DISCARD,low_score
43.999,978,class56,0.698,0.349,DISCARD,low_score
43.999,978,class60,0.54,0.27,DISCARD,low_score
44.087,980,class56,0.329,0.165,DISCARD,low_score
44.172,982,class60,0.439,0.219,DISCARD,low_score
44.172,982,class56,0.412,0.206,DISCARD,low_score
44.172,982,class56,0.388,0.194,DISCARD,low_score
44.257,984,class56,0.539,0.269,DISCARD,low_score
44.257,984,class59,0.497,0.249,DISCARD,low_score
44.257,984,class56,0.48,0.24,DISCARD,low_score
44.257,984,class60,0.293,0.146,DISCARD,low_score
44.342,986,class59,0.642,0.321,DISCARD,low_score
44.342,986,class56,0.543,0.271,DISCARD,low_score
44.342,986,class60,0.285,0.142,DISCARD,low_score
44.427,988,class56,0.577,0.289,DISCARD,low_score
44.427,988,class56,0.4,0.2,DISCARD,low_score
44.427,988,class60,0.34,0.17,DISCARD,low_score
44.427,988,class73,0.255,0.128,DISCARD,low_score
44.514,990,class56,0.803,0.402,DISCARD,bandwidth
44.514,990,class60,0.556,0.278,DISCARD,low_score
44.514,990,class73,0.442,0.221,DISCARD,low_score
44.514,990,class56,0.267,0.133,DISCARD,low_score
44.599,992,class59,0.434,0.217,DISCARD,low_score
44.599,992,class56,0.43,0.215,DISCARD,low_score
44.599,992,class73,0.378,0.189,DISCARD,low_score
44.599,992,class73,0.266,0.133,DISCARD,low_score
44.686,994,class73,0.312,0.156,DISCARD,low_score
44.686,994,class59,0.291,0.145,DISCARD,low_score
44.686,994,class73,0.285,0.142,DISCARD,low_score
44.774,996,class73,0.323,0.161,DISCARD,low_score
44.774,996,class59,0.27,0.135,DISCARD,low_score
44.859,998,class73,0.342,0.171,DISCARD,low_score
44.859,998,class73,0.335,0.167,DISCARD,low_score
44.943,1000,class73,0.469,0.234,DISCARD,low_score
45.028,1002,class73,0.52,0.26,DISCARD,low_score
45.114,1004,class73,0.525,0.263,DISCARD,low_score
45.114,1004,class59,0.404,0.202,DISCARD,low_score
45.2,1006,class73,0.504,0.252,DISCARD,low_score
45.2,1006,class73,0.419,0.209,DISCARD,low_score
45.2,1006,class72,0.367,0.183,DISCARD,low_score
45.2,1006,class73,0.324,0.162,DISCARD,low_score
45.2,1006,class59,0.271,0.136,DISCARD,low_score
45.285,1008,class71,0.455,0.228,DISCARD,low_score
45.285,1008,class73,0.389,0.194,DISCARD,low_score
45.285,1008,class72,0.37,0.185,DISCARD,low_score
45.285,1008,class73,0.266,0.133,DISCARD,low_score
45.38,1010,class71,0.832,0.416,DISCARD,bandwidth
45.38,1010,class72,0.383,0.192,DISCARD,low_score
45.38,1010,class73,0.331,0.166,DISCARD,low_score
45.38,1010,class73,0.329,0.165,DISCARD,low_score
45.38,1010,class73,0.278,0.139,DISCARD,low_score
45.466,1012,class71,0.793,0.397,DISCARD,bandwidth
45.466,1012,class72,0.554,0.277,DISCARD,low_score
45.466,1012,class73,0.479,0.239,DISCARD,low_score
45.466,1012,class72,0.294,0.147,DISCARD,low_score
45.466,1012,class39,0.278,0.139,DISCARD,low_score
45.466,1012,class73,0.266,0.133,DISCARD,low_score
45.552,1014,class71,0.812,0.406,DISCARD,bandwidth
45.552,1014,class39,0.646,0.323,DISCARD,low_score
45.552,1014,class73,0.48,0.24,DISCARD,low_score
45.552,1014,class73,0.267,0.134,DISCARD,low_score
45.552,1014,class69,0.254,0.127,DISCARD,low_score
45.637,1016,class71,0.819,0.409,DISCARD,bandwidth
45.637,1016,class39,0.751,0.375,DISCARD,bandwidth
45.637,1016,class73,0.288,0.144,DISCARD,low_score
45.637,1016,class73,0.275,0.138,DISCARD,low_score
45.637,1016,class69,0.255,0.128,DISCARD,low_score
45.722,1018,class71,0.846,0.423,DISCARD,bandwidth
45.722,1018,class39,0.63,0.315,DISCARD,low_score
45.722,1018,class69,0.365,0.182,DISCARD,low_score
45.722,1018,class73,0.286,0.143,DISCARD,low_score
45.722,1018,class72,0.285,0.142,DISCARD,low_score
45.807,1020,class71,0.763,0.382,DISCARD,bandwidth
45.807,1020,class39,0.473,0.236,DISCARD,low_score
45.807,1020,class69,0.389,0.194,DISCARD,low_score
45.895,1022,class71,0.772,0.386,DISCARD,bandwidth
45.981,1024,class71,0.816,0.408,DISCARD,bandwidth
45.981,1024,class39,0.583,0.292,DISCARD,low_score
45.981,1024,class39,0.417,0.208,DISCARD,low_score
46.067,1026,class71,0.775,0.387,DISCARD,bandwidth
46.067,1026,class39,0.333,0.166,DISCARD,low_score
46.152,1028,class71,0.831,0.416,DISCARD,bandwidth
46.152,1028,class39,0.525,0.263,DISCARD,low_score
46.152,1028,class56,0.482,0.241,DISCARD,low_score
46.237,1030,class71,0.809,0.405,DISCARD,bandwidth
46.237,1030,class56,0.479,0.239,DISCARD,low_score
46.237,1030,class39,0.378,0.189,DISCARD,low_score
46.322,1032,class71,0.862,0.431,DISCARD,bandwidth
46.322,1032,class2,0.541,0.27,DISCARD,low_score
46.322,1032,class39,0.383,0.192,DISCARD,low_score
46.322,1032,class2,0.301,0.15,DISCARD,low_score
46.407,1034,class71,0.853,0.426,DISCARD,bandwidth
46.407,1034,class39,0.367,0.183,DISCARD,low_score
46.492,1036,class71,0.905,0.452,DISCARD,bandwidth
46.577,1038,class71,0.852,0.426,DISCARD,bandwidth
46.662,1040,class71,0.621,0.31,DISCARD,low_score
46.662,1040,class71,0.447,0.224,DISCARD,low_score
46.747,1042,class71,0.644,0.322,DISCARD,low_score
46.747,1042,class72,0.572,0.286,DISCARD,low_score
46.747,1042,class71,0.291,0.145,DISCARD,low_score
46.832,1044,class72,0.796,0.398,DISCARD,bandwidth
46.832,1044,class71,0.473,0.236,DISCARD,low_score
46.832,1044,class71,0.329,0.165,DISCARD,low_score
46.832,1044,class72,0.326,0.163,DISCARD,low_score
46.921,1046,class72,0.807,0.403,DISCARD,bandwidth
46.921,1046,class71,0.615,0.308,DISCARD,low_score
46.921,1046,class69,0.274,0.137,DISCARD,low_score
47.008,1048,class71,0.866,0.433,DISCARD,bandwidth
47.008,1048,class72,0.787,0.393,DISCARD,bandwidth
47.093,1050,class71,0.858,0.429,DISCARD,bandwidth
47.093,1050,class72,0.83,0.415,DISCARD,bandwidth
47.179,1052,class71,0.707,0.354,DISCARD,bandwidth
47.179,1052,class72,0.644,0.322,DISCARD,low_score
47.263,1054,class72,0.742,0.371,DISCARD,bandwidth
47.347,1056,class72,0.769,0.385,DISCARD,bandwidth
47.347,1056,class56,0.359,0.18,DISCARD,low_score
47.347,1056,class71,0.252,0.126,DISCARD,low_score
47.432,1058,class72,0.785,0.393,DISCARD,bandwidth
47.432,1058,class71,0.34,0.17,DISCARD,low_score
47.432,1058,class71,0.336,0.168,DISCARD,low_score
47.52,1060,class72,0.72,0.36,DISCARD,bandwidth
47.52,1060,class68,0.496,0.248,DISCARD,low_score
47.52,1060,class56,0.342,0.171,DISCARD,low_score
47.52,1060,class39,0.274,0.137,DISCARD,low_score
47.606,1062,class72,0.624,0.312,DISCARD,low_score
47.606,1062,class68,0.326,0.163,DISCARD,low_score
47.606,1062,class39,0.277,0.138,DISCARD,low_score
47.691,1064,class72,0.862,0.431,DISCARD,bandwidth
47.691,1064,class56,0.549,0.274,DISCARD,low_score
47.776,1066,class72,0.84,0.42,DISCARD,bandwidth
47.776,1066,class45,0.328,0.164,DISCARD,low_score
47.776,1066,class71,0.299,0.15,DISCARD,low_score
47.776,1066,class68,0.285,0.142,DISCARD,low_score
47.861,1068,class72,0.83,0.415,DISCARD,bandwidth
47.861,1068,class68,0.338,0.169,DISCARD,low_score
47.861,1068,class71,0.324,0.162,DISCARD,low_score
47.946,1070,class72,0.854,0.427,DISCARD,bandwidth
47.946,1070,class68,0.52,0.26,DISCARD,low_score
47.946,1070,class71,0.409,0.205,DISCARD,low_score
47.946,1070,class39,0.309,0.155,DISCARD,low_score
48.031,1072,class72,0.871,0.436,DISCARD,bandwidth
48.031,1072,class68,0.51,0.255,DISCARD,low_score
48.031,1072,class39,0.484,0.242,DISCARD,low_score
48.123,1074,class72,0.753,0.377,DISCARD,bandwidth
48.123,1074,class71,0.473,0.236,DISCARD,low_score
48.123,1074,class39,0.449,0.225,DISCARD,low_score
48.123,1074,class68,0.356,0.178,DISCARD,low_score
48.123,1074,class39,0.328,0.164,DISCARD,low_score
48.209,1076,class72,0.731,0.366,DISCARD,bandwidth
48.209,1076,class71,0.5,0.25,DISCARD,low_score
48.209,1076,class39,0.479,0.239,DISCARD,low_score
48.209,1076,class68,0.372,0.186,DISCARD,low_score
48.294,1078,class72,0.766,0.383,DISCARD,bandwidth
48.294,1078,class68,0.642,0.321,DISCARD,low_score
48.378,1080,class72,0.858,0.429,DISCARD,bandwidth
48.378,1080,class68,0.508,0.254,DISCARD,low_score
48.378,1080,class39,0.316,0.158,DISCARD,low_score
48.378,1080,class71,0.263,0.131,DISCARD,low_score
48.465,1082,class72,0.886,0.443,DISCARD,bandwidth
48.465,1082,class39,0.376,0.188,DISCARD,low_score
48.465,1082,class70,0.338,0.169,DISCARD,low_score
48.465,1082,class68,0.321,0.16,DISCARD,low_score
48.549,1084,class72,0.931,0.465,DISCARD,bandwidth
48.549,1084,class68,0.589,0.294,DISCARD,low_score
48.549,1084,class39,0.541,0.27,DISCARD,low_score
48.549,1084,class39,0.289,0.145,DISCARD,low_score
48.634,1086,class72,0.859,0.429,DISCARD,bandwidth
48.634,1086,class68,0.471,0.235,DISCARD,low_score
48.721,1088,class72,0.903,0.451,DISCARD,bandwidth
48.721,1088,class70,0.525,0.263,DISCARD,low_score
48.721,1088,class39,0.475,0.237,DISCARD,low_score
48.721,1088,class39,0.383,0.192,DISCARD,low_score
48.721,1088,class68,0.338,0.169,DISCARD,low_score
48.721,1088,class39,0.278,0.139,DISCARD,low_score
48.807,1090,class72,0.929,0.464,DISCARD,bandwidth
48.807,1090,class68,0.568,0.284,DISCARD,low_score
48.807,1090,class39,0.419,0.209,DISCARD,low_score
48.807,1090,class45,0.374,0.187,DISCARD,low_score
48.807,1090,class69,0.311,0.155,DISCARD,low_score
48.892,1092,class72,0.749,0.375,DISCARD,bandwidth
48.892,1092,class70,0.44,0.22,DISCARD,low_score
48.892,1092,class39,0.415,0.207,DISCARD,low_score
48.892,1092,class39,0.376,0.188,DISCARD,low_score
48.892,1092,class68,0.321,0.16,DISCARD,low_score
48.892,1092,class70,0.302,0.151,DISCARD,low_score
48.892,1092,class69,0.292,0.146,DISCARD,low_score
48.977,1094,class72,0.848,0.424,DISCARD,bandwidth
48.977,1094,class39,0.512,0.256,DISCARD,low_score
48.977,1094,class69,0.482,0.241,DISCARD,low_score
48.977,1094,class39,0.367,0.183,DISCARD,low_score
48.977,1094,class70,0.299,0.15,DISCARD,low_score
48.977,1094,class39,0.291,0.145,DISCARD,low_score
48.977,1094,class68,0.288,0.144,DISCARD,low_score
48.977,1094,class45,0.254,0.127,DISCARD,low_score
49.066,1096,class69,0.742,0.371,DISCARD,bandwidth
49.066,1096,class70,0.679,0.34,DISCARD,low_score
49.066,1096,class39,0.554,0.277,DISCARD,low_score
49.066,1096,class39,0.356,0.178,DISCARD,low_score
49.066,1096,class39,0.323,0.161,DISCARD,low_score
49.066,1096,class70,0.317,0.159,DISCARD,low_score
49.066,1096,class39,0.283,0.141,DISCARD,low_score
49.066,1096,class39,0.281,0.141,DISCARD,low_score
49.066,1096,class72,0.28,0.14,DISCARD,low_score
49.154,1098,class69,0.736,0.368,DISCARD,bandwidth
49.154,1098,class70,0.674,0.337,DISCARD,low_score
49.154,1098,class39,0.545,0.272,DISCARD,low_score
49.154,1098,class39,0.372,0.186,DISCARD,low_score
49.154,1098,class68,0.314,0.157,DISCARD,low_score
49.154,1098,class39,0.257,0.128,DISCARD,low_score
49.239,1100,class70,0.701,0.35,DISCARD,bandwidth
49.239,1100,class69,0.615,0.308,DISCARD,low_score
49.239,1100,class39,0.514,0.257,DISCARD,low_score
49.239,1100,class39,0.335,0.167,DISCARD,low_score
49.239,1100,class39,0.296,0.148,DISCARD,low_score
49.239,1100,class39,0.254,0.127,DISCARD,low_score
49.327,1102,class70,0.715,0.358,DISCARD,bandwidth
49.327,1102,class69,0.696,0.348,DISCARD,low_score
49.327,1102,class39,0.446,0.223,DISCARD,low_score
49.327,1102,class39,0.442,0.221,DISCARD,low_score
49.327,1102,class70,0.428,0.214,DISCARD,low_score
49.327,1102,class39,0.324,0.162,DISCARD,low_score
49.327,1102,class68,0.255,0.128,DISCARD,low_score
49.411,1104,class69,0.809,0.405,DISCARD,bandwidth
49.411,1104,class70,0.611,0.306,DISCARD,low_score
49.411,1104,class39,0.449,0.225,DISCARD,low_score
49.411,1104,class39,0.293,0.146,DISCARD,low_score
49.496,1106,class69,0.813,0.406,DISCARD,bandwidth
49.496,1106,class70,0.637,0.319,DISCARD,low_score
49.496,1106,class39,0.376,0.188,DISCARD,low_score
49.496,1106,class39,0.261,0.131,DISCARD,low_score
49.581,1108,class69,0.639,0.319,DISCARD,low_score
49.581,1108,class70,0.52,0.26,DISCARD,low_score
49.581,1108,class39,0.319,0.16,DISCARD,low_score
49.581,1108,class39,0.309,0.155,DISCARD,low_score
49.665,1110,class39,0.502,0.251,DISCARD,low_score
49.665,1110,class69,0.426,0.213,DISCARD,low_score
49.752,1112,class69,0.484,0.242,DISCARD,low_score
49.752,1112,class45,0.394,0.197,DISCARD,low_score
49.84,1114,class69,0.488,0.244,DISCARD,low_score
49.84,1114,class45,0.449,0.225,DISCARD,low_score
49.84,1114,class71,0.301,0.15,DISCARD,low_score
49.926,1116,class45,0.347,0.173,DISCARD,low_score
50.011,1118,class45,0.321,0.16,DISCARD,low_score
50.178,1122,class2,0.277,0.138,DISCARD,low_score
50.43,1128,class45,0.35,0.175,DISCARD,low_score
50.43,1128,class69,0.331,0.166,DISCARD,low_score
50.515,1130,class72,0.411,0.206,DISCARD,low_score
50.515,1130,class45,0.349,0.174,DISCARD,low_score
50.599,1132,class45,0.617,0.308,DISCARD,low_score
50.599,1132,class72,0.417,0.208,DISCARD,low_score
50.599,1132,class69,0.379,0.19,DISCARD,low_score
50.683,1134,class69,0.392,0.196,DISCARD,low_score
50.683,1134,class45,0.314,0.157,DISCARD,low_score
50.683,1134,class39,0.307,0.154,DISCARD,low_score
50.683,1134,class72,0.278,0.139,DISCARD,low_score
50.767,1136,class72,0.72,0.36,DISCARD,bandwidth
50.767,1136,class45,0.61,0.305,DISCARD,low_score
50.767,1136,class69,0.404,0.202,DISCARD,low_score
