t,frame,name,conf,score,decision,reason
49.185,902,class61,0.529,0.265,DISCARD,low_score
49.239,903,class61,0.361,0.181,DISCARD,low_score
49.293,904,class61,0.539,0.269,DISCARD,low_score
49.399,906,class0,0.582,0.291,DISCARD,low_score
50.02,918,class73,0.639,0.319,DISCARD,low_score
50.02,918,class41,0.385,0.192,DISCARD,low_score
50.074,919,class41,0.531,0.266,DISCARD,low_score
50.128,920,class41,0.317,0.159,DISCARD,low_score
50.128,920,class60,0.265,0.133,DISCARD,low_score
50.182,921,class41,0.812,0.406,DISCARD,low_score
50.182,921,class60,0.316,0.158,DISCARD,low_score
50.236,922,class41,0.77,0.385,DISCARD,low_score
50.236,922,class60,0.414,0.207,DISCARD,low_score
50.236,922,class67,0.28,0.14,DISCARD,low_score
50.29,923,class41,0.677,0.339,DISCARD,low_score
50.29,923,class60,0.339,0.169,DISCARD,low_score
50.29,923,class67,0.293,0.146,DISCARD,low_score
50.344,924,class41,0.479,0.239,DISCARD,low_score
50.398,925,class41,0.48,0.24,DISCARD,low_score
50.398,925,class60,0.299,0.15,DISCARD,low_score
50.398,925,class73,0.255,0.128,DISCARD,low_score
50.467,926,class41,0.553,0.276,DISCARD,low_score
50.521,927,class41,0.665,0.333,DISCARD,low_score
50.521,927,class73,0.4,0.2,DISCARD,low_score
50.577,928,class41,0.385,0.192,DISCARD,low_score
50.577,928,class60,0.272,0.136,DISCARD,low_score
50.631,929,class41,0.294,0.147,DISCARD,low_score
50.685,930,class41,0.527,0.264,DISCARD,low_score
50.685,930,class73,0.409,0.205,DISCARD,low_score
50.685,930,class41,0.286,0.143,DISCARD,low_score
50.739,931,class73,0.432,0.216,DISCARD,low_score
50.739,931,class73,0.363,0.181,DISCARD,low_score
50.739,931,class41,0.354,0.177,DISCARD,low_score
50.739,931,class73,0.302,0.151,DISCARD,low_score
50.739,931,class75,0.267,0.134,DISCARD,low_score
50.794,932,class73,0.402,0.201,DISCARD,low_score
50.794,932,class56,0.329,0.164,DISCARD,low_score
50.848,933,class73,0.404,0.202,DISCARD,low_score
50.848,933,class73,0.379,0.19,DISCARD,low_score
50.902,934,class73,0.394,0.197,DISCARD,low_score
50.902,934,class41,0.374,0.187,DISCARD,low_score
50.902,934,class56,0.323,0.162,DISCARD,low_score
50.957,935,class56,0.529,0.265,DISCARD,low_score
50.957,935,class73,0.484,0.242,DISCARD,low_score
50.957,935,class71,0.27,0.135,DISCARD,low_score
51.011,936,class41,0.508,0.254,DISCARD,low_score
51.011,936,class41,0.447,0.224,DISCARD,low_score
51.011,936,class73,0.368,0.184,DISCARD,low_score
51.011,936,class73,0.277,0.138,DISCARD,low_score
51.066,937,class73,0.551,0.275,DISCARD,low_score
51.066,937,class41,0.336,0.168,DISCARD,low_score
51.066,937,class71,0.28,0.14,DISCARD,low_score
51.121,938,class41,0.701,0.35,DISCARD,low_score
51.121,938,class56,0.595,0.297,DISCARD,low_score
51.121,938,class73,0.504,0.252,DISCARD,low_score
51.121,938,class71,0.5,0.25,DISCARD,low_score
51.121,938,class41,0.409,0.205,DISCARD,low_score
51.176,939,class71,0.665,0.333,DISCARD,low_score
51.176,939,class73,0.338,0.169,DISCARD,low_score
51.176,939,class39,0.261,0.131,DISCARD,low_score
51.176,939,class56,0.25,0.125,DISCARD,low_score
51.23,940,class71,0.671,0.335,DISCARD,low_score
51.23,940,class39,0.545,0.272,DISCARD,low_score
51.23,940,class41,0.545,0.272,DISCARD,low_score
51.23,940,class73,0.446,0.223,DISCARD,low_score
51.23,940,class73,0.338,0.169,DISCARD,low_score
51.23,940,class39,0.321,0.16,DISCARD,low_score
51.285,941,class73,0.655,0.327,DISCARD,low_score
51.285,941,class39,0.453,0.227,DISCARD,low_score
51.285,941,class41,0.426,0.213,DISCARD,low_score
51.285,941,class73,0.413,0.207,DISCARD,low_score
51.285,941,class71,0.394,0.197,DISCARD,low_score
51.285,941,class73,0.311,0.155,DISCARD,low_score
51.285,941,class60,0.289,0.144,DISCARD,low_score
51.285,941,class71,0.283,0.141,DISCARD,low_score
51.341,942,class73,0.615,0.308,DISCARD,low_score
51.341,942,class71,0.349,0.174,DISCARD,low_score
51.341,942,class39,0.349,0.174,DISCARD,low_score
51.341,942,class71,0.331,0.166,DISCARD,low_score
51.341,942,class39,0.28,0.14,DISCARD,low_score
51.395,943,class71,0.529,0.265,DISCARD,low_score
51.395,943,class73,0.434,0.217,DISCARD,low_score
51.395,943,class73,0.264,0.132,DISCARD,low_score
51.395,943,class41,0.254,0.127,DISCARD,low_score
51.45,944,class71,0.671,0.335,DISCARD,low_score
51.45,944,class39,0.484,0.242,DISCARD,low_score
51.45,944,class56,0.469,0.234,DISCARD,low_score
51.45,944,class56,0.42,0.21,DISCARD,low_score
51.45,944,class73,0.372,0.186,DISCARD,low_score
51.45,944,class73,0.297,0.148,DISCARD,low_score
51.505,945,class71,0.779,0.389,DISCARD,low_score
51.505,945,class39,0.484,0.242,DISCARD,low_score
51.505,945,class39,0.417,0.208,DISCARD,low_score
51.505,945,class73,0.37,0.185,DISCARD,low_score
51.505,945,class60,0.311,0.155,DISCARD,low_score
51.505,945,class41,0.289,0.145,DISCARD,low_score
51.56,946,class71,0.734,0.367,DISCARD,low_score
51.614,947,class71,0.602,0.301,DISCARD,low_score
51.614,947,class41,0.554,0.277,DISCARD,low_score
51.614,947,class39,0.463,0.231,DISCARD,low_score
51.614,947,class71,0.338,0.169,DISCARD,low_score
51.614,947,class39,0.281,0.141,DISCARD,low_score
51.614,947,class73,0.264,0.132,DISCARD,low_score
51.669,948,class71,0.558,0.279,DISCARD,low_score
51.669,948,class73,0.461,0.231,DISCARD,low_score
51.669,948,class41,0.423,0.211,DISCARD,low_score
51.669,948,class39,0.404,0.202,DISCARD,low_score
51.669,948,class41,0.361,0.181,DISCARD,low_score
51.669,948,class71,0.345,0.173,DISCARD,low_score
51.669,948,class39,0.283,0.141,DISCARD,low_score
51.724,949,class71,0.591,0.295,DISCARD,low_score
51.724,949,class41,0.405,0.203,DISCARD,low_score
51.724,949,class73,0.374,0.187,DISCARD,low_score
51.778,950,class73,0.396,0.198,DISCARD,low_score
51.778,950,class39,0.306,0.153,DISCARD,low_score
51.778,950,class41,0.302,0.151,DISCARD,low_score
51.833,951,class73,0.424,0.212,DISCARD,low_score
51.833,951,class73,0.331,0.166,DISCARD,low_score
51.94,953,class41,0.415,0.207,DISCARD,low_score
51.994,954,class41,0.34,0.17,DISCARD,low_score
51.994,954,class56,0.327,0.163,DISCARD,low_score
52.048,955,class41,0.473,0.236,DISCARD,low_score
52.048,955,class56,0.39,0.195,DISCARD,low_score
52.048,955,class56,0.353,0.177,DISCARD,low_score
52.048,955,class73,0.326,0.163,DISCARD,low_score
52.103,956,class41,0.392,0.196,DISCARD,low_score
52.103,956,class56,0.347,0.173,DISCARD,low_score
52.103,956,class56,0.342,0.171,DISCARD,low_score
52.103,956,class60,0.316,0.158,DISCARD,low_score
52.103,956,class73,0.294,0.147,DISCARD,low_score
52.157,957,class56,0.81,0.405,DISCARD,low_score
52.157,957,class73,0.447,0.224,DISCARD,low_score
52.157,957,class60,0.379,0.19,DISCARD,low_score
52.157,957,class73,0.367,0.183,DISCARD,low_score
52.212,958,class56,0.843,0.421,DISCARD,low_score
52.212,958,class60,0.404,0.202,DISCARD,low_score
52.212,958,class41,0.347,0.173,DISCARD,low_score
52.212,958,class73,0.336,0.168,DISCARD,low_score
52.212,958,class73,0.301,0.15,DISCARD,low_score
52.212,958,class73,0.28,0.14,DISCARD,low_score
52.267,959,class56,0.73,0.365,DISCARD,low_score
52.267,959,class41,0.446,0.223,DISCARD,low_score
52.267,959,class73,0.326,0.163,DISCARD,low_score
52.321,960,class56,0.912,0.456,DISCARD,bandwidth
52.321,960,class41,0.624,0.312,DISCARD,low_score
52.321,960,class60,0.521,0.261,DISCARD,low_score
52.375,961,class56,0.849,0.424,DISCARD,low_score
52.375,961,class41,0.681,0.34,DISCARD,low_score
52.375,961,class60,0.625,0.313,DISCARD,low_score
52.43,962,class56,0.82,0.41,DISCARD,low_score
52.43,962,class41,0.66,0.33,DISCARD,low_score
52.43,962,class60,0.42,0.21,DISCARD,low_score
52.484,963,class56,0.877,0.438,DISCARD,low_score
52.484,963,class60,0.724,0.362,DISCARD,low_score
52.484,963,class41,0.272,0.136,DISCARD,low_score
52.484,963,class56,0.259,0.13,DISCARD,low_score
52.539,964,class56,0.823,0.412,DISCARD,low_score
52.539,964,class60,0.612,0.306,DISCARD,low_score
52.539,964,class45,0.269,0.134,DISCARD,low_score
52.593,965,class56,0.892,0.446,DISCARD,low_score
52.593,965,class60,0.705,0.352,DISCARD,low_score
52.647,966,class56,0.901,0.45,DISCARD,bandwidth
52.647,966,class60,0.697,0.348,DISCARD,low_score
52.647,966,class41,0.492,0.246,DISCARD,low_score
52.702,967,class56,0.924,0.462,DISCARD,bandwidth
52.702,967,class60,0.73,0.365,DISCARD,low_score
52.702,967,class41,0.407,0.204,DISCARD,low_score
52.756,968,class56,0.911,0.455,DISCARD,bandwidth
52.756,968,class60,0.736,0.368,DISCARD,low_score
52.756,968,class41,0.667,0.334,DISCARD,low_score
52.756,968,class41,0.43,0.215,DISCARD,low_score
52.811,969,class56,0.89,0.445,DISCARD,low_score
52.811,969,class60,0.693,0.346,DISCARD,low_score
52.811,969,class41,0.672,0.336,DISCARD,low_score
52.865,970,class56,0.742,0.371,DISCARD,low_score
52.865,970,class60,0.537,0.269,DISCARD,low_score
52.865,970,class41,0.335,0.167,DISCARD,low_score
52.92,971,class56,0.789,0.395,DISCARD,low_score
52.92,971,class60,0.679,0.34,DISCARD,low_score
52.92,971,class56,0.301,0.15,DISCARD,low_score
52.974,972,class56,0.822,0.411,DISCARD,low_score
52.974,972,class60,0.602,0.301,DISCARD,low_score
53.028,973,class56,0.83,0.415,DISCARD,low_score
53.028,973,class60,0.547,0.273,DISCARD,low_score
53.083,974,class56,0.838,0.419,DISCARD,low_score
53.083,974,class60,0.511,0.255,DISCARD,low_score
53.083,974,class41,0.275,0.138,DISCARD,low_score
53.083,974,class56,0.254,0.127,DISCARD,low_score
53.137,975,class56,0.875,0.437,DISCARD,low_score
53.137,975,class60,0.706,0.353,DISCARD,low_score
53.137,975,class56,0.308,0.154,DISCARD,low_score
53.191,976,class56,0.863,0.432,DISCARD,low_score
53.191,976,class60,0.539,0.269,DISCARD,low_score
53.191,976,class41,0.535,0.268,DISCARD,low_score
53.191,976,class60,0.31,0.155,DISCARD,low_score
53.245,977,class56,0.742,0.371,DISCARD,low_score
53.245,977,class60,0.616,0.308,DISCARD,low_score
53.245,977,class41,0.365,0.182,DISCARD,low_score
53.302,978,class56,0.698,0.349,DISCARD,low_score
53.302,978,class60,0.54,0.27,DISCARD,low_score
53.356,979,class56,0.855,0.427,DISCARD,low_score
53.356,979,class60,0.533,0.267,DISCARD,low_score
53.356,979,class56,0.346,0.173,DISCARD,low_score
53.411,980,class56,0.329,0.165,DISCARD,low_score
53.465,981,class56,0.482,0.241,DISCARD,low_score
53.465,981,class73,0.356,0.178,DISCARD,low_score
53.465,981,class60,0.353,0.177,DISCARD,low_score
53.519,982,class60,0.439,0.219,DISCARD,low_score
53.519,982,class56,0.412,0.206,DISCARD,low_score
53.519,982,class56,0.388,0.194,DISCARD,low_score
53.573,983,class56,0.541,0.27,DISCARD,low_score
53.573,983,class73,0.405,0.203,DISCARD,low_score
53.627,984,class56,0.539,0.269,DISCARD,low_score
53.627,984,class59,0.497,0.249,DISCARD,low_score
53.627,984,class56,0.48,0.24,DISCARD,low_score
53.627,984,class60,0.293,0.146,DISCARD,low_score
53.682,985,class56,0.701,0.35,DISCARD,low_score
53.682,985,class59,0.597,0.299,DISCARD,low_score
53.682,985,class56,0.451,0.226,DISCARD,low_score
53.682,985,class60,0.388,0.194,DISCARD,low_score
53.736,986,class59,0.642,0.321,DISCARD,low_score
53.736,986,class56,0.543,0.271,DISCARD,low_score
53.736,986,class60,0.285,0.142,DISCARD,low_score
53.79,987,class56,0.479,0.239,DISCARD,low_score
53.79,987,class56,0.449,0.225,DISCARD,low_score
53.79,987,class59,0.442,0.221,DISCARD,low_score
53.79,987,class60,0.369,0.185,DISCARD,low_score
53.845,988,class56,0.577,0.289,DISCARD,low_score
53.845,988,class56,0.4,0.2,DISCARD,low_score
53.845,988,class60,0.34,0.17,DISCARD,low_score
53.845,988,class73,0.255,0.128,DISCARD,low_score
53.899,989,class56,0.804,0.402,DISCARD,low_score
53.899,989,class60,0.569,0.284,DISCARD,low_score
53.899,989,class73,0.289,0.145,DISCARD,low_score
53.899,989,class59,0.255,0.128,DISCARD,low_score
53.954,990,class56,0.803,0.402,DISCARD,low_score
53.954,990,class60,0.556,0.278,DISCARD,low_score
53.954,990,class73,0.442,0.221,DISCARD,low_score
53.954,990,class56,0.267,0.133,DISCARD,low_score
54.008,991,class56,0.684,0.342,DISCARD,low_score
54.008,991,class73,0.356,0.178,DISCARD,low_score
54.008,991,class73,0.258,0.129,DISCARD,low_score
54.063,992,class59,0.434,0.217,DISCARD,low_score
54.063,992,class56,0.43,0.215,DISCARD,low_score
54.063,992,class73,0.378,0.189,DISCARD,low_score
54.063,992,class73,0.266,0.133,DISCARD,low_score
54.117,993,class59,0.495,0.248,DISCARD,low_score
54.117,993,class73,0.296,0.148,DISCARD,low_score
54.117,993,class73,0.26,0.13,DISCARD,low_score
54.171,994,class73,0.312,0.156,DISCARD,low_score
54.171,994,class59,0.291,0.145,DISCARD,low_score
54.171,994,class73,0.285,0.142,DISCARD,low_score
54.225,995,class73,0.321,0.16,DISCARD,low_score
54.225,995,class59,0.317,0.159,DISCARD,low_score
54.225,995,class60,0.262,0.131,DISCARD,low_score
54.28,996,class73,0.323,0.161,DISCARD,low_score
54.28,996,class59,0.27,0.135,DISCARD,low_score
54.335,997,class73,0.286,0.143,DISCARD,low_score
54.335,997,class59,0.269,0.134,DISCARD,low_score
54.335,997,class60,0.253,0.127,DISCARD,low_score
54.389,998,class73,0.342,0.171,DISCARD,low_score
54.389,998,class73,0.335,0.167,DISCARD,low_score
54.443,999,class73,0.446,0.223,DISCARD,low_score
54.443,999,class73,0.372,0.186,DISCARD,low_score
54.497,1000,class73,0.469,0.234,DISCARD,low_score
54.603,1002,class73,0.52,0.26,DISCARD,low_score
54.657,1003,class73,0.558,0.279,DISCARD,low_score
54.713,1004,class73,0.525,0.263,DISCARD,low_score
54.713,1004,class59,0.404,0.202,DISCARD,low_score
54.767,1005,class73,0.415,0.207,DISCARD,low_score
54.821,1006,class73,0.504,0.252,DISCARD,low_score
54.821,1006,class73,0.419,0.209,DISCARD,low_score
54.821,1006,class72,0.367,0.183,DISCARD,low_score
54.821,1006,class73,0.324,0.162,DISCARD,low_score
54.821,1006,class59,0.271,0.136,DISCARD,low_score
54.875,1007,class73,0.583,0.292,DISCARD,low_score
54.875,1007,class72,0.475,0.237,DISCARD,low_score
54.875,1007,class16,0.368,0.184,DISCARD,low_score
54.875,1007,class71,0.367,0.183,DISCARD,low_score
54.875,1007,class73,0.361,0.181,DISCARD,low_score
54.93,1008,class71,0.455,0.228,DISCARD,low_score
54.93,1008,class73,0.389,0.194,DISCARD,low_score
54.93,1008,class72,0.37,0.185,DISCARD,low_score
54.93,1008,class73,0.266,0.133,DISCARD,low_score
54.985,1009,class71,0.523,0.262,DISCARD,low_score
54.985,1009,class73,0.404,0.202,DISCARD,low_score
54.985,1009,class72,0.392,0.196,DISCARD,low_score
54.985,1009,class71,0.291,0.145,DISCARD,low_score
54.985,1009,class73,0.251,0.125,DISCARD,low_score
55.04,1010,class71,0.832,0.416,DISCARD,low_score
55.04,1010,class72,0.383,0.192,DISCARD,low_score
55.04,1010,class73,0.331,0.166,DISCARD,low_score
55.04,1010,class73,0.329,0.165,DISCARD,low_score
55.04,1010,class73,0.278,0.139,DISCARD,low_score
55.094,1011,class71,0.809,0.405,DISCARD,low_score
55.094,1011,class72,0.57,0.285,DISCARD,low_score
55.094,1011,class73,0.471,0.235,DISCARD,low_score
55.094,1011,class41,0.387,0.193,DISCARD,low_score
55.094,1011,class73,0.289,0.145,DISCARD,low_score
55.149,1012,class71,0.793,0.397,DISCARD,low_score
55.149,1012,class72,0.554,0.277,DISCARD,low_score
55.149,1012,class73,0.479,0.239,DISCARD,low_score
55.149,1012,class72,0.294,0.147,DISCARD,low_score
55.149,1012,class39,0.278,0.139,DISCARD,low_score
55.149,1012,class73,0.266,0.133,DISCARD,low_score
55.204,1013,class71,0.804,0.402,DISCARD,low_score
55.204,1013,class39,0.657,0.328,DISCARD,low_score
55.204,1013,class73,0.372,0.186,DISCARD,low_score
55.204,1013,class73,0.309,0.155,DISCARD,low_score
55.204,1013,class69,0.294,0.147,DISCARD,low_score
55.259,1014,class71,0.812,0.406,DISCARD,low_score
55.259,1014,class39,0.646,0.323,DISCARD,low_score
55.259,1014,class73,0.48,0.24,DISCARD,low_score
55.259,1014,class73,0.267,0.134,DISCARD,low_score
55.259,1014,class69,0.254,0.127,DISCARD,low_score
55.313,1015,class71,0.797,0.398,DISCARD,low_score
55.313,1015,class39,0.745,0.372,DISCARD,low_score
55.313,1015,class73,0.34,0.17,DISCARD,low_score
55.368,1016,class71,0.819,0.409,DISCARD,low_score
55.368,1016,class39,0.751,0.375,DISCARD,low_score
55.368,1016,class73,0.288,0.144,DISCARD,low_score
55.368,1016,class73,0.275,0.138,DISCARD,low_score
55.368,1016,class69,0.255,0.128,DISCARD,low_score
55.423,1017,class39,0.779,0.389,DISCARD,low_score
55.423,1017,class71,0.749,0.375,DISCARD,low_score
55.423,1017,class73,0.389,0.194,DISCARD,low_score
55.489,1018,class71,0.846,0.423,DISCARD,low_score
55.489,1018,class39,0.63,0.315,DISCARD,low_score
55.489,1018,class69,0.365,0.182,DISCARD,low_score
55.489,1018,class73,0.286,0.143,DISCARD,low_score
55.489,1018,class72,0.285,0.142,DISCARD,low_score
55.544,1019,class71,0.861,0.43,DISCARD,low_score
55.544,1019,class39,0.564,0.282,DISCARD,low_score
55.544,1019,class69,0.417,0.208,DISCARD,low_score
55.544,1019,class72,0.28,0.14,DISCARD,low_score
55.598,1020,class71,0.763,0.382,DISCARD,low_score
55.598,1020,class39,0.473,0.236,DISCARD,low_score
55.598,1020,class69,0.389,0.194,DISCARD,low_score
55.653,1021,class71,0.765,0.382,DISCARD,low_score
55.653,1021,class71,0.251,0.125,DISCARD,low_score
55.719,1022,class71,0.772,0.386,DISCARD,low_score
55.773,1023,class71,0.658,0.329,DISCARD,low_score
55.773,1023,class71,0.446,0.223,DISCARD,low_score
55.773,1023,class39,0.417,0.208,DISCARD,low_score
55.773,1023,class71,0.309,0.155,DISCARD,low_score
55.827,1024,class71,0.816,0.408,DISCARD,low_score
55.827,1024,class39,0.583,0.292,DISCARD,low_score
55.827,1024,class39,0.417,0.208,DISCARD,low_score
55.882,1025,class71,0.779,0.389,DISCARD,low_score
55.882,1025,class71,0.274,0.137,DISCARD,low_score
55.936,1026,class71,0.775,0.387,DISCARD,low_score
55.936,1026,class39,0.333,0.166,DISCARD,low_score
55.99,1027,class71,0.814,0.407,DISCARD,low_score
55.99,1027,class39,0.558,0.279,DISCARD,low_score
56.044,1028,class71,0.831,0.416,DISCARD,low_score
56.044,1028,class39,0.525,0.263,DISCARD,low_score
56.044,1028,class56,0.482,0.241,DISCARD,low_score
56.1,1029,class71,0.838,0.419,DISCARD,low_score
56.1,1029,class39,0.613,0.307,DISCARD,low_score
56.154,1030,class71,0.809,0.405,DISCARD,low_score
56.154,1030,class56,0.479,0.239,DISCARD,low_score
56.154,1030,class39,0.378,0.189,DISCARD,low_score
56.208,1031,class71,0.853,0.426,DISCARD,low_score
56.208,1031,class2,0.405,0.203,DISCARD,low_score
56.208,1031,class39,0.383,0.192,DISCARD,low_score
56.208,1031,class2,0.317,0.159,DISCARD,low_score
56.208,1031,class56,0.26,0.13,DISCARD,low_score
56.263,1032,class71,0.862,0.431,DISCARD,low_score
56.263,1032,class2,0.541,0.27,DISCARD,low_score
56.263,1032,class39,0.383,0.192,DISCARD,low_score
56.263,1032,class2,0.301,0.15,DISCARD,low_score
56.318,1033,class71,0.891,0.446,DISCARD,low_score
56.318,1033,class39,0.398,0.199,DISCARD,low_score
56.318,1033,class2,0.336,0.168,DISCARD,low_score
56.372,1034,class71,0.853,0.426,DISCARD,low_score
56.372,1034,class39,0.367,0.183,DISCARD,low_score
56.427,1035,class71,0.848,0.424,DISCARD,low_score
56.427,1035,class2,0.323,0.161,DISCARD,low_score
56.481,1036,class71,0.905,0.452,KEEP,priority+bandwidth_ok
56.534,1037,class71,0.816,0.408,DISCARD,low_score
56.588,1038,class71,0.852,0.426,DISCARD,low_score
56.642,1039,class71,0.87,0.435,DISCARD,low_score
56.697,1040,class71,0.621,0.31,DISCARD,low_score
56.697,1040,class71,0.447,0.224,DISCARD,low_score
56.752,1041,class71,0.776,0.388,DISCARD,low_score
56.752,1041,class72,0.518,0.259,DISCARD,low_score
56.752,1041,class71,0.289,0.145,DISCARD,low_score
56.807,1042,class71,0.644,0.322,DISCARD,low_score
56.807,1042,class72,0.572,0.286,DISCARD,low_score
56.807,1042,class71,0.291,0.145,DISCARD,low_score
56.861,1043,class72,0.642,0.321,DISCARD,low_score
56.861,1043,class71,0.593,0.296,DISCARD,low_score
56.861,1043,class71,0.378,0.189,DISCARD,low_score
56.861,1043,class71,0.294,0.147,DISCARD,low_score
56.915,1044,class72,0.796,0.398,DISCARD,low_score
56.915,1044,class71,0.473,0.236,DISCARD,low_score
56.915,1044,class71,0.329,0.165,DISCARD,low_score
56.915,1044,class72,0.326,0.163,DISCARD,low_score
56.97,1045,class72,0.859,0.429,DISCARD,low_score
56.97,1045,class71,0.822,0.411,DISCARD,low_score
56.97,1045,class71,0.299,0.15,DISCARD,low_score
57.024,1046,class72,0.807,0.403,DISCARD,low_score
57.024,1046,class71,0.615,0.308,DISCARD,low_score
57.024,1046,class69,0.274,0.137,DISCARD,low_score
57.079,1047,class72,0.809,0.405,DISCARD,low_score
57.079,1047,class71,0.637,0.319,DISCARD,low_score
57.133,1048,class71,0.866,0.433,DISCARD,low_score
57.133,1048,class72,0.787,0.393,DISCARD,low_score
57.186,1049,class71,0.923,0.462,KEEP,priority+bandwidth_ok
57.186,1049,class72,0.664,0.332,DISCARD,low_score
57.186,1049,class69,0.314,0.157,DISCARD,low_score
57.186,1049,class56,0.259,0.13,DISCARD,low_score
57.241,1050,class71,0.858,0.429,DISCARD,low_score
57.241,1050,class72,0.83,0.415,DISCARD,low_score
57.295,1051,class71,0.781,0.391,DISCARD,low_score
57.295,1051,class72,0.698,0.349,DISCARD,low_score
57.36,1052,class71,0.707,0.354,DISCARD,low_score
57.36,1052,class72,0.644,0.322,DISCARD,low_score
57.414,1053,class72,0.859,0.429,DISCARD,low_score
57.414,1053,class71,0.413,0.207,DISCARD,low_score
57.414,1053,class68,0.37,0.185,DISCARD,low_score
57.471,1054,class72,0.742,0.371,DISCARD,low_score
57.525,1055,class72,0.784,0.392,DISCARD,low_score
57.525,1055,class68,0.281,0.141,DISCARD,low_score
57.579,1056,class72,0.769,0.385,DISCARD,low_score
57.579,1056,class56,0.359,0.18,DISCARD,low_score
57.579,1056,class71,0.252,0.126,DISCARD,low_score
57.634,1057,class72,0.787,0.393,DISCARD,low_score
57.688,1058,class72,0.785,0.393,DISCARD,low_score
57.688,1058,class71,0.34,0.17,DISCARD,low_score
57.688,1058,class71,0.336,0.168,DISCARD,low_score
57.743,1059,class72,0.816,0.408,DISCARD,low_score
57.743,1059,class39,0.283,0.141,DISCARD,low_score
57.743,1059,class68,0.258,0.129,DISCARD,low_score
57.797,1060,class72,0.72,0.36,DISCARD,low_score
57.797,1060,class68,0.496,0.248,DISCARD,low_score
57.797,1060,class56,0.342,0.171,DISCARD,low_score
57.797,1060,class39,0.274,0.137,DISCARD,low_score
