t,frame,name,conf,score,decision,reason
24.399,366,class59,0.797,0.398,KEEP,priority+bandwidth_ok
24.399,366,class57,0.288,0.144,DISCARD,low_score
24.465,367,class59,0.863,0.432,KEEP,priority+bandwidth_ok
24.465,367,class16,0.843,0.421,KEEP,priority+bandwidth_ok
24.532,368,class59,0.877,0.438,KEEP,priority+bandwidth_ok
24.532,368,class16,0.874,0.437,KEEP,priority+bandwidth_ok
24.598,369,class16,0.875,0.437,KEEP,priority+bandwidth_ok
24.598,369,class59,0.853,0.426,KEEP,priority+bandwidth_ok
24.664,370,class16,0.867,0.434,KEEP,priority+bandwidth_ok
24.664,370,class59,0.83,0.415,KEEP,priority+bandwidth_ok
24.73,371,class59,0.868,0.434,KEEP,priority+bandwidth_ok
24.73,371,class16,0.865,0.433,KEEP,priority+bandwidth_ok
24.795,372,class16,0.885,0.442,KEEP,priority+bandwidth_ok
24.795,372,class59,0.753,0.377,KEEP,priority+bandwidth_ok
24.861,373,class16,0.869,0.434,KEEP,priority+bandwidth_ok
24.861,373,class59,0.726,0.363,KEEP,priority+bandwidth_ok
24.927,374,class16,0.885,0.442,KEEP,priority+bandwidth_ok
24.927,374,class59,0.748,0.374,KEEP,priority+bandwidth_ok
24.993,375,class16,0.866,0.433,KEEP,priority+bandwidth_ok
24.993,375,class59,0.763,0.382,KEEP,priority+bandwidth_ok
25.059,376,class16,0.861,0.43,KEEP,priority+bandwidth_ok
25.059,376,class59,0.799,0.4,KEEP,priority+bandwidth_ok
25.126,377,class16,0.888,0.444,KEEP,priority+bandwidth_ok
25.126,377,class59,0.813,0.406,KEEP,priority+bandwidth_ok
25.192,378,class16,0.886,0.443,KEEP,priority+bandwidth_ok
25.192,378,class59,0.775,0.387,KEEP,priority+bandwidth_ok
25.26,379,class16,0.891,0.446,KEEP,priority+bandwidth_ok
25.26,379,class59,0.728,0.364,KEEP,priority+bandwidth_ok
25.326,380,class16,0.895,0.447,KEEP,priority+bandwidth_ok
25.326,380,class59,0.691,0.345,DISCARD,low_score
25.391,381,class16,0.901,0.45,KEEP,priority+bandwidth_ok
25.391,381,class59,0.653,0.327,DISCARD,low_score
25.457,382,class16,0.909,0.455,KEEP,priority+bandwidth_ok
25.457,382,class59,0.644,0.322,DISCARD,low_score
25.523,383,class16,0.897,0.448,KEEP,priority+bandwidth_ok
25.523,383,class59,0.617,0.308,DISCARD,low_score
25.589,384,class16,0.871,0.435,KEEP,priority+bandwidth_ok
25.589,384,class59,0.698,0.349,DISCARD,low_score
25.655,385,class16,0.878,0.439,KEEP,priority+bandwidth_ok
25.655,385,class59,0.65,0.325,DISCARD,low_score
25.721,386,class16,0.874,0.437,KEEP,priority+bandwidth_ok
25.721,386,class59,0.628,0.314,DISCARD,low_score
25.787,387,class16,0.861,0.43,KEEP,priority+bandwidth_ok
25.787,387,class59,0.506,0.253,DISCARD,low_score
25.854,388,class16,0.869,0.434,KEEP,priority+bandwidth_ok
25.854,388,class59,0.56,0.28,DISCARD,low_score
25.92,389,class16,0.888,0.444,KEEP,priority+bandwidth_ok
25.92,389,class59,0.436,0.218,DISCARD,low_score
25.986,390,class16,0.861,0.43,KEEP,priority+bandwidth_ok
25.986,390,class59,0.518,0.259,DISCARD,low_score
25.986,390,class57,0.342,0.171,DISCARD,low_score
26.052,391,class16,0.855,0.427,KEEP,priority+bandwidth_ok
26.052,391,class59,0.42,0.21,DISCARD,low_score
26.052,391,class57,0.413,0.207,DISCARD,low_score
26.052,391,class57,0.306,0.153,DISCARD,low_score
26.124,392,class16,0.862,0.431,KEEP,priority+bandwidth_ok
26.124,392,class59,0.507,0.253,DISCARD,low_score
26.19,393,class16,0.866,0.433,KEEP,priority+bandwidth_ok
26.19,393,class59,0.467,0.233,DISCARD,low_score
26.19,393,class57,0.312,0.156,DISCARD,low_score
26.255,394,class16,0.711,0.355,KEEP,priority+bandwidth_ok
26.255,394,class59,0.399,0.199,DISCARD,low_score
26.255,394,class57,0.303,0.152,DISCARD,low_score
26.322,395,class16,0.862,0.431,KEEP,priority+bandwidth_ok
26.322,395,class59,0.302,0.151,DISCARD,low_score
26.388,396,class16,0.873,0.437,KEEP,priority+bandwidth_ok
26.454,397,class16,0.863,0.432,KEEP,priority+bandwidth_ok
26.454,397,class59,0.351,0.176,DISCARD,low_score
26.519,398,class16,0.717,0.359,KEEP,priority+bandwidth_ok
26.519,398,class15,0.27,0.135,DISCARD,low_score
26.585,399,class16,0.833,0.417,KEEP,priority+bandwidth_ok
26.585,399,class59,0.423,0.212,DISCARD,low_score
26.651,400,class16,0.852,0.426,KEEP,priority+bandwidth_ok
26.651,400,class57,0.258,0.129,DISCARD,low_score
26.716,401,class16,0.847,0.423,KEEP,priority+bandwidth_ok
26.716,401,class57,0.564,0.282,DISCARD,low_score
26.782,402,class16,0.587,0.293,DISCARD,low_score
26.782,402,class57,0.267,0.133,DISCARD,low_score
26.85,403,class16,0.688,0.344,DISCARD,low_score
26.916,404,class16,0.84,0.42,KEEP,priority+bandwidth_ok
26.981,405,class16,0.818,0.409,KEEP,priority+bandwidth_ok
26.981,405,class57,0.295,0.148,DISCARD,low_score
27.047,406,class16,0.428,0.214,DISCARD,low_score
27.047,406,class17,0.317,0.159,DISCARD,low_score
27.113,407,class16,0.793,0.397,KEEP,priority+bandwidth_ok
27.178,408,class16,0.912,0.456,KEEP,priority+bandwidth_ok
27.245,409,class16,0.889,0.444,KEEP,priority+bandwidth_ok
27.312,410,class16,0.87,0.435,KEEP,priority+bandwidth_ok
27.377,411,class16,0.847,0.423,KEEP,priority+bandwidth_ok
27.444,412,class16,0.886,0.443,KEEP,priority+bandwidth_ok
27.51,413,class16,0.862,0.431,KEEP,priority+bandwidth_ok
27.575,414,class16,0.762,0.381,KEEP,priority+bandwidth_ok
27.64,415,class16,0.893,0.447,KEEP,priority+bandwidth_ok
27.706,416,class16,0.882,0.441,KEEP,priority+bandwidth_ok
27.773,417,class16,0.908,0.454,KEEP,priority+bandwidth_ok
27.839,418,class16,0.916,0.458,KEEP,priority+bandwidth_ok
27.904,419,class16,0.91,0.455,KEEP,priority+bandwidth_ok
27.969,420,class16,0.909,0.455,KEEP,priority+bandwidth_ok
28.036,421,class16,0.914,0.457,KEEP,priority+bandwidth_ok
28.105,422,class16,0.903,0.451,KEEP,priority+bandwidth_ok
28.17,423,class16,0.822,0.411,KEEP,priority+bandwidth_ok
28.235,424,class16,0.776,0.388,KEEP,priority+bandwidth_ok
28.303,425,class16,0.828,0.414,KEEP,priority+bandwidth_ok
28.371,426,class16,0.878,0.439,KEEP,priority+bandwidth_ok
28.436,427,class16,0.892,0.446,KEEP,priority+bandwidth_ok
28.503,428,class16,0.709,0.355,KEEP,priority+bandwidth_ok
28.503,428,class21,0.374,0.187,DISCARD,low_score
28.569,429,class16,0.863,0.432,KEEP,priority+bandwidth_ok
28.638,430,class16,0.893,0.447,KEEP,priority+bandwidth_ok
28.704,431,class16,0.892,0.446,KEEP,priority+bandwidth_ok
28.704,431,class57,0.349,0.174,DISCARD,low_score
28.772,432,class16,0.904,0.452,KEEP,priority+bandwidth_ok
28.772,432,class57,0.436,0.218,DISCARD,low_score
28.838,433,class16,0.905,0.453,KEEP,priority+bandwidth_ok
28.838,433,class59,0.431,0.216,DISCARD,low_score
28.838,433,class57,0.415,0.207,DISCARD,low_score
28.905,434,class16,0.905,0.452,KEEP,priority+bandwidth_ok
28.905,434,class59,0.446,0.223,DISCARD,low_score
28.905,434,class57,0.402,0.201,DISCARD,low_score
28.97,435,class16,0.905,0.452,KEEP,priority+bandwidth_ok
29.036,436,class16,0.909,0.455,KEEP,priority+bandwidth_ok
29.036,436,class59,0.288,0.144,DISCARD,low_score
29.102,437,class16,0.911,0.455,KEEP,priority+bandwidth_ok
29.102,437,class57,0.411,0.206,DISCARD,low_score
29.102,437,class59,0.376,0.188,DISCARD,low_score
29.168,438,class16,0.894,0.447,KEEP,priority+bandwidth_ok
29.233,439,class16,0.908,0.454,KEEP,priority+bandwidth_ok
29.233,439,class59,0.47,0.235,DISCARD,low_score
29.299,440,class16,0.916,0.458,KEEP,priority+bandwidth_ok
29.299,440,class59,0.45,0.225,DISCARD,low_score
29.365,441,class16,0.906,0.453,KEEP,priority+bandwidth_ok
29.365,441,class59,0.532,0.266,DISCARD,low_score
29.431,442,class16,0.91,0.455,KEEP,priority+bandwidth_ok
29.431,442,class59,0.525,0.263,DISCARD,low_score
29.496,443,class16,0.921,0.46,KEEP,priority+bandwidth_ok
29.496,443,class59,0.657,0.328,DISCARD,low_score
29.562,444,class16,0.896,0.448,KEEP,priority+bandwidth_ok
29.562,444,class59,0.61,0.305,DISCARD,low_score
29.562,444,class57,0.268,0.134,DISCARD,low_score
29.628,445,class16,0.903,0.452,KEEP,priority+bandwidth_ok
29.628,445,class59,0.72,0.36,KEEP,priority+bandwidth_ok
29.694,446,class16,0.899,0.45,KEEP,priority+bandwidth_ok
29.694,446,class59,0.785,0.393,KEEP,priority+bandwidth_ok
29.761,447,class16,0.904,0.452,KEEP,priority+bandwidth_ok
29.761,447,class59,0.794,0.397,KEEP,priority+bandwidth_ok
29.829,448,class16,0.905,0.453,KEEP,priority+bandwidth_ok
29.829,448,class59,0.829,0.414,KEEP,priority+bandwidth_ok
29.896,449,class59,0.903,0.451,KEEP,priority+bandwidth_ok
29.896,449,class16,0.903,0.451,KEEP,priority+bandwidth_ok
29.963,450,class16,0.927,0.464,KEEP,priority+bandwidth_ok
29.963,450,class59,0.818,0.409,KEEP,priority+bandwidth_ok
30.03,451,class16,0.925,0.462,KEEP,priority+bandwidth_ok
30.03,451,class59,0.83,0.415,KEEP,priority+bandwidth_ok
