t,frame,name,conf,score,decision,reason
86.576,1978,class28,0.589,0.294,DISCARD,low_score
86.576,1978,class56,0.577,0.289,DISCARD,low_score
86.664,1980,class56,0.676,0.338,DISCARD,low_score
86.664,1980,class56,0.414,0.207,DISCARD,low_score
86.748,1982,class56,0.82,0.41,KEEP,priority+bandwidth_ok
86.832,1984,class56,0.679,0.34,DISCARD,low_score
86.917,1986,class56,0.828,0.414,KEEP,priority+bandwidth_ok
86.917,1986,class56,0.383,0.192,DISCARD,low_score
87.001,1988,class56,0.759,0.38,KEEP,priority+bandwidth_ok
87.001,1988,class56,0.465,0.232,DISCARD,low_score
87.001,1988,class0,0.344,0.172,DISCARD,low_score
87.085,1990,class56,0.688,0.344,DISCARD,low_score
87.085,1990,class0,0.356,0.178,DISCARD,low_score
87.085,1990,class56,0.339,0.169,DISCARD,low_score
87.173,1992,class56,0.752,0.376,KEEP,priority+bandwidth_ok
87.173,1992,class0,0.256,0.128,DISCARD,low_score
87.173,1992,class56,0.251,0.125,DISCARD,low_score
87.259,1994,class56,0.637,0.319,DISCARD,low_score
87.259,1994,class56,0.467,0.233,DISCARD,low_score
87.259,1994,class0,0.335,0.167,DISCARD,low_score
87.343,1996,class56,0.553,0.276,DISCARD,low_score
87.343,1996,class0,0.463,0.231,DISCARD,low_score
87.343,1996,class56,0.379,0.19,DISCARD,low_score
87.428,1998,class56,0.568,0.284,DISCARD,low_score
87.428,1998,class0,0.462,0.231,DISCARD,low_score
87.428,1998,class56,0.408,0.204,DISCARD,low_score
87.513,2000,class56,0.449,0.225,DISCARD,low_score
87.513,2000,class56,0.405,0.203,DISCARD,low_score
87.513,2000,class0,0.332,0.166,DISCARD,low_score
87.599,2002,class56,0.525,0.263,DISCARD,low_score
87.599,2002,class56,0.368,0.184,DISCARD,low_score
87.683,2004,class56,0.479,0.239,DISCARD,low_score
87.768,2006,class56,0.422,0.211,DISCARD,low_score
87.851,2008,class56,0.492,0.246,DISCARD,low_score
87.851,2008,class56,0.349,0.174,DISCARD,low_score
87.936,2010,class56,0.282,0.141,DISCARD,low_score
88.02,2012,class56,0.354,0.177,DISCARD,low_score
88.02,2012,class56,0.289,0.144,DISCARD,low_score
88.517,2024,class74,0.296,0.148,DISCARD,low_score
