t,frame,name,conf,score,decision,reason
40.206,736,class27,0.498,0.249,DISCARD,low_score
41.047,752,class72,0.482,0.241,DISCARD,low_score
41.1,753,class72,0.748,0.374,DISCARD,low_score
41.1,753,class39,0.667,0.334,DISCARD,low_score
41.154,754,class39,0.662,0.331,DISCARD,low_score
41.154,754,class72,0.387,0.193,DISCARD,low_score
41.208,755,class39,0.669,0.334,DISCARD,low_score
41.208,755,class72,0.598,0.299,DISCARD,low_score
41.208,755,class39,0.398,0.199,DISCARD,low_score
41.208,755,class72,0.254,0.127,DISCARD,low_score
41.262,756,class39,0.653,0.327,DISCARD,low_score
41.262,756,class72,0.405,0.203,DISCARD,low_score
41.262,756,class39,0.291,0.145,DISCARD,low_score
41.316,757,class39,0.737,0.369,DISCARD,low_score
41.316,757,class39,0.413,0.207,DISCARD,low_score
41.37,758,class39,0.737,0.369,DISCARD,low_score
41.37,758,class39,0.688,0.344,DISCARD,low_score
41.37,758,class39,0.446,0.223,DISCARD,low_score
41.425,759,class39,0.737,0.369,DISCARD,low_score
41.425,759,class39,0.701,0.35,DISCARD,low_score
41.425,759,class39,0.502,0.251,DISCARD,low_score
41.425,759,class72,0.288,0.144,DISCARD,low_score
41.48,760,class39,0.651,0.326,DISCARD,low_score
41.48,760,class39,0.617,0.308,DISCARD,low_score
41.48,760,class39,0.347,0.173,DISCARD,low_score
41.48,760,class72,0.333,0.166,DISCARD,low_score
41.48,760,class72,0.264,0.132,DISCARD,low_score
41.534,761,class39,0.651,0.326,DISCARD,low_score
41.534,761,class39,0.568,0.284,DISCARD,low_score
41.534,761,class39,0.296,0.148,DISCARD,low_score
41.534,761,class39,0.269,0.134,DISCARD,low_score
41.534,761,class72,0.264,0.132,DISCARD,low_score
41.534,761,class72,0.252,0.126,DISCARD,low_score
41.589,762,class39,0.664,0.332,DISCARD,low_score
41.589,762,class39,0.641,0.32,DISCARD,low_score
41.589,762,class39,0.471,0.235,DISCARD,low_score
41.589,762,class39,0.428,0.214,DISCARD,low_score
41.589,762,class39,0.319,0.16,DISCARD,low_score
41.589,762,class72,0.293,0.146,DISCARD,low_score
41.589,762,class72,0.274,0.137,DISCARD,low_score
41.589,762,class39,0.266,0.133,DISCARD,low_score
41.645,763,class39,0.669,0.334,DISCARD,low_score
41.645,763,class39,0.633,0.317,DISCARD,low_score
41.645,763,class39,0.508,0.254,DISCARD,low_score
41.645,763,class39,0.446,0.223,DISCARD,low_score
41.645,763,class39,0.338,0.169,DISCARD,low_score
41.645,763,class72,0.26,0.13,DISCARD,low_score
41.7,764,class39,0.669,0.334,DISCARD,low_score
41.7,764,class39,0.615,0.308,DISCARD,low_score
41.7,764,class39,0.523,0.262,DISCARD,low_score
41.7,764,class39,0.506,0.253,DISCARD,low_score
41.7,764,class39,0.354,0.177,DISCARD,low_score
41.7,764,class72,0.328,0.164,DISCARD,low_score
41.7,764,class39,0.321,0.16,DISCARD,low_score
41.7,764,class72,0.286,0.143,DISCARD,low_score
41.755,765,class39,0.703,0.351,DISCARD,low_score
41.755,765,class39,0.667,0.334,DISCARD,low_score
41.755,765,class39,0.598,0.299,DISCARD,low_score
41.755,765,class39,0.539,0.269,DISCARD,low_score
41.755,765,class39,0.48,0.24,DISCARD,low_score
41.755,765,class72,0.338,0.169,DISCARD,low_score
41.755,765,class39,0.316,0.158,DISCARD,low_score
41.81,766,class39,0.756,0.378,DISCARD,low_score
41.81,766,class39,0.703,0.351,DISCARD,low_score
41.81,766,class39,0.602,0.301,DISCARD,low_score
41.81,766,class39,0.496,0.248,DISCARD,low_score
41.81,766,class39,0.405,0.203,DISCARD,low_score
41.81,766,class72,0.278,0.139,DISCARD,low_score
41.865,767,class39,0.722,0.361,DISCARD,low_score
41.865,767,class39,0.698,0.349,DISCARD,low_score
41.865,767,class39,0.587,0.293,DISCARD,low_score
41.865,767,class39,0.498,0.249,DISCARD,low_score
41.865,767,class39,0.469,0.234,DISCARD,low_score
41.865,767,class72,0.283,0.141,DISCARD,low_score
41.865,767,class39,0.252,0.126,DISCARD,low_score
41.92,768,class39,0.808,0.404,DISCARD,low_score
41.92,768,class39,0.759,0.38,DISCARD,low_score
41.92,768,class39,0.57,0.285,DISCARD,low_score
41.92,768,class39,0.535,0.268,DISCARD,low_score
41.92,768,class39,0.387,0.193,DISCARD,low_score
41.975,769,class39,0.812,0.406,DISCARD,low_score
41.975,769,class39,0.681,0.34,DISCARD,low_score
41.975,769,class39,0.639,0.319,DISCARD,low_score
41.975,769,class39,0.543,0.271,DISCARD,low_score
41.975,769,class39,0.44,0.22,DISCARD,low_score
41.975,769,class72,0.275,0.138,DISCARD,low_score
42.03,770,class39,0.761,0.38,DISCARD,low_score
42.03,770,class39,0.749,0.375,DISCARD,low_score
42.03,770,class39,0.648,0.324,DISCARD,low_score
42.03,770,class39,0.459,0.23,DISCARD,low_score
42.03,770,class39,0.453,0.227,DISCARD,low_score
42.03,770,class72,0.411,0.206,DISCARD,low_score
42.085,771,class39,0.784,0.392,DISCARD,low_score
42.085,771,class39,0.78,0.39,DISCARD,low_score
42.085,771,class39,0.56,0.28,DISCARD,low_score
42.085,771,class39,0.506,0.253,DISCARD,low_score
42.085,771,class39,0.475,0.237,DISCARD,low_score
42.085,771,class72,0.326,0.163,DISCARD,low_score
42.14,772,class39,0.742,0.371,DISCARD,low_score
42.14,772,class39,0.74,0.37,DISCARD,low_score
42.14,772,class39,0.635,0.318,DISCARD,low_score
42.14,772,class39,0.547,0.273,DISCARD,low_score
42.14,772,class39,0.413,0.207,DISCARD,low_score
42.14,772,class72,0.27,0.135,DISCARD,low_score
42.195,773,class39,0.816,0.408,DISCARD,low_score
42.195,773,class39,0.733,0.366,DISCARD,low_score
42.195,773,class39,0.617,0.308,DISCARD,low_score
42.195,773,class39,0.556,0.278,DISCARD,low_score
42.195,773,class72,0.329,0.165,DISCARD,low_score
42.25,774,class39,0.797,0.398,DISCARD,low_score
42.25,774,class39,0.776,0.388,DISCARD,low_score
42.25,774,class39,0.73,0.365,DISCARD,low_score
42.25,774,class39,0.684,0.342,DISCARD,low_score
42.25,774,class39,0.363,0.181,DISCARD,low_score
42.304,775,class39,0.797,0.398,DISCARD,low_score
42.304,775,class39,0.763,0.382,DISCARD,low_score
42.304,775,class39,0.761,0.38,DISCARD,low_score
42.304,775,class39,0.622,0.311,DISCARD,low_score
42.36,776,class39,0.835,0.418,DISCARD,low_score
42.36,776,class39,0.793,0.397,DISCARD,low_score
42.36,776,class39,0.787,0.393,DISCARD,low_score
42.36,776,class39,0.619,0.309,DISCARD,low_score
42.415,777,class39,0.827,0.413,DISCARD,low_score
42.415,777,class39,0.804,0.402,DISCARD,low_score
42.415,777,class39,0.794,0.397,DISCARD,low_score
42.415,777,class39,0.684,0.342,DISCARD,low_score
42.47,778,class39,0.837,0.418,DISCARD,low_score
42.47,778,class39,0.829,0.414,DISCARD,low_score
42.47,778,class39,0.815,0.408,DISCARD,low_score
42.47,778,class39,0.566,0.283,DISCARD,low_score
42.524,779,class39,0.853,0.426,DISCARD,low_score
42.524,779,class39,0.807,0.403,DISCARD,low_score
42.524,779,class39,0.745,0.372,DISCARD,low_score
42.524,779,class39,0.707,0.354,DISCARD,low_score
42.579,780,class39,0.83,0.415,DISCARD,low_score
42.579,780,class39,0.813,0.406,DISCARD,low_score
42.579,780,class39,0.776,0.388,DISCARD,low_score
42.579,780,class39,0.714,0.357,DISCARD,low_score
42.579,780,class39,0.432,0.216,DISCARD,low_score
42.634,781,class39,0.868,0.434,DISCARD,low_score
42.634,781,class39,0.77,0.385,DISCARD,low_score
42.634,781,class39,0.769,0.385,DISCARD,low_score
42.634,781,class39,0.707,0.354,DISCARD,low_score
42.688,782,class39,0.867,0.434,DISCARD,low_score
42.688,782,class39,0.807,0.403,DISCARD,low_score
42.688,782,class39,0.781,0.391,DISCARD,low_score
42.688,782,class39,0.746,0.373,DISCARD,low_score
42.688,782,class39,0.252,0.126,DISCARD,low_score
42.743,783,class39,0.83,0.415,DISCARD,low_score
42.743,783,class39,0.794,0.397,DISCARD,low_score
42.743,783,class39,0.769,0.385,DISCARD,low_score
42.743,783,class39,0.686,0.343,DISCARD,low_score
42.798,784,class39,0.892,0.446,DISCARD,low_score
42.798,784,class39,0.821,0.411,DISCARD,low_score
42.798,784,class39,0.802,0.401,DISCARD,low_score
42.798,784,class39,0.644,0.322,DISCARD,low_score
42.798,784,class39,0.367,0.183,DISCARD,low_score
42.853,785,class39,0.823,0.412,DISCARD,low_score
42.853,785,class39,0.81,0.405,DISCARD,low_score
42.853,785,class39,0.802,0.401,DISCARD,low_score
42.853,785,class39,0.709,0.355,DISCARD,low_score
42.907,786,class39,0.824,0.412,DISCARD,low_score
42.907,786,class39,0.798,0.399,DISCARD,low_score
42.907,786,class39,0.788,0.394,DISCARD,low_score
42.907,786,class39,0.701,0.35,DISCARD,low_score
42.962,787,class39,0.837,0.418,DISCARD,low_score
42.962,787,class39,0.815,0.408,DISCARD,low_score
42.962,787,class39,0.793,0.397,DISCARD,low_score
42.962,787,class39,0.745,0.372,DISCARD,low_score
43.016,788,class39,0.806,0.403,DISCARD,low_score
43.016,788,class39,0.802,0.401,DISCARD,low_score
43.016,788,class39,0.799,0.4,DISCARD,low_score
43.016,788,class39,0.694,0.347,DISCARD,low_score
43.016,788,class39,0.335,0.167,DISCARD,low_score
43.071,789,class39,0.806,0.403,DISCARD,low_score
43.071,789,class39,0.742,0.371,DISCARD,low_score
43.071,789,class39,0.684,0.342,DISCARD,low_score
43.071,789,class39,0.504,0.252,DISCARD,low_score
43.071,789,class39,0.306,0.153,DISCARD,low_score
43.126,790,class39,0.814,0.407,DISCARD,low_score
43.126,790,class39,0.737,0.369,DISCARD,low_score
43.126,790,class39,0.728,0.364,DISCARD,low_score
43.126,790,class39,0.564,0.282,DISCARD,low_score
43.126,790,class39,0.302,0.151,DISCARD,low_score
43.181,791,class39,0.799,0.4,DISCARD,low_score
43.181,791,class39,0.78,0.39,DISCARD,low_score
43.181,791,class39,0.759,0.38,DISCARD,low_score
43.181,791,class39,0.587,0.293,DISCARD,low_score
43.236,792,class39,0.787,0.393,DISCARD,low_score
43.236,792,class39,0.731,0.366,DISCARD,low_score
43.236,792,class39,0.558,0.279,DISCARD,low_score
43.236,792,class39,0.529,0.265,DISCARD,low_score
43.236,792,class39,0.402,0.201,DISCARD,low_score
43.29,793,class39,0.707,0.354,DISCARD,low_score
43.29,793,class39,0.674,0.337,DISCARD,low_score
43.29,793,class39,0.434,0.217,DISCARD,low_score
43.29,793,class39,0.419,0.209,DISCARD,low_score
43.29,793,class39,0.347,0.173,DISCARD,low_score
43.345,794,class39,0.644,0.322,DISCARD,low_score
43.345,794,class39,0.525,0.263,DISCARD,low_score
43.399,795,class39,0.698,0.349,DISCARD,low_score
43.399,795,class39,0.585,0.293,DISCARD,low_score
43.399,795,class39,0.459,0.23,DISCARD,low_score
43.454,796,class39,0.776,0.388,DISCARD,low_score
43.454,796,class39,0.74,0.37,DISCARD,low_score
43.454,796,class39,0.73,0.365,DISCARD,low_score
43.454,796,class39,0.712,0.356,DISCARD,low_score
43.509,797,class39,0.766,0.383,DISCARD,low_score
43.509,797,class39,0.762,0.381,DISCARD,low_score
43.509,797,class39,0.752,0.376,DISCARD,low_score
43.509,797,class39,0.61,0.305,DISCARD,low_score
43.509,797,class39,0.432,0.216,DISCARD,low_score
43.509,797,class39,0.257,0.128,DISCARD,low_score
43.564,798,class39,0.82,0.41,DISCARD,low_score
43.564,798,class39,0.765,0.382,DISCARD,low_score
43.564,798,class39,0.709,0.355,DISCARD,low_score
43.564,798,class39,0.551,0.275,DISCARD,low_score
43.564,798,class39,0.415,0.207,DISCARD,low_score
43.564,798,class72,0.251,0.125,DISCARD,low_score
43.62,799,class39,0.81,0.405,DISCARD,low_score
43.62,799,class39,0.766,0.383,DISCARD,low_score
43.62,799,class39,0.543,0.271,DISCARD,low_score
43.62,799,class39,0.525,0.263,DISCARD,low_score
43.62,799,class72,0.4,0.2,DISCARD,low_score
43.674,800,class39,0.787,0.393,DISCARD,low_score
43.674,800,class39,0.739,0.369,DISCARD,low_score
43.674,800,class39,0.504,0.252,DISCARD,low_score
43.674,800,class39,0.502,0.251,DISCARD,low_score
43.674,800,class72,0.411,0.206,DISCARD,low_score
43.729,801,class39,0.665,0.333,DISCARD,low_score
43.729,801,class72,0.622,0.311,DISCARD,low_score
43.729,801,class39,0.587,0.293,DISCARD,low_score
43.729,801,class39,0.529,0.265,DISCARD,low_score
43.729,801,class39,0.471,0.235,DISCARD,low_score
43.784,802,class39,0.755,0.377,DISCARD,low_score
43.784,802,class56,0.335,0.168,DISCARD,low_score
43.784,802,class39,0.319,0.16,DISCARD,low_score
43.784,802,class72,0.301,0.15,DISCARD,low_score
43.839,803,class39,0.676,0.338,DISCARD,low_score
43.839,803,class56,0.459,0.23,DISCARD,low_score
43.839,803,class39,0.407,0.204,DISCARD,low_score
43.839,803,class72,0.372,0.186,DISCARD,low_score
43.839,803,class39,0.359,0.18,DISCARD,low_score
43.839,803,class39,0.342,0.171,DISCARD,low_score
43.839,803,class39,0.312,0.156,DISCARD,low_score
43.839,803,class39,0.275,0.138,DISCARD,low_score
43.839,803,class56,0.263,0.131,DISCARD,low_score
43.894,804,class56,0.683,0.341,DISCARD,low_score
43.894,804,class39,0.446,0.223,DISCARD,low_score
43.894,804,class56,0.356,0.178,DISCARD,low_score
43.894,804,class39,0.352,0.176,DISCARD,low_score
43.894,804,class39,0.333,0.166,DISCARD,low_score
43.894,804,class72,0.297,0.149,DISCARD,low_score
43.949,805,class56,0.707,0.354,DISCARD,low_score
43.949,805,class39,0.438,0.219,DISCARD,low_score
43.949,805,class39,0.285,0.142,DISCARD,low_score
43.949,805,class72,0.285,0.142,DISCARD,low_score
43.949,805,class56,0.261,0.13,DISCARD,low_score
44.004,806,class56,0.78,0.39,DISCARD,low_score
44.004,806,class72,0.398,0.199,DISCARD,low_score
44.058,807,class56,0.637,0.319,DISCARD,low_score
44.058,807,class56,0.422,0.211,DISCARD,low_score
44.058,807,class72,0.291,0.145,DISCARD,low_score
44.113,808,class56,0.726,0.363,DISCARD,low_score
44.113,808,class56,0.457,0.229,DISCARD,low_score
44.167,809,class56,0.628,0.314,DISCARD,low_score
44.167,809,class56,0.307,0.153,DISCARD,low_score
44.221,810,class56,0.839,0.419,DISCARD,low_score
44.221,810,class56,0.314,0.157,DISCARD,low_score
44.275,811,class56,0.815,0.408,DISCARD,low_score
44.275,811,class56,0.613,0.307,DISCARD,low_score
44.275,811,class26,0.424,0.212,DISCARD,low_score
44.329,812,class56,0.86,0.43,DISCARD,low_score
44.329,812,class26,0.424,0.212,DISCARD,low_score
44.329,812,class56,0.361,0.181,DISCARD,low_score
44.384,813,class56,0.931,0.465,DISCARD,bandwidth
44.384,813,class26,0.508,0.254,DISCARD,low_score
44.384,813,class56,0.311,0.155,DISCARD,low_score
44.384,813,class72,0.285,0.142,DISCARD,low_score
44.439,814,class56,0.901,0.451,DISCARD,bandwidth
44.439,814,class26,0.547,0.273,DISCARD,low_score
44.439,814,class56,0.396,0.198,DISCARD,low_score
44.493,815,class56,0.828,0.414,DISCARD,low_score
44.493,815,class56,0.551,0.275,DISCARD,low_score
44.493,815,class26,0.514,0.257,DISCARD,low_score
44.493,815,class39,0.329,0.165,DISCARD,low_score
44.548,816,class56,0.9,0.45,DISCARD,low_score
44.548,816,class56,0.502,0.251,DISCARD,low_score
44.548,816,class26,0.438,0.219,DISCARD,low_score
44.548,816,class45,0.254,0.127,DISCARD,low_score
44.602,817,class56,0.874,0.437,DISCARD,low_score
44.602,817,class26,0.492,0.246,DISCARD,low_score
44.602,817,class56,0.393,0.197,DISCARD,low_score
44.657,818,class56,0.893,0.446,DISCARD,low_score
44.657,818,class26,0.585,0.293,DISCARD,low_score
44.657,818,class56,0.467,0.233,DISCARD,low_score
44.711,819,class56,0.877,0.438,DISCARD,low_score
44.711,819,class26,0.457,0.229,DISCARD,low_score
44.711,819,class56,0.402,0.201,DISCARD,low_score
44.711,819,class28,0.343,0.172,DISCARD,low_score
44.711,819,class56,0.323,0.161,DISCARD,low_score
44.711,819,class45,0.267,0.134,DISCARD,low_score
44.766,820,class56,0.833,0.417,DISCARD,low_score
44.766,820,class56,0.585,0.293,DISCARD,low_score
44.766,820,class26,0.547,0.273,DISCARD,low_score
44.766,820,class28,0.521,0.261,DISCARD,low_score
44.766,820,class45,0.252,0.126,DISCARD,low_score
44.821,821,class56,0.849,0.424,DISCARD,low_score
44.821,821,class28,0.742,0.371,DISCARD,low_score
44.821,821,class56,0.411,0.206,DISCARD,low_score
44.821,821,class56,0.295,0.148,DISCARD,low_score
44.875,822,class56,0.781,0.391,DISCARD,low_score
44.875,822,class28,0.662,0.331,DISCARD,low_score
44.875,822,class56,0.585,0.293,DISCARD,low_score
44.929,823,class56,0.688,0.344,DISCARD,low_score
44.929,823,class56,0.585,0.293,DISCARD,low_score
44.929,823,class26,0.523,0.262,DISCARD,low_score
44.929,823,class28,0.469,0.234,DISCARD,low_score
44.984,824,class56,0.803,0.402,DISCARD,low_score
44.984,824,class28,0.667,0.334,DISCARD,low_score
44.984,824,class72,0.359,0.18,DISCARD,low_score
44.984,824,class60,0.334,0.167,DISCARD,low_score
44.984,824,class56,0.285,0.143,DISCARD,low_score
45.041,825,class56,0.773,0.387,DISCARD,low_score
45.041,825,class28,0.707,0.354,DISCARD,low_score
45.041,825,class72,0.4,0.2,DISCARD,low_score
45.041,825,class60,0.265,0.133,DISCARD,low_score
45.096,826,class56,0.743,0.372,DISCARD,low_score
45.096,826,class28,0.523,0.262,DISCARD,low_score
45.096,826,class26,0.469,0.234,DISCARD,low_score
45.096,826,class72,0.404,0.202,DISCARD,low_score
45.15,827,class56,0.725,0.362,DISCARD,low_score
45.15,827,class28,0.628,0.314,DISCARD,low_score
45.15,827,class26,0.459,0.23,DISCARD,low_score
45.204,828,class56,0.686,0.343,DISCARD,low_score
45.204,828,class28,0.684,0.342,DISCARD,low_score
45.204,828,class26,0.469,0.234,DISCARD,low_score
45.204,828,class45,0.409,0.205,DISCARD,low_score
45.204,828,class72,0.328,0.164,DISCARD,low_score
45.259,829,class28,0.756,0.378,DISCARD,low_score
45.259,829,class56,0.61,0.305,DISCARD,low_score
45.259,829,class72,0.394,0.197,DISCARD,low_score
45.259,829,class45,0.278,0.139,DISCARD,low_score
45.313,830,class28,0.734,0.367,DISCARD,low_score
45.313,830,class56,0.43,0.215,DISCARD,low_score
45.313,830,class72,0.306,0.153,DISCARD,low_score
45.368,831,class28,0.72,0.36,DISCARD,low_score
45.368,831,class72,0.51,0.255,DISCARD,low_score
45.434,832,class28,0.686,0.343,DISCARD,low_score
45.434,832,class72,0.549,0.274,DISCARD,low_score
45.489,833,class28,0.479,0.239,DISCARD,low_score
45.489,833,class26,0.451,0.226,DISCARD,low_score
45.489,833,class56,0.288,0.144,DISCARD,low_score
45.489,833,class72,0.252,0.126,DISCARD,low_score
45.544,834,class56,0.516,0.258,DISCARD,low_score
45.544,834,class26,0.506,0.253,DISCARD,low_score
45.544,834,class28,0.444,0.222,DISCARD,low_score
45.598,835,class28,0.644,0.322,DISCARD,low_score
45.598,835,class56,0.577,0.289,DISCARD,low_score
45.598,835,class26,0.415,0.207,DISCARD,low_score
45.652,836,class56,0.644,0.322,DISCARD,low_score
45.652,836,class28,0.633,0.317,DISCARD,low_score
45.706,837,class56,0.756,0.378,DISCARD,low_score
45.706,837,class28,0.512,0.256,DISCARD,low_score
45.706,837,class26,0.345,0.173,DISCARD,low_score
45.761,838,class56,0.838,0.419,DISCARD,low_score
45.761,838,class26,0.465,0.232,DISCARD,low_score
45.761,838,class60,0.402,0.201,DISCARD,low_score
45.761,838,class28,0.262,0.131,DISCARD,low_score
45.815,839,class56,0.84,0.42,DISCARD,low_score
45.815,839,class26,0.566,0.283,DISCARD,low_score
45.815,839,class60,0.305,0.152,DISCARD,low_score
45.815,839,class56,0.281,0.14,DISCARD,low_score
45.87,840,class56,0.877,0.438,DISCARD,low_score
45.87,840,class28,0.622,0.311,DISCARD,low_score
45.924,841,class56,0.733,0.366,DISCARD,low_score
45.924,841,class28,0.632,0.316,DISCARD,low_score
45.978,842,class56,0.897,0.448,DISCARD,low_score
45.978,842,class28,0.269,0.134,DISCARD,low_score
46.032,843,class56,0.875,0.437,DISCARD,low_score
46.032,843,class26,0.428,0.214,DISCARD,low_score
46.086,844,class56,0.901,0.451,DISCARD,bandwidth
46.086,844,class56,0.37,0.185,DISCARD,low_score
46.086,844,class26,0.324,0.162,DISCARD,low_score
46.086,844,class56,0.319,0.16,DISCARD,low_score
46.14,845,class56,0.874,0.437,DISCARD,low_score
46.14,845,class26,0.533,0.267,DISCARD,low_score
46.14,845,class56,0.486,0.243,DISCARD,low_score
46.14,845,class56,0.281,0.141,DISCARD,low_score
46.195,846,class56,0.908,0.454,DISCARD,bandwidth
46.195,846,class26,0.502,0.251,DISCARD,low_score
46.195,846,class0,0.439,0.219,DISCARD,low_score
46.195,846,class56,0.273,0.136,DISCARD,low_score
46.195,846,class28,0.26,0.13,DISCARD,low_score
46.25,847,class56,0.855,0.427,DISCARD,low_score
46.25,847,class28,0.423,0.211,DISCARD,low_score
46.304,848,class56,0.871,0.435,DISCARD,low_score
46.304,848,class28,0.516,0.258,DISCARD,low_score
46.358,849,class56,0.78,0.39,DISCARD,low_score
46.358,849,class28,0.585,0.293,DISCARD,low_score
46.358,849,class72,0.289,0.145,DISCARD,low_score
46.415,850,class56,0.818,0.409,DISCARD,low_score
46.469,851,class56,0.818,0.409,DISCARD,low_score
46.523,852,class56,0.595,0.297,DISCARD,low_score
46.577,853,class56,0.773,0.387,DISCARD,low_score
46.631,854,class56,0.789,0.395,DISCARD,low_score
46.631,854,class56,0.284,0.142,DISCARD,low_score
46.685,855,class56,0.815,0.408,DISCARD,low_score
46.685,855,class62,0.392,0.196,DISCARD,low_score
46.739,856,class56,0.784,0.392,DISCARD,low_score
46.793,857,class56,0.731,0.366,DISCARD,low_score
46.847,858,class56,0.453,0.227,DISCARD,low_score
46.901,859,class62,0.302,0.151,DISCARD,low_score
46.901,859,class56,0.286,0.143,DISCARD,low_score
46.955,860,class56,0.381,0.191,DISCARD,low_score
47.164,864,class62,0.277,0.138,DISCARD,low_score
47.269,866,class71,0.314,0.157,DISCARD,low_score
47.269,866,class58,0.307,0.154,DISCARD,low_score
47.324,867,class62,0.304,0.152,DISCARD,low_score
47.324,867,class62,0.296,0.148,DISCARD,low_score
47.378,868,class56,0.271,0.136,DISCARD,low_score
47.432,869,class56,0.615,0.308,DISCARD,low_score
47.486,870,class56,0.398,0.199,DISCARD,low_score
47.54,871,class71,0.261,0.131,DISCARD,low_score
47.698,874,class71,0.323,0.161,DISCARD,low_score
47.857,877,class0,0.299,0.15,DISCARD,low_score
48.168,883,class56,0.274,0.137,DISCARD,low_score
48.222,884,class0,0.639,0.319,DISCARD,low_score
48.275,885,class0,0.286,0.143,DISCARD,low_score
48.382,887,class61,0.421,0.21,DISCARD,low_score
48.436,888,class61,0.333,0.166,DISCARD,low_score
48.542,890,class72,0.428,0.214,DISCARD,low_score
48.542,890,class72,0.299,0.15,DISCARD,low_score
48.596,891,class72,0.502,0.251,DISCARD,low_score
48.702,893,class72,0.644,0.322,DISCARD,low_score
48.807,895,class72,0.323,0.161,DISCARD,low_score
48.861,896,class72,0.451,0.226,DISCARD,low_score
48.915,897,class72,0.554,0.277,DISCARD,low_score
48.969,898,class61,0.396,0.198,DISCARD,low_score
49.022,899,class61,0.324,0.162,DISCARD,low_score
49.076,900,class61,0.683,0.341,DISCARD,low_score
49.13,901,class61,0.39,0.195,DISCARD,low_score
