t,frame,name,conf,score,decision,reason
65.989,1494,class45,0.759,0.38,KEEP,priority+bandwidth_ok
65.989,1494,class39,0.626,0.313,DISCARD,low_score
65.989,1494,class45,0.498,0.249,DISCARD,low_score
65.989,1494,class41,0.475,0.237,DISCARD,low_score
65.989,1494,class45,0.352,0.176,DISCARD,low_score
66.074,1496,class59,0.844,0.422,KEEP,priority+bandwidth_ok
66.074,1496,class45,0.736,0.368,KEEP,priority+bandwidth_ok
66.074,1496,class45,0.704,0.352,KEEP,priority+bandwidth_ok
66.074,1496,class39,0.691,0.345,DISCARD,low_score
66.16,1498,class59,0.835,0.418,KEEP,priority+bandwidth_ok
66.16,1498,class39,0.756,0.378,KEEP,priority+bandwidth_ok
66.16,1498,class45,0.674,0.337,DISCARD,low_score
66.16,1498,class45,0.658,0.329,DISCARD,low_score
66.16,1498,class45,0.549,0.274,DISCARD,low_score
66.16,1498,class41,0.363,0.181,DISCARD,low_score
66.16,1498,class45,0.251,0.125,DISCARD,low_score
66.248,1500,class59,0.819,0.409,KEEP,priority+bandwidth_ok
66.248,1500,class45,0.803,0.402,KEEP,priority+bandwidth_ok
66.248,1500,class45,0.66,0.33,DISCARD,low_score
66.248,1500,class45,0.484,0.242,DISCARD,low_score
66.248,1500,class39,0.467,0.233,DISCARD,low_score
66.248,1500,class41,0.442,0.221,DISCARD,low_score
66.248,1500,class45,0.302,0.151,DISCARD,low_score
66.333,1502,class59,0.84,0.42,KEEP,priority+bandwidth_ok
66.333,1502,class45,0.807,0.403,KEEP,priority+bandwidth_ok
66.333,1502,class45,0.657,0.328,DISCARD,low_score
66.333,1502,class39,0.633,0.317,DISCARD,low_score
66.333,1502,class41,0.564,0.282,DISCARD,low_score
66.333,1502,class45,0.333,0.166,DISCARD,low_score
66.418,1504,class45,0.854,0.427,KEEP,priority+bandwidth_ok
66.418,1504,class59,0.814,0.407,KEEP,priority+bandwidth_ok
66.418,1504,class45,0.758,0.379,KEEP,priority+bandwidth_ok
66.418,1504,class39,0.66,0.33,DISCARD,low_score
66.418,1504,class41,0.484,0.242,DISCARD,low_score
66.503,1506,class59,0.862,0.431,KEEP,priority+bandwidth_ok
66.503,1506,class45,0.766,0.383,KEEP,priority+bandwidth_ok
66.503,1506,class45,0.752,0.376,KEEP,priority+bandwidth_ok
66.503,1506,class39,0.595,0.297,DISCARD,low_score
66.503,1506,class45,0.361,0.181,DISCARD,low_score
66.503,1506,class39,0.277,0.138,DISCARD,low_score
66.588,1508,class59,0.768,0.384,KEEP,priority+bandwidth_ok
66.588,1508,class45,0.761,0.38,KEEP,priority+bandwidth_ok
66.588,1508,class45,0.681,0.34,DISCARD,low_score
66.588,1508,class39,0.608,0.304,DISCARD,low_score
66.588,1508,class41,0.469,0.234,DISCARD,low_score
66.672,1510,class45,0.821,0.411,KEEP,priority+bandwidth_ok
66.672,1510,class59,0.791,0.395,KEEP,priority+bandwidth_ok
66.672,1510,class45,0.674,0.337,DISCARD,low_score
66.672,1510,class39,0.564,0.282,DISCARD,low_score
66.672,1510,class41,0.309,0.155,DISCARD,low_score
66.672,1510,class41,0.294,0.147,DISCARD,low_score
66.757,1512,class45,0.814,0.407,KEEP,priority+bandwidth_ok
66.757,1512,class59,0.81,0.405,KEEP,priority+bandwidth_ok
66.757,1512,class45,0.637,0.319,DISCARD,low_score
66.757,1512,class39,0.628,0.314,DISCARD,low_score
66.757,1512,class41,0.266,0.133,DISCARD,low_score
66.845,1514,class59,0.807,0.403,KEEP,priority+bandwidth_ok
66.845,1514,class45,0.799,0.4,KEEP,priority+bandwidth_ok
66.845,1514,class45,0.684,0.342,DISCARD,low_score
66.845,1514,class39,0.572,0.286,DISCARD,low_score
66.845,1514,class41,0.37,0.185,DISCARD,low_score
66.845,1514,class41,0.297,0.149,DISCARD,low_score
66.93,1516,class45,0.799,0.4,KEEP,priority+bandwidth_ok
66.93,1516,class59,0.759,0.38,KEEP,priority+bandwidth_ok
66.93,1516,class39,0.739,0.369,KEEP,priority+bandwidth_ok
66.93,1516,class45,0.711,0.355,KEEP,priority+bandwidth_ok
66.93,1516,class41,0.407,0.204,DISCARD,low_score
66.93,1516,class45,0.307,0.154,DISCARD,low_score
66.93,1516,class41,0.285,0.142,DISCARD,low_score
67.014,1518,class45,0.816,0.408,KEEP,priority+bandwidth_ok
67.014,1518,class45,0.809,0.405,KEEP,priority+bandwidth_ok
67.014,1518,class59,0.746,0.373,KEEP,priority+bandwidth_ok
67.014,1518,class39,0.734,0.367,KEEP,priority+bandwidth_ok
67.014,1518,class45,0.34,0.17,DISCARD,low_score
67.014,1518,class41,0.264,0.132,DISCARD,low_score
67.099,1520,class45,0.807,0.403,KEEP,priority+bandwidth_ok
67.099,1520,class45,0.694,0.347,DISCARD,low_score
67.099,1520,class59,0.653,0.327,DISCARD,low_score
67.099,1520,class57,0.556,0.278,DISCARD,low_score
67.099,1520,class39,0.479,0.239,DISCARD,low_score
67.099,1520,class45,0.361,0.181,DISCARD,low_score
67.185,1522,class59,0.733,0.366,KEEP,priority+bandwidth_ok
67.185,1522,class45,0.728,0.364,KEEP,priority+bandwidth_ok
67.185,1522,class39,0.679,0.34,DISCARD,low_score
67.185,1522,class45,0.596,0.298,DISCARD,low_score
67.185,1522,class57,0.484,0.242,DISCARD,low_score
67.269,1524,class45,0.806,0.403,KEEP,priority+bandwidth_ok
67.269,1524,class59,0.794,0.397,KEEP,priority+bandwidth_ok
67.269,1524,class39,0.693,0.346,DISCARD,low_score
67.269,1524,class45,0.628,0.314,DISCARD,low_score
67.354,1526,class59,0.844,0.422,KEEP,priority+bandwidth_ok
67.354,1526,class45,0.715,0.358,KEEP,priority+bandwidth_ok
67.354,1526,class45,0.615,0.308,DISCARD,low_score
67.354,1526,class39,0.52,0.26,DISCARD,low_score
67.354,1526,class41,0.512,0.256,DISCARD,low_score
67.354,1526,class45,0.426,0.213,DISCARD,low_score
67.354,1526,class16,0.291,0.145,DISCARD,low_score
67.439,1528,class57,0.756,0.378,KEEP,priority+bandwidth_ok
67.439,1528,class59,0.679,0.34,DISCARD,low_score
67.439,1528,class39,0.407,0.204,DISCARD,low_score
67.439,1528,class45,0.314,0.157,DISCARD,low_score
67.524,1530,class45,0.81,0.405,KEEP,priority+bandwidth_ok
67.524,1530,class59,0.703,0.351,KEEP,priority+bandwidth_ok
67.524,1530,class57,0.679,0.34,DISCARD,low_score
67.524,1530,class45,0.549,0.274,DISCARD,low_score
67.524,1530,class39,0.512,0.256,DISCARD,low_score
67.524,1530,class41,0.383,0.192,DISCARD,low_score
67.608,1532,class59,0.857,0.428,KEEP,priority+bandwidth_ok
67.608,1532,class45,0.843,0.421,KEEP,priority+bandwidth_ok
67.608,1532,class45,0.624,0.312,DISCARD,low_score
67.608,1532,class41,0.329,0.165,DISCARD,low_score
67.693,1534,class59,0.887,0.444,KEEP,priority+bandwidth_ok
67.693,1534,class45,0.733,0.366,KEEP,priority+bandwidth_ok
67.693,1534,class45,0.521,0.261,DISCARD,low_score
67.777,1536,class59,0.851,0.425,KEEP,priority+bandwidth_ok
67.777,1536,class45,0.688,0.344,DISCARD,low_score
67.777,1536,class45,0.626,0.313,DISCARD,low_score
67.777,1536,class45,0.374,0.187,DISCARD,low_score
67.777,1536,class16,0.258,0.129,DISCARD,low_score
67.863,1538,class45,0.633,0.317,DISCARD,low_score
67.863,1538,class59,0.614,0.307,DISCARD,low_score
67.863,1538,class45,0.494,0.247,DISCARD,low_score
67.948,1540,class59,0.797,0.398,KEEP,priority+bandwidth_ok
67.948,1540,class45,0.758,0.379,KEEP,priority+bandwidth_ok
67.948,1540,class45,0.514,0.257,DISCARD,low_score
67.948,1540,class16,0.392,0.196,DISCARD,low_score
68.032,1542,class59,0.671,0.335,DISCARD,low_score
68.032,1542,class45,0.662,0.331,DISCARD,low_score
68.032,1542,class45,0.457,0.229,DISCARD,low_score
68.116,1544,class45,0.761,0.38,KEEP,priority+bandwidth_ok
68.116,1544,class59,0.698,0.349,DISCARD,low_score
68.116,1544,class45,0.566,0.283,DISCARD,low_score
68.116,1544,class60,0.272,0.136,DISCARD,low_score
68.201,1546,class59,0.746,0.373,KEEP,priority+bandwidth_ok
68.201,1546,class45,0.679,0.34,DISCARD,low_score
68.201,1546,class45,0.591,0.295,DISCARD,low_score
68.201,1546,class60,0.335,0.167,DISCARD,low_score
68.286,1548,class45,0.78,0.39,KEEP,priority+bandwidth_ok
68.286,1548,class59,0.707,0.354,KEEP,priority+bandwidth_ok
68.286,1548,class45,0.593,0.296,DISCARD,low_score
68.286,1548,class60,0.305,0.152,DISCARD,low_score
68.286,1548,class45,0.251,0.125,DISCARD,low_score
68.37,1550,class59,0.804,0.402,KEEP,priority+bandwidth_ok
68.37,1550,class45,0.554,0.277,DISCARD,low_score
68.37,1550,class60,0.31,0.155,DISCARD,low_score
68.37,1550,class45,0.309,0.155,DISCARD,low_score
68.37,1550,class45,0.306,0.153,DISCARD,low_score
68.459,1552,class59,0.595,0.297,DISCARD,low_score
68.459,1552,class45,0.579,0.29,DISCARD,low_score
68.459,1552,class45,0.504,0.252,DISCARD,low_score
68.459,1552,class56,0.457,0.229,DISCARD,low_score
68.459,1552,class60,0.431,0.216,DISCARD,low_score
68.459,1552,class16,0.419,0.209,DISCARD,low_score
68.459,1552,class41,0.309,0.155,DISCARD,low_score
68.544,1554,class59,0.854,0.427,KEEP,priority+bandwidth_ok
68.544,1554,class45,0.667,0.334,DISCARD,low_score
68.544,1554,class56,0.475,0.237,DISCARD,low_score
68.544,1554,class60,0.455,0.228,DISCARD,low_score
68.628,1556,class59,0.602,0.301,DISCARD,low_score
68.628,1556,class45,0.494,0.247,DISCARD,low_score
68.628,1556,class45,0.381,0.191,DISCARD,low_score
68.628,1556,class56,0.367,0.184,DISCARD,low_score
68.628,1556,class60,0.329,0.164,DISCARD,low_score
68.713,1558,class56,0.626,0.313,DISCARD,low_score
68.713,1558,class45,0.488,0.244,DISCARD,low_score
68.713,1558,class60,0.376,0.188,DISCARD,low_score
68.797,1560,class59,0.677,0.339,DISCARD,low_score
68.797,1560,class56,0.486,0.243,DISCARD,low_score
68.797,1560,class41,0.383,0.192,DISCARD,low_score
68.797,1560,class60,0.257,0.128,DISCARD,low_score
68.882,1562,class60,0.384,0.192,DISCARD,low_score
68.882,1562,class56,0.329,0.164,DISCARD,low_score
68.882,1562,class45,0.309,0.155,DISCARD,low_score
68.966,1564,class56,0.677,0.339,DISCARD,low_score
68.966,1564,class59,0.442,0.221,DISCARD,low_score
68.966,1564,class45,0.43,0.215,DISCARD,low_score
68.966,1564,class60,0.264,0.132,DISCARD,low_score
69.054,1566,class59,0.541,0.27,DISCARD,low_score
69.054,1566,class56,0.494,0.247,DISCARD,low_score
69.054,1566,class56,0.401,0.2,DISCARD,low_score
69.054,1566,class45,0.345,0.173,DISCARD,low_score
69.139,1568,class59,0.466,0.233,DISCARD,low_score
69.139,1568,class56,0.358,0.179,DISCARD,low_score
69.139,1568,class56,0.35,0.175,DISCARD,low_score
69.139,1568,class45,0.307,0.154,DISCARD,low_score
69.139,1568,class59,0.266,0.133,DISCARD,low_score
69.224,1570,class59,0.689,0.345,DISCARD,low_score
69.224,1570,class56,0.615,0.308,DISCARD,low_score
69.224,1570,class56,0.564,0.282,DISCARD,low_score
69.224,1570,class45,0.498,0.249,DISCARD,low_score
69.308,1572,class59,0.765,0.382,KEEP,priority+bandwidth_ok
69.308,1572,class45,0.604,0.302,DISCARD,low_score
69.308,1572,class56,0.529,0.265,DISCARD,low_score
69.308,1572,class16,0.506,0.253,DISCARD,low_score
69.308,1572,class56,0.405,0.203,DISCARD,low_score
69.393,1574,class59,0.476,0.238,DISCARD,low_score
69.393,1574,class56,0.303,0.152,DISCARD,low_score
69.479,1576,class59,0.453,0.227,DISCARD,low_score
69.479,1576,class56,0.341,0.17,DISCARD,low_score
69.564,1578,class59,0.822,0.411,KEEP,priority+bandwidth_ok
69.564,1578,class41,0.385,0.192,DISCARD,low_score
69.648,1580,class59,0.731,0.366,KEEP,priority+bandwidth_ok
69.731,1582,class59,0.848,0.424,KEEP,priority+bandwidth_ok
69.815,1584,class59,0.779,0.389,KEEP,priority+bandwidth_ok
69.815,1584,class15,0.27,0.135,DISCARD,low_score
69.899,1586,class59,0.749,0.375,KEEP,priority+bandwidth_ok
69.982,1588,class59,0.669,0.334,DISCARD,low_score
70.07,1590,class45,0.783,0.391,KEEP,priority+bandwidth_ok
70.07,1590,class45,0.761,0.38,KEEP,priority+bandwidth_ok
70.07,1590,class59,0.676,0.338,DISCARD,low_score
70.07,1590,class57,0.447,0.224,DISCARD,low_score
70.07,1590,class60,0.277,0.138,DISCARD,low_score
70.07,1590,class41,0.264,0.132,DISCARD,low_score
70.156,1592,class45,0.789,0.395,KEEP,priority+bandwidth_ok
70.156,1592,class59,0.72,0.36,KEEP,priority+bandwidth_ok
70.156,1592,class45,0.591,0.295,DISCARD,low_score
70.156,1592,class57,0.543,0.271,DISCARD,low_score
70.156,1592,class41,0.465,0.232,DISCARD,low_score
70.156,1592,class16,0.254,0.127,DISCARD,low_score
70.241,1594,class59,0.87,0.435,KEEP,priority+bandwidth_ok
70.241,1594,class45,0.756,0.378,KEEP,priority+bandwidth_ok
70.241,1594,class45,0.595,0.297,DISCARD,low_score
70.241,1594,class57,0.547,0.273,DISCARD,low_score
70.241,1594,class45,0.319,0.16,DISCARD,low_score
70.241,1594,class41,0.312,0.156,DISCARD,low_score
70.325,1596,class59,0.862,0.431,KEEP,priority+bandwidth_ok
70.325,1596,class45,0.838,0.419,KEEP,priority+bandwidth_ok
70.325,1596,class45,0.658,0.329,DISCARD,low_score
70.325,1596,class16,0.309,0.155,DISCARD,low_score
70.325,1596,class45,0.285,0.142,DISCARD,low_score
70.41,1598,class59,0.834,0.417,KEEP,priority+bandwidth_ok
70.41,1598,class45,0.821,0.411,KEEP,priority+bandwidth_ok
70.41,1598,class45,0.657,0.328,DISCARD,low_score
70.501,1600,class59,0.819,0.409,KEEP,priority+bandwidth_ok
70.501,1600,class45,0.779,0.389,KEEP,priority+bandwidth_ok
70.501,1600,class45,0.73,0.365,KEEP,priority+bandwidth_ok
70.586,1602,class59,0.849,0.424,KEEP,priority+bandwidth_ok
70.586,1602,class45,0.787,0.393,KEEP,priority+bandwidth_ok
70.586,1602,class45,0.664,0.332,DISCARD,low_score
70.67,1604,class59,0.743,0.372,KEEP,priority+bandwidth_ok
70.67,1604,class57,0.508,0.254,DISCARD,low_score
70.67,1604,class45,0.396,0.198,DISCARD,low_score
70.67,1604,class45,0.294,0.147,DISCARD,low_score
70.755,1606,class59,0.891,0.446,KEEP,priority+bandwidth_ok
70.755,1606,class45,0.477,0.238,DISCARD,low_score
70.755,1606,class45,0.453,0.227,DISCARD,low_score
70.839,1608,class59,0.85,0.425,KEEP,priority+bandwidth_ok
70.839,1608,class45,0.361,0.181,DISCARD,low_score
70.839,1608,class45,0.266,0.133,DISCARD,low_score
70.839,1608,class73,0.251,0.125,DISCARD,low_score
70.924,1610,class59,0.893,0.447,KEEP,priority+bandwidth_ok
70.924,1610,class45,0.407,0.204,DISCARD,low_score
70.924,1610,class57,0.367,0.183,DISCARD,low_score
70.924,1610,class45,0.307,0.154,DISCARD,low_score
71.009,1612,class59,0.812,0.406,KEEP,priority+bandwidth_ok
71.009,1612,class57,0.514,0.257,DISCARD,low_score
71.009,1612,class45,0.461,0.231,DISCARD,low_score
71.009,1612,class45,0.44,0.22,DISCARD,low_score
71.009,1612,class16,0.293,0.147,DISCARD,low_score
71.093,1614,class59,0.804,0.402,KEEP,priority+bandwidth_ok
71.093,1614,class16,0.432,0.216,DISCARD,low_score
71.093,1614,class57,0.368,0.184,DISCARD,low_score
71.093,1614,class45,0.311,0.155,DISCARD,low_score
71.179,1616,class59,0.814,0.407,KEEP,priority+bandwidth_ok
71.179,1616,class16,0.488,0.244,DISCARD,low_score
71.179,1616,class45,0.417,0.208,DISCARD,low_score
71.264,1618,class59,0.843,0.421,KEEP,priority+bandwidth_ok
71.264,1618,class15,0.502,0.251,DISCARD,low_score
71.264,1618,class57,0.446,0.223,DISCARD,low_score
71.264,1618,class45,0.285,0.142,DISCARD,low_score
71.264,1618,class73,0.257,0.128,DISCARD,low_score
71.353,1620,class59,0.843,0.421,KEEP,priority+bandwidth_ok
71.353,1620,class16,0.329,0.164,DISCARD,low_score
71.353,1620,class73,0.319,0.16,DISCARD,low_score
71.353,1620,class15,0.27,0.135,DISCARD,low_score
71.437,1622,class59,0.893,0.447,KEEP,priority+bandwidth_ok
71.437,1622,class45,0.494,0.247,DISCARD,low_score
71.437,1622,class16,0.255,0.128,DISCARD,low_score
71.521,1624,class59,0.888,0.444,KEEP,priority+bandwidth_ok
71.521,1624,class16,0.359,0.18,DISCARD,low_score
71.521,1624,class15,0.351,0.176,DISCARD,low_score
71.521,1624,class45,0.345,0.173,DISCARD,low_score
71.606,1626,class59,0.88,0.44,KEEP,priority+bandwidth_ok
71.606,1626,class16,0.506,0.253,DISCARD,low_score
71.69,1628,class59,0.884,0.442,KEEP,priority+bandwidth_ok
71.69,1628,class16,0.633,0.317,DISCARD,low_score
71.774,1630,class59,0.868,0.434,KEEP,priority+bandwidth_ok
71.774,1630,class16,0.65,0.325,DISCARD,low_score
71.774,1630,class73,0.316,0.158,DISCARD,low_score
71.859,1632,class59,0.888,0.444,KEEP,priority+bandwidth_ok
71.859,1632,class16,0.43,0.215,DISCARD,low_score
71.859,1632,class73,0.26,0.13,DISCARD,low_score
71.943,1634,class59,0.916,0.458,KEEP,priority+bandwidth_ok
71.943,1634,class16,0.648,0.324,DISCARD,low_score
72.027,1636,class59,0.885,0.442,KEEP,priority+bandwidth_ok
72.027,1636,class16,0.453,0.227,DISCARD,low_score
72.112,1638,class59,0.891,0.446,KEEP,priority+bandwidth_ok
72.112,1638,class16,0.498,0.249,DISCARD,low_score
72.197,1640,class59,0.87,0.435,KEEP,priority+bandwidth_ok
72.197,1640,class16,0.698,0.349,DISCARD,low_score
72.197,1640,class57,0.421,0.21,DISCARD,low_score
72.197,1640,class60,0.288,0.144,DISCARD,low_score
72.284,1642,class59,0.887,0.444,KEEP,priority+bandwidth_ok
72.284,1642,class16,0.725,0.362,KEEP,priority+bandwidth_ok
72.284,1642,class60,0.359,0.18,DISCARD,low_score
72.369,1644,class59,0.885,0.442,KEEP,priority+bandwidth_ok
72.369,1644,class16,0.808,0.404,KEEP,priority+bandwidth_ok
72.369,1644,class60,0.256,0.128,DISCARD,low_score
72.454,1646,class59,0.878,0.439,KEEP,priority+bandwidth_ok
72.454,1646,class16,0.826,0.413,KEEP,priority+bandwidth_ok
72.538,1648,class59,0.871,0.435,KEEP,priority+bandwidth_ok
72.538,1648,class16,0.789,0.395,KEEP,priority+bandwidth_ok
72.538,1648,class60,0.307,0.154,DISCARD,low_score
72.622,1650,class59,0.709,0.355,KEEP,priority+bandwidth_ok
72.622,1650,class16,0.665,0.333,DISCARD,low_score
72.622,1650,class60,0.31,0.155,DISCARD,low_score
72.707,1652,class16,0.874,0.437,KEEP,priority+bandwidth_ok
72.707,1652,class59,0.796,0.398,KEEP,priority+bandwidth_ok
72.707,1652,class60,0.289,0.145,DISCARD,low_score
72.707,1652,class57,0.268,0.134,DISCARD,low_score
72.791,1654,class16,0.839,0.419,KEEP,priority+bandwidth_ok
72.791,1654,class59,0.815,0.408,KEEP,priority+bandwidth_ok
72.791,1654,class56,0.307,0.153,DISCARD,low_score
72.878,1656,class59,0.792,0.396,KEEP,priority+bandwidth_ok
72.878,1656,class16,0.693,0.346,DISCARD,low_score
72.962,1658,class59,0.816,0.408,KEEP,priority+bandwidth_ok
72.962,1658,class16,0.807,0.403,KEEP,priority+bandwidth_ok
72.962,1658,class56,0.328,0.164,DISCARD,low_score
73.047,1660,class16,0.833,0.417,KEEP,priority+bandwidth_ok
73.047,1660,class59,0.812,0.406,KEEP,priority+bandwidth_ok
73.132,1662,class59,0.874,0.437,KEEP,priority+bandwidth_ok
73.132,1662,class16,0.726,0.363,KEEP,priority+bandwidth_ok
73.217,1664,class16,0.903,0.451,KEEP,priority+bandwidth_ok
73.217,1664,class59,0.753,0.377,KEEP,priority+bandwidth_ok
73.217,1664,class56,0.259,0.13,DISCARD,low_score
73.304,1666,class16,0.89,0.445,KEEP,priority+bandwidth_ok
73.304,1666,class59,0.787,0.393,KEEP,priority+bandwidth_ok
73.304,1666,class56,0.471,0.235,DISCARD,low_score
73.389,1668,class16,0.82,0.41,KEEP,priority+bandwidth_ok
73.389,1668,class59,0.802,0.401,KEEP,priority+bandwidth_ok
73.389,1668,class56,0.504,0.252,DISCARD,low_score
73.474,1670,class16,0.776,0.388,KEEP,priority+bandwidth_ok
73.474,1670,class59,0.776,0.388,KEEP,priority+bandwidth_ok
73.474,1670,class56,0.496,0.248,DISCARD,low_score
73.558,1672,class16,0.779,0.389,KEEP,priority+bandwidth_ok
73.558,1672,class59,0.769,0.385,KEEP,priority+bandwidth_ok
73.558,1672,class56,0.44,0.22,DISCARD,low_score
73.642,1674,class16,0.794,0.397,KEEP,priority+bandwidth_ok
73.642,1674,class59,0.78,0.39,KEEP,priority+bandwidth_ok
73.726,1676,class16,0.835,0.418,KEEP,priority+bandwidth_ok
73.726,1676,class59,0.711,0.355,KEEP,priority+bandwidth_ok
73.81,1678,class16,0.832,0.416,KEEP,priority+bandwidth_ok
73.81,1678,class59,0.576,0.288,DISCARD,low_score
73.899,1680,class16,0.881,0.44,KEEP,priority+bandwidth_ok
73.899,1680,class59,0.57,0.285,DISCARD,low_score
73.983,1682,class16,0.868,0.434,KEEP,priority+bandwidth_ok
73.983,1682,class59,0.558,0.279,DISCARD,low_score
74.066,1684,class16,0.876,0.438,KEEP,priority+bandwidth_ok
74.066,1684,class59,0.664,0.332,DISCARD,low_score
74.151,1686,class16,0.873,0.437,KEEP,priority+bandwidth_ok
74.151,1686,class59,0.63,0.315,DISCARD,low_score
74.235,1688,class16,0.86,0.43,KEEP,priority+bandwidth_ok
74.235,1688,class59,0.628,0.314,DISCARD,low_score
74.319,1690,class16,0.882,0.441,KEEP,priority+bandwidth_ok
74.319,1690,class59,0.658,0.329,DISCARD,low_score
74.403,1692,class16,0.865,0.433,KEEP,priority+bandwidth_ok
74.403,1692,class59,0.554,0.277,DISCARD,low_score
74.49,1694,class16,0.878,0.439,KEEP,priority+bandwidth_ok
74.49,1694,class59,0.681,0.34,DISCARD,low_score
74.49,1694,class57,0.264,0.132,DISCARD,low_score
74.574,1696,class16,0.863,0.432,KEEP,priority+bandwidth_ok
74.574,1696,class59,0.66,0.33,DISCARD,low_score
74.658,1698,class16,0.871,0.435,KEEP,priority+bandwidth_ok
74.658,1698,class59,0.749,0.375,KEEP,priority+bandwidth_ok
74.742,1700,class16,0.846,0.423,KEEP,priority+bandwidth_ok
74.742,1700,class59,0.797,0.398,KEEP,priority+bandwidth_ok
74.742,1700,class57,0.288,0.144,DISCARD,low_score
74.826,1702,class59,0.877,0.438,KEEP,priority+bandwidth_ok
74.826,1702,class16,0.874,0.437,KEEP,priority+bandwidth_ok
74.912,1704,class16,0.867,0.434,KEEP,priority+bandwidth_ok
74.912,1704,class59,0.83,0.415,KEEP,priority+bandwidth_ok
74.996,1706,class16,0.885,0.442,KEEP,priority+bandwidth_ok
74.996,1706,class59,0.753,0.377,KEEP,priority+bandwidth_ok
75.081,1708,class16,0.885,0.442,KEEP,priority+bandwidth_ok
75.081,1708,class59,0.748,0.374,KEEP,priority+bandwidth_ok
75.165,1710,class16,0.861,0.43,KEEP,priority+bandwidth_ok
75.165,1710,class59,0.799,0.4,KEEP,priority+bandwidth_ok
75.249,1712,class16,0.886,0.443,KEEP,priority+bandwidth_ok
75.249,1712,class59,0.775,0.387,KEEP,priority+bandwidth_ok
75.333,1714,class16,0.895,0.447,KEEP,priority+bandwidth_ok
75.333,1714,class59,0.691,0.345,DISCARD,low_score
75.417,1716,class16,0.909,0.455,KEEP,priority+bandwidth_ok
75.417,1716,class59,0.644,0.322,DISCARD,low_score
75.508,1718,class16,0.871,0.435,KEEP,priority+bandwidth_ok
75.508,1718,class59,0.698,0.349,DISCARD,low_score
75.592,1720,class16,0.874,0.437,KEEP,priority+bandwidth_ok
75.592,1720,class59,0.628,0.314,DISCARD,low_score
75.676,1722,class16,0.869,0.434,KEEP,priority+bandwidth_ok
75.676,1722,class59,0.56,0.28,DISCARD,low_score
75.76,1724,class16,0.861,0.43,KEEP,priority+bandwidth_ok
75.76,1724,class59,0.518,0.259,DISCARD,low_score
75.76,1724,class57,0.342,0.171,DISCARD,low_score
75.844,1726,class16,0.862,0.431,KEEP,priority+bandwidth_ok
75.844,1726,class59,0.507,0.253,DISCARD,low_score
