t,frame,name,conf,score,decision,reason
50.852,1138,class45,0.6,0.3,DISCARD,low_score
50.852,1138,class72,0.568,0.284,DISCARD,low_score
50.852,1138,class69,0.331,0.166,DISCARD,low_score
50.94,1140,class45,0.648,0.324,DISCARD,low_score
50.94,1140,class72,0.613,0.307,DISCARD,low_score
50.94,1140,class69,0.508,0.254,DISCARD,low_score
51.024,1142,class72,0.655,0.327,DISCARD,low_score
51.024,1142,class45,0.606,0.303,DISCARD,low_score
51.024,1142,class54,0.438,0.219,DISCARD,low_score
51.108,1144,class45,0.626,0.313,DISCARD,low_score
51.108,1144,class66,0.451,0.226,DISCARD,low_score
51.108,1144,class39,0.264,0.132,DISCARD,low_score
51.193,1146,class45,0.624,0.312,DISCARD,low_score
51.277,1148,class56,0.751,0.375,DISCARD,bandwidth
51.277,1148,class45,0.672,0.336,DISCARD,low_score
51.277,1148,class56,0.255,0.128,DISCARD,low_score
51.363,1150,class56,0.849,0.424,DISCARD,bandwidth
51.363,1150,class45,0.717,0.359,DISCARD,bandwidth
51.363,1150,class39,0.288,0.144,DISCARD,low_score
51.448,1152,class56,0.798,0.399,DISCARD,bandwidth
51.448,1152,class45,0.731,0.366,DISCARD,bandwidth
51.535,1154,class45,0.655,0.327,DISCARD,low_score
51.535,1154,class56,0.646,0.323,DISCARD,low_score
51.619,1156,class56,0.734,0.367,DISCARD,bandwidth
51.619,1156,class45,0.608,0.304,DISCARD,low_score
51.703,1158,class56,0.715,0.358,DISCARD,bandwidth
51.703,1158,class45,0.635,0.318,DISCARD,low_score
51.787,1160,class56,0.814,0.407,DISCARD,bandwidth
51.787,1160,class45,0.461,0.231,DISCARD,low_score
51.787,1160,class73,0.392,0.196,DISCARD,low_score
51.871,1162,class56,0.455,0.228,DISCARD,low_score
51.871,1162,class69,0.289,0.145,DISCARD,low_score
51.955,1164,class56,0.449,0.225,DISCARD,low_score
51.955,1164,class45,0.278,0.139,DISCARD,low_score
52.04,1166,class56,0.78,0.39,DISCARD,bandwidth
52.04,1166,class69,0.296,0.148,DISCARD,low_score
52.04,1166,class56,0.258,0.129,DISCARD,low_score
52.125,1168,class56,0.814,0.407,DISCARD,bandwidth
52.125,1168,class56,0.436,0.218,DISCARD,low_score
52.125,1168,class71,0.257,0.128,DISCARD,low_score
52.21,1170,class56,0.51,0.255,DISCARD,low_score
52.21,1170,class73,0.291,0.145,DISCARD,low_score
52.295,1172,class73,0.467,0.233,DISCARD,low_score
52.295,1172,class56,0.461,0.231,DISCARD,low_score
52.295,1172,class69,0.341,0.17,DISCARD,low_score
52.295,1172,class73,0.297,0.149,DISCARD,low_score
52.38,1174,class69,0.562,0.281,DISCARD,low_score
52.38,1174,class73,0.424,0.212,DISCARD,low_score
52.38,1174,class39,0.335,0.167,DISCARD,low_score
52.38,1174,class73,0.266,0.133,DISCARD,low_score
52.467,1176,class69,0.518,0.259,DISCARD,low_score
52.467,1176,class73,0.302,0.151,DISCARD,low_score
52.467,1176,class39,0.28,0.14,DISCARD,low_score
52.557,1178,class69,0.556,0.278,DISCARD,low_score
52.557,1178,class73,0.257,0.128,DISCARD,low_score
52.642,1180,class69,0.606,0.303,DISCARD,low_score
52.727,1182,class69,0.72,0.36,DISCARD,bandwidth
52.727,1182,class73,0.39,0.195,DISCARD,low_score
52.727,1182,class73,0.283,0.141,DISCARD,low_score
52.727,1182,class39,0.278,0.139,DISCARD,low_score
52.812,1184,class69,0.498,0.249,DISCARD,low_score
52.897,1186,class69,0.518,0.259,DISCARD,low_score
52.897,1186,class39,0.26,0.13,DISCARD,low_score
52.981,1188,class69,0.49,0.245,DISCARD,low_score
52.981,1188,class39,0.299,0.15,DISCARD,low_score
52.981,1188,class71,0.252,0.126,DISCARD,low_score
53.065,1190,class69,0.722,0.361,DISCARD,bandwidth
53.153,1192,class69,0.6,0.3,DISCARD,low_score
53.153,1192,class71,0.294,0.147,DISCARD,low_score
53.237,1194,class69,0.681,0.34,DISCARD,low_score
53.323,1196,class69,0.628,0.314,DISCARD,low_score
53.323,1196,class60,0.276,0.138,DISCARD,low_score
53.407,1198,class69,0.74,0.37,DISCARD,bandwidth
53.491,1200,class69,0.547,0.273,DISCARD,low_score
53.491,1200,class39,0.321,0.16,DISCARD,low_score
53.491,1200,class39,0.301,0.15,DISCARD,low_score
53.578,1202,class69,0.51,0.255,DISCARD,low_score
53.578,1202,class39,0.289,0.145,DISCARD,low_score
53.745,1206,class70,0.564,0.282,DISCARD,low_score
53.745,1206,class69,0.514,0.257,DISCARD,low_score
53.745,1206,class69,0.263,0.131,DISCARD,low_score
53.745,1206,class45,0.254,0.127,DISCARD,low_score
53.993,1212,class70,0.556,0.278,DISCARD,low_score
53.993,1212,class69,0.492,0.246,DISCARD,low_score
53.993,1212,class45,0.345,0.173,DISCARD,low_score
54.077,1214,class69,0.389,0.194,DISCARD,low_score
54.166,1216,class72,0.715,0.358,DISCARD,bandwidth
54.166,1216,class69,0.423,0.211,DISCARD,low_score
54.166,1216,class45,0.27,0.135,DISCARD,low_score
54.25,1218,class72,0.598,0.299,DISCARD,low_score
54.25,1218,class69,0.372,0.186,DISCARD,low_score
54.25,1218,class69,0.256,0.128,DISCARD,low_score
54.335,1220,class72,0.806,0.403,DISCARD,bandwidth
54.418,1222,class72,0.396,0.198,DISCARD,low_score
54.586,1226,class71,0.378,0.189,DISCARD,low_score
54.67,1228,class72,0.572,0.286,DISCARD,low_score
54.757,1230,class72,0.726,0.363,DISCARD,bandwidth
54.841,1232,class72,0.676,0.338,DISCARD,low_score
54.925,1234,class72,0.756,0.378,DISCARD,bandwidth
55.009,1236,class72,0.748,0.374,DISCARD,bandwidth
55.092,1238,class72,0.587,0.293,DISCARD,low_score
55.179,1240,class72,0.291,0.145,DISCARD,low_score
55.262,1242,class72,0.711,0.355,KEEP,priority+bandwidth_ok
55.438,1246,class72,0.329,0.165,DISCARD,low_score
55.521,1248,class72,0.651,0.326,DISCARD,low_score
55.605,1250,class72,0.426,0.213,DISCARD,low_score
55.691,1252,class68,0.387,0.193,DISCARD,low_score
55.779,1254,class68,0.465,0.232,DISCARD,low_score
55.779,1254,class39,0.296,0.148,DISCARD,low_score
55.779,1254,class39,0.275,0.138,DISCARD,low_score
56.028,1260,class39,0.311,0.155,DISCARD,low_score
56.276,1266,class62,0.405,0.203,DISCARD,low_score
56.276,1266,class39,0.289,0.145,DISCARD,low_score
56.604,1274,class59,0.321,0.16,DISCARD,low_score
56.775,1278,class62,0.385,0.192,DISCARD,low_score
56.859,1280,class62,0.564,0.282,DISCARD,low_score
56.948,1282,class62,0.722,0.361,KEEP,priority+bandwidth_ok
57.032,1284,class62,0.508,0.254,DISCARD,low_score
57.116,1286,class62,0.455,0.228,DISCARD,low_score
57.116,1286,class39,0.258,0.129,DISCARD,low_score
57.201,1288,class62,0.396,0.198,DISCARD,low_score
57.284,1290,class62,0.294,0.147,DISCARD,low_score
57.45,1294,class62,0.568,0.284,DISCARD,low_score
57.615,1298,class68,0.296,0.148,DISCARD,low_score
57.699,1300,class59,0.283,0.141,DISCARD,low_score
57.699,1300,class59,0.27,0.135,DISCARD,low_score
57.785,1302,class56,0.327,0.163,DISCARD,low_score
57.785,1302,class72,0.25,0.125,DISCARD,low_score
57.87,1304,class56,0.438,0.219,DISCARD,low_score
57.87,1304,class68,0.317,0.159,DISCARD,low_score
57.87,1304,class72,0.291,0.145,DISCARD,low_score
57.954,1306,class56,0.583,0.292,DISCARD,low_score
58.038,1308,class56,0.381,0.191,DISCARD,low_score
58.122,1310,class56,0.434,0.217,DISCARD,low_score
58.122,1310,class72,0.26,0.13,DISCARD,low_score
58.289,1314,class56,0.482,0.241,DISCARD,low_score
58.289,1314,class56,0.332,0.166,DISCARD,low_score
58.289,1314,class59,0.268,0.134,DISCARD,low_score
58.412,1316,class62,0.752,0.376,KEEP,priority+bandwidth_ok
58.412,1316,class39,0.251,0.125,DISCARD,low_score
58.497,1318,class62,0.83,0.415,KEEP,priority+bandwidth_ok
58.497,1318,class39,0.26,0.13,DISCARD,low_score
58.584,1320,class62,0.755,0.377,KEEP,priority+bandwidth_ok
58.668,1322,class62,0.72,0.36,KEEP,priority+bandwidth_ok
58.668,1322,class39,0.342,0.171,DISCARD,low_score
58.668,1322,class39,0.257,0.128,DISCARD,low_score
58.753,1324,class62,0.777,0.389,KEEP,priority+bandwidth_ok
58.753,1324,class39,0.486,0.243,DISCARD,low_score
58.753,1324,class39,0.338,0.169,DISCARD,low_score
58.837,1326,class62,0.65,0.325,DISCARD,low_score
58.837,1326,class62,0.343,0.172,DISCARD,low_score
58.922,1328,class62,0.554,0.277,DISCARD,low_score
58.922,1328,class62,0.434,0.217,DISCARD,low_score
59.009,1330,class62,0.78,0.39,KEEP,priority+bandwidth_ok
59.009,1330,class62,0.411,0.206,DISCARD,low_score
59.009,1330,class39,0.283,0.141,DISCARD,low_score
59.093,1332,class62,0.797,0.398,KEEP,priority+bandwidth_ok
59.178,1334,class62,0.776,0.388,KEEP,priority+bandwidth_ok
59.178,1334,class45,0.26,0.13,DISCARD,low_score
59.178,1334,class39,0.257,0.128,DISCARD,low_score
59.262,1336,class62,0.453,0.227,DISCARD,low_score
59.262,1336,class45,0.302,0.151,DISCARD,low_score
59.262,1336,class39,0.278,0.139,DISCARD,low_score
59.347,1338,class62,0.482,0.241,DISCARD,low_score
59.43,1340,class62,0.479,0.239,DISCARD,low_score
59.43,1340,class39,0.326,0.163,DISCARD,low_score
59.515,1342,class62,0.621,0.31,DISCARD,low_score
59.603,1344,class62,0.398,0.199,DISCARD,low_score
59.603,1344,class62,0.317,0.159,DISCARD,low_score
59.687,1346,class62,0.523,0.262,DISCARD,low_score
59.687,1346,class39,0.307,0.154,DISCARD,low_score
59.687,1346,class62,0.254,0.127,DISCARD,low_score
59.772,1348,class62,0.642,0.321,DISCARD,low_score
59.856,1350,class62,0.486,0.243,DISCARD,low_score
59.856,1350,class62,0.304,0.152,DISCARD,low_score
59.94,1352,class62,0.537,0.269,DISCARD,low_score
60.024,1354,class62,0.4,0.2,DISCARD,low_score
60.108,1356,class62,0.39,0.195,DISCARD,low_score
60.196,1358,class62,0.432,0.216,DISCARD,low_score
60.28,1360,class62,0.523,0.262,DISCARD,low_score
60.364,1362,class62,0.314,0.157,DISCARD,low_score
60.458,1364,class62,0.516,0.258,DISCARD,low_score
60.542,1366,class62,0.681,0.34,DISCARD,low_score
60.626,1368,class62,0.389,0.194,DISCARD,low_score
60.626,1368,class62,0.251,0.125,DISCARD,low_score
60.71,1370,class62,0.642,0.321,DISCARD,low_score
60.71,1370,class62,0.356,0.178,DISCARD,low_score
60.796,1372,class62,0.469,0.234,DISCARD,low_score
60.88,1374,class62,0.453,0.227,DISCARD,low_score
60.964,1376,class62,0.417,0.208,DISCARD,low_score
61.212,1382,class62,0.335,0.167,DISCARD,low_score
61.378,1386,class62,0.324,0.162,DISCARD,low_score
61.462,1388,class2,0.257,0.128,DISCARD,low_score
61.462,1388,class2,0.255,0.128,DISCARD,low_score
61.462,1388,class2,0.251,0.125,DISCARD,low_score
61.629,1392,class2,0.428,0.214,DISCARD,low_score
61.629,1392,class2,0.329,0.165,DISCARD,low_score
61.629,1392,class60,0.268,0.134,DISCARD,low_score
61.713,1394,class39,0.516,0.258,DISCARD,low_score
61.798,1396,class39,0.521,0.261,DISCARD,low_score
61.798,1396,class62,0.363,0.181,DISCARD,low_score
61.882,1398,class2,0.319,0.16,DISCARD,low_score
61.967,1400,class39,0.402,0.201,DISCARD,low_score
61.967,1400,class45,0.385,0.192,DISCARD,low_score
61.967,1400,class2,0.316,0.158,DISCARD,low_score
62.051,1402,class45,0.423,0.211,DISCARD,low_score
62.051,1402,class39,0.419,0.209,DISCARD,low_score
62.051,1402,class62,0.407,0.204,DISCARD,low_score
62.137,1404,class39,0.63,0.315,DISCARD,low_score
62.137,1404,class45,0.459,0.23,DISCARD,low_score
62.137,1404,class41,0.361,0.181,DISCARD,low_score
62.225,1406,class39,0.553,0.276,DISCARD,low_score
62.225,1406,class45,0.535,0.268,DISCARD,low_score
62.31,1408,class39,0.533,0.267,DISCARD,low_score
62.31,1408,class45,0.479,0.239,DISCARD,low_score
62.31,1408,class41,0.396,0.198,DISCARD,low_score
62.31,1408,class62,0.345,0.173,DISCARD,low_score
62.396,1410,class39,0.598,0.299,DISCARD,low_score
62.396,1410,class45,0.533,0.267,DISCARD,low_score
62.396,1410,class41,0.461,0.231,DISCARD,low_score
62.396,1410,class62,0.295,0.148,DISCARD,low_score
62.48,1412,class45,0.479,0.239,DISCARD,low_score
62.48,1412,class39,0.447,0.224,DISCARD,low_score
62.48,1412,class41,0.359,0.18,DISCARD,low_score
62.565,1414,class45,0.646,0.323,DISCARD,low_score
62.565,1414,class39,0.633,0.317,DISCARD,low_score
62.565,1414,class41,0.484,0.242,DISCARD,low_score
62.565,1414,class62,0.256,0.128,DISCARD,low_score
62.65,1416,class45,0.698,0.349,DISCARD,low_score
62.65,1416,class39,0.665,0.333,DISCARD,low_score
62.65,1416,class41,0.44,0.22,DISCARD,low_score
62.734,1418,class45,0.657,0.328,DISCARD,low_score
62.734,1418,class39,0.61,0.305,DISCARD,low_score
62.734,1418,class62,0.572,0.286,DISCARD,low_score
62.734,1418,class41,0.417,0.208,DISCARD,low_score
62.822,1420,class45,0.644,0.322,DISCARD,low_score
62.822,1420,class39,0.617,0.308,DISCARD,low_score
62.822,1420,class41,0.39,0.195,DISCARD,low_score
62.822,1420,class62,0.387,0.193,DISCARD,low_score
62.907,1422,class45,0.715,0.358,KEEP,priority+bandwidth_ok
62.907,1422,class62,0.577,0.289,DISCARD,low_score
62.907,1422,class41,0.482,0.241,DISCARD,low_score
62.907,1422,class39,0.43,0.215,DISCARD,low_score
62.992,1424,class39,0.686,0.343,DISCARD,low_score
62.992,1424,class62,0.635,0.318,DISCARD,low_score
62.992,1424,class45,0.632,0.316,DISCARD,low_score
62.992,1424,class77,0.417,0.208,DISCARD,low_score
63.077,1426,class45,0.63,0.315,DISCARD,low_score
63.077,1426,class39,0.619,0.309,DISCARD,low_score
63.077,1426,class39,0.514,0.257,DISCARD,low_score
63.077,1426,class77,0.5,0.25,DISCARD,low_score
63.077,1426,class41,0.488,0.244,DISCARD,low_score
63.077,1426,class62,0.308,0.154,DISCARD,low_score
63.163,1428,class45,0.689,0.345,DISCARD,low_score
63.163,1428,class39,0.336,0.168,DISCARD,low_score
63.163,1428,class41,0.286,0.143,DISCARD,low_score
63.248,1430,class45,0.714,0.357,KEEP,priority+bandwidth_ok
63.248,1430,class39,0.417,0.208,DISCARD,low_score
63.248,1430,class41,0.354,0.177,DISCARD,low_score
63.248,1430,class45,0.281,0.141,DISCARD,low_score
63.248,1430,class62,0.277,0.138,DISCARD,low_score
63.334,1432,class45,0.709,0.355,KEEP,priority+bandwidth_ok
63.334,1432,class39,0.672,0.336,DISCARD,low_score
63.334,1432,class45,0.434,0.217,DISCARD,low_score
63.334,1432,class41,0.272,0.136,DISCARD,low_score
63.334,1432,class39,0.267,0.134,DISCARD,low_score
63.334,1432,class77,0.258,0.129,DISCARD,low_score
63.422,1434,class45,0.779,0.389,KEEP,priority+bandwidth_ok
63.422,1434,class39,0.639,0.319,DISCARD,low_score
63.422,1434,class45,0.482,0.241,DISCARD,low_score
63.422,1434,class41,0.376,0.188,DISCARD,low_score
63.507,1436,class45,0.635,0.318,DISCARD,low_score
63.507,1436,class39,0.617,0.308,DISCARD,low_score
63.507,1436,class45,0.48,0.24,DISCARD,low_score
63.507,1436,class41,0.372,0.186,DISCARD,low_score
63.507,1436,class45,0.354,0.177,DISCARD,low_score
63.507,1436,class77,0.272,0.136,DISCARD,low_score
63.593,1438,class45,0.633,0.317,DISCARD,low_score
63.593,1438,class45,0.436,0.218,DISCARD,low_score
63.593,1438,class39,0.39,0.195,DISCARD,low_score
63.593,1438,class41,0.381,0.191,DISCARD,low_score
63.593,1438,class45,0.374,0.187,DISCARD,low_score
63.593,1438,class45,0.264,0.132,DISCARD,low_score
63.682,1440,class45,0.642,0.321,DISCARD,low_score
63.682,1440,class39,0.633,0.317,DISCARD,low_score
63.682,1440,class45,0.438,0.219,DISCARD,low_score
63.682,1440,class41,0.314,0.157,DISCARD,low_score
63.682,1440,class45,0.274,0.137,DISCARD,low_score
63.767,1442,class39,0.646,0.323,DISCARD,low_score
63.767,1442,class45,0.492,0.246,DISCARD,low_score
63.767,1442,class45,0.428,0.214,DISCARD,low_score
63.767,1442,class41,0.39,0.195,DISCARD,low_score
63.852,1444,class39,0.662,0.331,DISCARD,low_score
63.852,1444,class45,0.537,0.269,DISCARD,low_score
63.852,1444,class45,0.424,0.212,DISCARD,low_score
63.852,1444,class41,0.378,0.189,DISCARD,low_score
63.937,1446,class45,0.722,0.361,KEEP,priority+bandwidth_ok
63.937,1446,class45,0.635,0.318,DISCARD,low_score
63.937,1446,class39,0.527,0.264,DISCARD,low_score
63.937,1446,class41,0.272,0.136,DISCARD,low_score
64.025,1448,class39,0.608,0.304,DISCARD,low_score
64.025,1448,class45,0.589,0.294,DISCARD,low_score
64.025,1448,class45,0.432,0.216,DISCARD,low_score
64.025,1448,class41,0.358,0.179,DISCARD,low_score
64.11,1450,class45,0.606,0.303,DISCARD,low_score
64.11,1450,class39,0.572,0.286,DISCARD,low_score
64.11,1450,class45,0.35,0.175,DISCARD,low_score
64.11,1450,class41,0.275,0.138,DISCARD,low_score
64.196,1452,class45,0.646,0.323,DISCARD,low_score
64.196,1452,class45,0.556,0.278,DISCARD,low_score
64.196,1452,class39,0.541,0.27,DISCARD,low_score
64.196,1452,class39,0.461,0.231,DISCARD,low_score
64.28,1454,class39,0.615,0.308,DISCARD,low_score
64.28,1454,class45,0.556,0.278,DISCARD,low_score
64.28,1454,class45,0.496,0.248,DISCARD,low_score
64.28,1454,class45,0.343,0.172,DISCARD,low_score
64.28,1454,class41,0.326,0.163,DISCARD,low_score
64.365,1456,class45,0.686,0.343,DISCARD,low_score
64.365,1456,class45,0.637,0.319,DISCARD,low_score
64.365,1456,class39,0.593,0.296,DISCARD,low_score
64.365,1456,class41,0.438,0.219,DISCARD,low_score
64.45,1458,class39,0.591,0.295,DISCARD,low_score
64.45,1458,class45,0.587,0.293,DISCARD,low_score
64.45,1458,class41,0.543,0.271,DISCARD,low_score
64.45,1458,class45,0.535,0.268,DISCARD,low_score
64.45,1458,class45,0.413,0.207,DISCARD,low_score
64.45,1458,class45,0.275,0.138,DISCARD,low_score
64.535,1460,class45,0.679,0.34,DISCARD,low_score
64.535,1460,class39,0.657,0.328,DISCARD,low_score
64.535,1460,class45,0.595,0.297,DISCARD,low_score
64.535,1460,class45,0.363,0.181,DISCARD,low_score
64.535,1460,class41,0.299,0.15,DISCARD,low_score
64.62,1462,class45,0.719,0.359,KEEP,priority+bandwidth_ok
64.62,1462,class39,0.598,0.299,DISCARD,low_score
64.62,1462,class45,0.529,0.265,DISCARD,low_score
64.62,1462,class41,0.4,0.2,DISCARD,low_score
64.62,1462,class59,0.288,0.144,DISCARD,low_score
64.62,1462,class45,0.274,0.137,DISCARD,low_score
64.62,1462,class45,0.264,0.132,DISCARD,low_score
64.705,1464,class45,0.736,0.368,KEEP,priority+bandwidth_ok
64.705,1464,class39,0.593,0.296,DISCARD,low_score
64.705,1464,class45,0.553,0.276,DISCARD,low_score
64.705,1464,class41,0.385,0.192,DISCARD,low_score
64.705,1464,class45,0.28,0.14,DISCARD,low_score
64.789,1466,class45,0.676,0.338,DISCARD,low_score
64.789,1466,class39,0.622,0.311,DISCARD,low_score
64.789,1466,class41,0.541,0.27,DISCARD,low_score
64.789,1466,class45,0.525,0.263,DISCARD,low_score
64.789,1466,class45,0.272,0.136,DISCARD,low_score
64.874,1468,class45,0.784,0.392,KEEP,priority+bandwidth_ok
64.874,1468,class39,0.61,0.305,DISCARD,low_score
64.874,1468,class45,0.514,0.257,DISCARD,low_score
64.874,1468,class45,0.347,0.173,DISCARD,low_score
64.874,1468,class41,0.343,0.172,DISCARD,low_score
64.874,1468,class45,0.283,0.141,DISCARD,low_score
64.959,1470,class45,0.761,0.38,KEEP,priority+bandwidth_ok
64.959,1470,class45,0.662,0.331,DISCARD,low_score
64.959,1470,class41,0.587,0.293,DISCARD,low_score
64.959,1470,class39,0.562,0.281,DISCARD,low_score
65.045,1472,class45,0.696,0.348,DISCARD,low_score
65.045,1472,class45,0.664,0.332,DISCARD,low_score
65.045,1472,class39,0.635,0.318,DISCARD,low_score
65.045,1472,class45,0.508,0.254,DISCARD,low_score
65.131,1474,class45,0.683,0.341,DISCARD,low_score
65.131,1474,class45,0.681,0.34,DISCARD,low_score
65.131,1474,class39,0.615,0.308,DISCARD,low_score
65.131,1474,class45,0.376,0.188,DISCARD,low_score
65.131,1474,class41,0.359,0.18,DISCARD,low_score
65.131,1474,class45,0.342,0.171,DISCARD,low_score
65.131,1474,class45,0.275,0.138,DISCARD,low_score
65.216,1476,class45,0.701,0.35,KEEP,priority+bandwidth_ok
65.216,1476,class45,0.684,0.342,DISCARD,low_score
65.216,1476,class39,0.664,0.332,DISCARD,low_score
65.216,1476,class45,0.446,0.223,DISCARD,low_score
65.216,1476,class45,0.398,0.199,DISCARD,low_score
65.216,1476,class45,0.251,0.125,DISCARD,low_score
65.301,1478,class45,0.63,0.315,DISCARD,low_score
65.301,1478,class39,0.61,0.305,DISCARD,low_score
65.301,1478,class45,0.521,0.261,DISCARD,low_score
65.301,1478,class45,0.261,0.131,DISCARD,low_score
65.386,1480,class45,0.753,0.377,KEEP,priority+bandwidth_ok
65.386,1480,class39,0.749,0.375,KEEP,priority+bandwidth_ok
65.386,1480,class45,0.617,0.308,DISCARD,low_score
65.386,1480,class45,0.342,0.171,DISCARD,low_score
65.386,1480,class41,0.342,0.171,DISCARD,low_score
65.386,1480,class57,0.296,0.148,DISCARD,low_score
65.48,1482,class39,0.693,0.346,DISCARD,low_score
65.48,1482,class45,0.667,0.334,DISCARD,low_score
65.48,1482,class45,0.581,0.291,DISCARD,low_score
65.48,1482,class57,0.545,0.272,DISCARD,low_score
65.48,1482,class45,0.484,0.242,DISCARD,low_score
65.48,1482,class45,0.413,0.207,DISCARD,low_score
65.565,1484,class39,0.712,0.356,KEEP,priority+bandwidth_ok
65.565,1484,class45,0.704,0.352,KEEP,priority+bandwidth_ok
65.565,1484,class45,0.686,0.343,DISCARD,low_score
65.565,1484,class45,0.549,0.274,DISCARD,low_score
65.565,1484,class57,0.5,0.25,DISCARD,low_score
65.565,1484,class45,0.413,0.207,DISCARD,low_score
65.65,1486,class39,0.715,0.358,KEEP,priority+bandwidth_ok
65.65,1486,class45,0.711,0.355,KEEP,priority+bandwidth_ok
65.65,1486,class45,0.626,0.313,DISCARD,low_score
65.65,1486,class57,0.539,0.269,DISCARD,low_score
65.65,1486,class45,0.43,0.215,DISCARD,low_score
65.734,1488,class45,0.693,0.346,DISCARD,low_score
65.734,1488,class45,0.66,0.33,DISCARD,low_score
65.734,1488,class57,0.579,0.29,DISCARD,low_score
65.734,1488,class39,0.527,0.264,DISCARD,low_score
65.734,1488,class59,0.518,0.259,DISCARD,low_score
65.734,1488,class45,0.413,0.207,DISCARD,low_score
65.734,1488,class41,0.354,0.177,DISCARD,low_score
65.734,1488,class39,0.266,0.133,DISCARD,low_score
65.819,1490,class59,0.714,0.357,KEEP,priority+bandwidth_ok
65.819,1490,class45,0.709,0.355,KEEP,priority+bandwidth_ok
65.819,1490,class45,0.679,0.34,DISCARD,low_score
65.819,1490,class57,0.581,0.291,DISCARD,low_score
65.819,1490,class45,0.558,0.279,DISCARD,low_score
65.819,1490,class45,0.549,0.274,DISCARD,low_score
65.819,1490,class39,0.547,0.273,DISCARD,low_score
65.819,1490,class45,0.294,0.147,DISCARD,low_score
65.904,1492,class59,0.793,0.397,KEEP,priority+bandwidth_ok
65.904,1492,class45,0.74,0.37,KEEP,priority+bandwidth_ok
65.904,1492,class39,0.693,0.346,DISCARD,low_score
65.904,1492,class45,0.608,0.304,DISCARD,low_score
65.904,1492,class41,0.37,0.185,DISCARD,low_score
65.904,1492,class45,0.349,0.174,DISCARD,low_score
65.904,1492,class45,0.316,0.158,DISCARD,low_score
65.904,1492,class39,0.307,0.154,DISCARD,low_score
65.989,1494,class59,0.796,0.398,KEEP,priority+bandwidth_ok
