t,frame,name,conf,score,decision,reason
57.852,1061,class72,0.759,0.38,DISCARD,low_score
57.852,1061,class56,0.405,0.203,DISCARD,low_score
57.852,1061,class68,0.354,0.177,DISCARD,low_score
57.852,1061,class39,0.252,0.126,DISCARD,low_score
57.908,1062,class72,0.624,0.312,DISCARD,low_score
57.908,1062,class68,0.326,0.163,DISCARD,low_score
57.908,1062,class39,0.277,0.138,DISCARD,low_score
57.963,1063,class72,0.543,0.271,DISCARD,low_score
57.963,1063,class56,0.419,0.209,DISCARD,low_score
57.963,1063,class39,0.34,0.17,DISCARD,low_score
58.018,1064,class72,0.862,0.431,DISCARD,low_score
58.018,1064,class56,0.549,0.274,DISCARD,low_score
58.072,1065,class72,0.78,0.39,DISCARD,low_score
58.072,1065,class71,0.301,0.15,DISCARD,low_score
58.072,1065,class41,0.283,0.141,DISCARD,low_score
58.072,1065,class56,0.267,0.133,DISCARD,low_score
58.127,1066,class72,0.84,0.42,DISCARD,low_score
58.127,1066,class45,0.328,0.164,DISCARD,low_score
58.127,1066,class71,0.299,0.15,DISCARD,low_score
58.127,1066,class68,0.285,0.142,DISCARD,low_score
58.188,1067,class72,0.819,0.409,DISCARD,low_score
58.188,1067,class71,0.498,0.249,DISCARD,low_score
58.188,1067,class39,0.331,0.166,DISCARD,low_score
58.188,1067,class71,0.328,0.164,DISCARD,low_score
58.188,1067,class39,0.261,0.131,DISCARD,low_score
58.243,1068,class72,0.83,0.415,DISCARD,low_score
58.243,1068,class68,0.338,0.169,DISCARD,low_score
58.243,1068,class71,0.324,0.162,DISCARD,low_score
58.298,1069,class72,0.788,0.394,DISCARD,low_score
58.298,1069,class68,0.358,0.179,DISCARD,low_score
58.298,1069,class71,0.333,0.166,DISCARD,low_score
58.353,1070,class72,0.854,0.427,DISCARD,low_score
58.353,1070,class68,0.52,0.26,DISCARD,low_score
58.353,1070,class71,0.409,0.205,DISCARD,low_score
58.353,1070,class39,0.309,0.155,DISCARD,low_score
58.409,1071,class72,0.793,0.397,DISCARD,low_score
58.409,1071,class68,0.6,0.3,DISCARD,low_score
58.409,1071,class39,0.442,0.221,DISCARD,low_score
58.409,1071,class71,0.288,0.144,DISCARD,low_score
58.464,1072,class72,0.871,0.436,DISCARD,low_score
58.464,1072,class68,0.51,0.255,DISCARD,low_score
58.464,1072,class39,0.484,0.242,DISCARD,low_score
58.523,1073,class72,0.809,0.405,DISCARD,low_score
58.523,1073,class68,0.547,0.273,DISCARD,low_score
58.523,1073,class71,0.525,0.263,DISCARD,low_score
58.523,1073,class39,0.421,0.21,DISCARD,low_score
58.578,1074,class72,0.753,0.377,DISCARD,low_score
58.578,1074,class71,0.473,0.236,DISCARD,low_score
58.578,1074,class39,0.449,0.225,DISCARD,low_score
58.578,1074,class68,0.356,0.178,DISCARD,low_score
58.578,1074,class39,0.328,0.164,DISCARD,low_score
58.634,1075,class72,0.701,0.35,DISCARD,low_score
58.634,1075,class68,0.672,0.336,DISCARD,low_score
58.634,1075,class39,0.543,0.271,DISCARD,low_score
58.634,1075,class71,0.52,0.26,DISCARD,low_score
58.688,1076,class72,0.731,0.366,DISCARD,low_score
58.688,1076,class71,0.5,0.25,DISCARD,low_score
58.688,1076,class39,0.479,0.239,DISCARD,low_score
58.688,1076,class68,0.372,0.186,DISCARD,low_score
58.746,1077,class72,0.722,0.361,DISCARD,low_score
58.746,1077,class68,0.512,0.256,DISCARD,low_score
58.746,1077,class39,0.405,0.203,DISCARD,low_score
58.746,1077,class39,0.28,0.14,DISCARD,low_score
58.803,1078,class72,0.766,0.383,DISCARD,low_score
58.803,1078,class68,0.642,0.321,DISCARD,low_score
58.861,1079,class72,0.813,0.406,DISCARD,low_score
58.861,1079,class68,0.665,0.333,DISCARD,low_score
58.861,1079,class71,0.389,0.194,DISCARD,low_score
58.915,1080,class72,0.858,0.429,DISCARD,low_score
58.915,1080,class68,0.508,0.254,DISCARD,low_score
58.915,1080,class39,0.316,0.158,DISCARD,low_score
58.915,1080,class71,0.263,0.131,DISCARD,low_score
58.973,1081,class72,0.922,0.461,KEEP,priority+bandwidth_ok
58.973,1081,class68,0.583,0.292,DISCARD,low_score
58.973,1081,class39,0.372,0.186,DISCARD,low_score
58.973,1081,class41,0.323,0.161,DISCARD,low_score
58.973,1081,class41,0.251,0.125,DISCARD,low_score
59.039,1082,class72,0.886,0.443,DISCARD,low_score
59.039,1082,class39,0.376,0.188,DISCARD,low_score
59.039,1082,class70,0.338,0.169,DISCARD,low_score
59.039,1082,class68,0.321,0.16,DISCARD,low_score
59.095,1083,class72,0.933,0.467,KEEP,priority+bandwidth_ok
59.095,1083,class39,0.379,0.19,DISCARD,low_score
59.095,1083,class70,0.278,0.139,DISCARD,low_score
59.095,1083,class68,0.272,0.136,DISCARD,low_score
59.15,1084,class72,0.931,0.465,KEEP,priority+bandwidth_ok
59.15,1084,class68,0.589,0.294,DISCARD,low_score
59.15,1084,class39,0.541,0.27,DISCARD,low_score
59.15,1084,class39,0.289,0.145,DISCARD,low_score
59.207,1085,class72,0.934,0.467,KEEP,priority+bandwidth_ok
59.207,1085,class39,0.428,0.214,DISCARD,low_score
59.207,1085,class68,0.413,0.207,DISCARD,low_score
59.207,1085,class71,0.352,0.176,DISCARD,low_score
59.207,1085,class39,0.28,0.14,DISCARD,low_score
59.207,1085,class70,0.275,0.138,DISCARD,low_score
59.262,1086,class72,0.859,0.429,DISCARD,low_score
59.262,1086,class68,0.471,0.235,DISCARD,low_score
59.317,1087,class72,0.93,0.465,KEEP,priority+bandwidth_ok
59.317,1087,class68,0.492,0.246,DISCARD,low_score
59.317,1087,class70,0.469,0.234,DISCARD,low_score
59.317,1087,class39,0.389,0.194,DISCARD,low_score
59.371,1088,class72,0.903,0.451,KEEP,priority+bandwidth_ok
59.371,1088,class70,0.525,0.263,DISCARD,low_score
59.371,1088,class39,0.475,0.237,DISCARD,low_score
59.371,1088,class39,0.383,0.192,DISCARD,low_score
59.371,1088,class68,0.338,0.169,DISCARD,low_score
59.371,1088,class39,0.278,0.139,DISCARD,low_score
59.428,1089,class72,0.918,0.459,KEEP,priority+bandwidth_ok
59.428,1089,class39,0.486,0.243,DISCARD,low_score
59.428,1089,class68,0.415,0.207,DISCARD,low_score
59.428,1089,class70,0.402,0.201,DISCARD,low_score
59.428,1089,class39,0.389,0.194,DISCARD,low_score
59.428,1089,class69,0.293,0.146,DISCARD,low_score
59.483,1090,class72,0.929,0.464,KEEP,priority+bandwidth_ok
59.483,1090,class68,0.568,0.284,DISCARD,low_score
59.483,1090,class39,0.419,0.209,DISCARD,low_score
59.483,1090,class45,0.374,0.187,DISCARD,low_score
59.483,1090,class69,0.311,0.155,DISCARD,low_score
59.538,1091,class72,0.847,0.423,DISCARD,low_score
59.538,1091,class68,0.611,0.306,DISCARD,low_score
59.538,1091,class39,0.432,0.216,DISCARD,low_score
59.593,1092,class72,0.749,0.375,DISCARD,low_score
59.593,1092,class70,0.44,0.22,DISCARD,low_score
59.593,1092,class39,0.415,0.207,DISCARD,low_score
59.593,1092,class39,0.376,0.188,DISCARD,low_score
59.593,1092,class68,0.321,0.16,DISCARD,low_score
59.593,1092,class70,0.302,0.151,DISCARD,low_score
59.593,1092,class69,0.292,0.146,DISCARD,low_score
59.648,1093,class72,0.838,0.419,DISCARD,low_score
59.648,1093,class69,0.434,0.217,DISCARD,low_score
59.648,1093,class39,0.43,0.215,DISCARD,low_score
59.648,1093,class39,0.365,0.182,DISCARD,low_score
59.648,1093,class70,0.365,0.182,DISCARD,low_score
59.648,1093,class68,0.27,0.135,DISCARD,low_score
59.648,1093,class39,0.263,0.131,DISCARD,low_score
59.703,1094,class72,0.848,0.424,DISCARD,low_score
59.703,1094,class39,0.512,0.256,DISCARD,low_score
59.703,1094,class69,0.482,0.241,DISCARD,low_score
59.703,1094,class39,0.367,0.183,DISCARD,low_score
59.703,1094,class70,0.299,0.15,DISCARD,low_score
59.703,1094,class39,0.291,0.145,DISCARD,low_score
59.703,1094,class68,0.288,0.144,DISCARD,low_score
59.703,1094,class45,0.254,0.127,DISCARD,low_score
59.758,1095,class69,0.676,0.338,DISCARD,low_score
59.758,1095,class72,0.572,0.286,DISCARD,low_score
59.758,1095,class39,0.543,0.271,DISCARD,low_score
59.758,1095,class70,0.417,0.208,DISCARD,low_score
59.758,1095,class39,0.402,0.201,DISCARD,low_score
59.758,1095,class70,0.394,0.197,DISCARD,low_score
59.758,1095,class68,0.354,0.177,DISCARD,low_score
59.758,1095,class39,0.317,0.159,DISCARD,low_score
59.813,1096,class69,0.742,0.371,DISCARD,low_score
59.813,1096,class70,0.679,0.34,DISCARD,low_score
59.813,1096,class39,0.554,0.277,DISCARD,low_score
59.813,1096,class39,0.356,0.178,DISCARD,low_score
59.813,1096,class39,0.323,0.161,DISCARD,low_score
59.813,1096,class70,0.317,0.159,DISCARD,low_score
59.813,1096,class39,0.283,0.141,DISCARD,low_score
59.813,1096,class39,0.281,0.141,DISCARD,low_score
59.813,1096,class72,0.28,0.14,DISCARD,low_score
59.869,1097,class69,0.706,0.353,DISCARD,low_score
59.869,1097,class70,0.691,0.345,DISCARD,low_score
59.869,1097,class39,0.523,0.262,DISCARD,low_score
59.869,1097,class70,0.402,0.201,DISCARD,low_score
59.869,1097,class39,0.363,0.181,DISCARD,low_score
59.869,1097,class39,0.258,0.129,DISCARD,low_score
59.924,1098,class69,0.736,0.368,DISCARD,low_score
59.924,1098,class70,0.674,0.337,DISCARD,low_score
59.924,1098,class39,0.545,0.272,DISCARD,low_score
59.924,1098,class39,0.372,0.186,DISCARD,low_score
59.924,1098,class68,0.314,0.157,DISCARD,low_score
59.924,1098,class39,0.257,0.128,DISCARD,low_score
59.978,1099,class69,0.698,0.349,DISCARD,low_score
59.978,1099,class70,0.628,0.314,DISCARD,low_score
59.978,1099,class39,0.556,0.278,DISCARD,low_score
59.978,1099,class39,0.326,0.163,DISCARD,low_score
59.978,1099,class39,0.321,0.16,DISCARD,low_score
59.978,1099,class68,0.291,0.145,DISCARD,low_score
59.978,1099,class39,0.288,0.144,DISCARD,low_score
59.978,1099,class39,0.278,0.139,DISCARD,low_score
59.978,1099,class70,0.254,0.127,DISCARD,low_score
60.034,1100,class70,0.701,0.35,DISCARD,low_score
60.034,1100,class69,0.615,0.308,DISCARD,low_score
60.034,1100,class39,0.514,0.257,DISCARD,low_score
60.034,1100,class39,0.335,0.167,DISCARD,low_score
60.034,1100,class39,0.296,0.148,DISCARD,low_score
60.034,1100,class39,0.254,0.127,DISCARD,low_score
60.088,1101,class70,0.78,0.39,DISCARD,low_score
60.088,1101,class69,0.766,0.383,DISCARD,low_score
60.088,1101,class39,0.484,0.242,DISCARD,low_score
60.088,1101,class39,0.419,0.209,DISCARD,low_score
60.088,1101,class39,0.283,0.141,DISCARD,low_score
60.088,1101,class39,0.263,0.131,DISCARD,low_score
60.143,1102,class70,0.715,0.358,DISCARD,low_score
60.143,1102,class69,0.696,0.348,DISCARD,low_score
60.143,1102,class39,0.446,0.223,DISCARD,low_score
60.143,1102,class39,0.442,0.221,DISCARD,low_score
60.143,1102,class70,0.428,0.214,DISCARD,low_score
60.143,1102,class39,0.324,0.162,DISCARD,low_score
60.143,1102,class68,0.255,0.128,DISCARD,low_score
60.198,1103,class70,0.755,0.377,DISCARD,low_score
60.198,1103,class69,0.704,0.352,DISCARD,low_score
60.198,1103,class39,0.451,0.226,DISCARD,low_score
60.198,1103,class39,0.335,0.167,DISCARD,low_score
60.198,1103,class39,0.326,0.163,DISCARD,low_score
60.198,1103,class39,0.294,0.147,DISCARD,low_score
60.198,1103,class39,0.275,0.138,DISCARD,low_score
60.198,1103,class39,0.272,0.136,DISCARD,low_score
60.198,1103,class39,0.254,0.127,DISCARD,low_score
60.256,1104,class69,0.809,0.405,DISCARD,low_score
60.256,1104,class70,0.611,0.306,DISCARD,low_score
60.256,1104,class39,0.449,0.225,DISCARD,low_score
60.256,1104,class39,0.293,0.146,DISCARD,low_score
60.31,1105,class69,0.78,0.39,DISCARD,low_score
60.31,1105,class70,0.529,0.265,DISCARD,low_score
60.31,1105,class39,0.387,0.193,DISCARD,low_score
60.31,1105,class39,0.306,0.153,DISCARD,low_score
60.31,1105,class39,0.275,0.138,DISCARD,low_score
60.365,1106,class69,0.813,0.406,DISCARD,low_score
60.365,1106,class70,0.637,0.319,DISCARD,low_score
60.365,1106,class39,0.376,0.188,DISCARD,low_score
60.365,1106,class39,0.261,0.131,DISCARD,low_score
60.419,1107,class69,0.788,0.394,DISCARD,low_score
60.419,1107,class39,0.498,0.249,DISCARD,low_score
60.419,1107,class39,0.44,0.22,DISCARD,low_score
60.419,1107,class70,0.326,0.163,DISCARD,low_score
60.474,1108,class69,0.639,0.319,DISCARD,low_score
60.474,1108,class70,0.52,0.26,DISCARD,low_score
60.474,1108,class39,0.319,0.16,DISCARD,low_score
60.474,1108,class39,0.309,0.155,DISCARD,low_score
60.54,1109,class69,0.648,0.324,DISCARD,low_score
60.54,1109,class39,0.482,0.241,DISCARD,low_score
60.54,1109,class45,0.394,0.197,DISCARD,low_score
60.594,1110,class39,0.502,0.251,DISCARD,low_score
60.594,1110,class69,0.426,0.213,DISCARD,low_score
60.648,1111,class69,0.626,0.313,DISCARD,low_score
60.648,1111,class45,0.368,0.184,DISCARD,low_score
60.708,1112,class69,0.484,0.242,DISCARD,low_score
60.708,1112,class45,0.394,0.197,DISCARD,low_score
60.763,1113,class69,0.628,0.314,DISCARD,low_score
60.763,1113,class45,0.387,0.193,DISCARD,low_score
60.816,1114,class69,0.488,0.244,DISCARD,low_score
60.816,1114,class45,0.449,0.225,DISCARD,low_score
60.816,1114,class71,0.301,0.15,DISCARD,low_score
60.871,1115,class69,0.484,0.242,DISCARD,low_score
60.871,1115,class45,0.475,0.237,DISCARD,low_score
60.925,1116,class45,0.347,0.173,DISCARD,low_score
60.978,1117,class45,0.258,0.129,DISCARD,low_score
61.032,1118,class45,0.321,0.16,DISCARD,low_score
61.24,1122,class2,0.277,0.138,DISCARD,low_score
61.294,1123,class2,0.257,0.128,DISCARD,low_score
61.503,1127,class45,0.471,0.235,DISCARD,low_score
61.503,1127,class69,0.286,0.143,DISCARD,low_score
61.557,1128,class45,0.35,0.175,DISCARD,low_score
61.557,1128,class69,0.331,0.166,DISCARD,low_score
61.611,1129,class45,0.436,0.218,DISCARD,low_score
61.611,1129,class39,0.289,0.145,DISCARD,low_score
61.665,1130,class72,0.411,0.206,DISCARD,low_score
61.665,1130,class45,0.349,0.174,DISCARD,low_score
61.72,1131,class72,0.677,0.339,DISCARD,low_score
61.774,1132,class45,0.617,0.308,DISCARD,low_score
61.774,1132,class72,0.417,0.208,DISCARD,low_score
61.774,1132,class69,0.379,0.19,DISCARD,low_score
61.828,1133,class45,0.696,0.348,DISCARD,low_score
61.828,1133,class72,0.5,0.25,DISCARD,low_score
61.828,1133,class69,0.37,0.185,DISCARD,low_score
61.828,1133,class46,0.26,0.13,DISCARD,low_score
61.883,1134,class69,0.392,0.196,DISCARD,low_score
61.883,1134,class45,0.314,0.157,DISCARD,low_score
61.883,1134,class39,0.307,0.154,DISCARD,low_score
61.883,1134,class72,0.278,0.139,DISCARD,low_score
61.937,1135,class45,0.639,0.319,DISCARD,low_score
61.937,1135,class69,0.628,0.314,DISCARD,low_score
61.937,1135,class72,0.484,0.242,DISCARD,low_score
61.991,1136,class72,0.72,0.36,DISCARD,low_score
61.991,1136,class45,0.61,0.305,DISCARD,low_score
61.991,1136,class69,0.404,0.202,DISCARD,low_score
62.045,1137,class45,0.644,0.322,DISCARD,low_score
62.045,1137,class72,0.486,0.243,DISCARD,low_score
62.045,1137,class69,0.394,0.197,DISCARD,low_score
62.045,1137,class72,0.319,0.16,DISCARD,low_score
62.099,1138,class45,0.6,0.3,DISCARD,low_score
62.099,1138,class72,0.568,0.284,DISCARD,low_score
62.099,1138,class69,0.331,0.166,DISCARD,low_score
62.154,1139,class72,0.657,0.328,DISCARD,low_score
62.154,1139,class45,0.583,0.292,DISCARD,low_score
62.154,1139,class69,0.396,0.198,DISCARD,low_score
62.208,1140,class45,0.648,0.324,DISCARD,low_score
62.208,1140,class72,0.613,0.307,DISCARD,low_score
62.208,1140,class69,0.508,0.254,DISCARD,low_score
62.262,1141,class72,0.611,0.306,DISCARD,low_score
62.262,1141,class45,0.482,0.241,DISCARD,low_score
62.262,1141,class39,0.278,0.139,DISCARD,low_score
62.328,1142,class72,0.655,0.327,DISCARD,low_score
62.328,1142,class45,0.606,0.303,DISCARD,low_score
62.328,1142,class54,0.438,0.219,DISCARD,low_score
62.382,1143,class45,0.56,0.28,DISCARD,low_score
62.382,1143,class72,0.402,0.201,DISCARD,low_score
62.382,1143,class46,0.374,0.187,DISCARD,low_score
62.436,1144,class45,0.626,0.313,DISCARD,low_score
62.436,1144,class66,0.451,0.226,DISCARD,low_score
62.436,1144,class39,0.264,0.132,DISCARD,low_score
62.491,1145,class45,0.488,0.244,DISCARD,low_score
62.545,1146,class45,0.624,0.312,DISCARD,low_score
62.599,1147,class45,0.624,0.312,DISCARD,low_score
62.599,1147,class72,0.389,0.194,DISCARD,low_score
62.652,1148,class56,0.751,0.375,DISCARD,low_score
62.652,1148,class45,0.672,0.336,DISCARD,low_score
62.652,1148,class56,0.255,0.128,DISCARD,low_score
62.707,1149,class56,0.704,0.352,DISCARD,low_score
62.707,1149,class45,0.577,0.289,DISCARD,low_score
62.707,1149,class56,0.404,0.202,DISCARD,low_score
62.761,1150,class56,0.849,0.424,DISCARD,low_score
62.761,1150,class45,0.717,0.359,DISCARD,low_score
62.761,1150,class39,0.288,0.144,DISCARD,low_score
62.815,1151,class56,0.802,0.401,DISCARD,low_score
62.815,1151,class45,0.739,0.369,DISCARD,low_score
62.869,1152,class56,0.798,0.399,DISCARD,low_score
62.869,1152,class45,0.731,0.366,DISCARD,low_score
62.923,1153,class56,0.679,0.34,DISCARD,low_score
62.923,1153,class45,0.658,0.329,DISCARD,low_score
62.977,1154,class45,0.655,0.327,DISCARD,low_score
62.977,1154,class56,0.646,0.323,DISCARD,low_score
63.031,1155,class56,0.78,0.39,DISCARD,low_score
63.031,1155,class45,0.644,0.322,DISCARD,low_score
63.086,1156,class56,0.734,0.367,DISCARD,low_score
63.086,1156,class45,0.608,0.304,DISCARD,low_score
63.14,1157,class56,0.787,0.393,DISCARD,low_score
63.14,1157,class45,0.655,0.327,DISCARD,low_score
63.195,1158,class56,0.715,0.358,DISCARD,low_score
63.195,1158,class45,0.635,0.318,DISCARD,low_score
63.248,1159,class56,0.655,0.327,DISCARD,low_score
63.248,1159,class45,0.312,0.156,DISCARD,low_score
63.302,1160,class56,0.814,0.407,DISCARD,low_score
63.302,1160,class45,0.461,0.231,DISCARD,low_score
63.302,1160,class73,0.392,0.196,DISCARD,low_score
63.357,1161,class56,0.759,0.38,DISCARD,low_score
63.357,1161,class69,0.333,0.166,DISCARD,low_score
63.41,1162,class56,0.455,0.228,DISCARD,low_score
63.41,1162,class69,0.289,0.145,DISCARD,low_score
63.465,1163,class56,0.291,0.145,DISCARD,low_score
63.519,1164,class56,0.449,0.225,DISCARD,low_score
63.519,1164,class45,0.278,0.139,DISCARD,low_score
63.573,1165,class56,0.756,0.378,DISCARD,low_score
63.573,1165,class69,0.281,0.141,DISCARD,low_score
63.573,1165,class73,0.275,0.138,DISCARD,low_score
63.573,1165,class45,0.275,0.138,DISCARD,low_score
63.573,1165,class43,0.263,0.131,DISCARD,low_score
63.627,1166,class56,0.78,0.39,DISCARD,low_score
63.627,1166,class69,0.296,0.148,DISCARD,low_score
63.627,1166,class56,0.258,0.129,DISCARD,low_score
63.681,1167,class56,0.699,0.35,DISCARD,low_score
63.681,1167,class69,0.411,0.206,DISCARD,low_score
63.681,1167,class56,0.35,0.175,DISCARD,low_score
63.681,1167,class46,0.304,0.152,DISCARD,low_score
63.736,1168,class56,0.814,0.407,DISCARD,low_score
63.736,1168,class56,0.436,0.218,DISCARD,low_score
63.736,1168,class71,0.257,0.128,DISCARD,low_score
63.79,1169,class56,0.681,0.34,DISCARD,low_score
63.79,1169,class69,0.417,0.208,DISCARD,low_score
63.79,1169,class73,0.317,0.159,DISCARD,low_score
63.79,1169,class56,0.252,0.126,DISCARD,low_score
63.79,1169,class45,0.252,0.126,DISCARD,low_score
63.845,1170,class56,0.51,0.255,DISCARD,low_score
63.845,1170,class73,0.291,0.145,DISCARD,low_score
63.899,1171,class69,0.355,0.177,DISCARD,low_score
63.899,1171,class68,0.343,0.172,DISCARD,low_score
63.965,1172,class73,0.467,0.233,DISCARD,low_score
63.965,1172,class56,0.461,0.231,DISCARD,low_score
63.965,1172,class69,0.341,0.17,DISCARD,low_score
63.965,1172,class73,0.297,0.149,DISCARD,low_score
64.019,1173,class71,0.314,0.157,DISCARD,low_score
64.019,1173,class69,0.292,0.146,DISCARD,low_score
64.019,1173,class39,0.252,0.126,DISCARD,low_score
64.074,1174,class69,0.562,0.281,DISCARD,low_score
64.074,1174,class73,0.424,0.212,DISCARD,low_score
64.074,1174,class39,0.335,0.167,DISCARD,low_score
64.074,1174,class73,0.266,0.133,DISCARD,low_score
64.128,1175,class69,0.568,0.284,DISCARD,low_score
64.128,1175,class68,0.28,0.14,DISCARD,low_score
64.182,1176,class69,0.518,0.259,DISCARD,low_score
64.182,1176,class73,0.302,0.151,DISCARD,low_score
64.182,1176,class39,0.28,0.14,DISCARD,low_score
64.236,1177,class69,0.622,0.311,DISCARD,low_score
64.236,1177,class73,0.5,0.25,DISCARD,low_score
64.236,1177,class73,0.385,0.192,DISCARD,low_score
64.236,1177,class39,0.323,0.161,DISCARD,low_score
64.236,1177,class73,0.288,0.144,DISCARD,low_score
64.236,1177,class73,0.267,0.134,DISCARD,low_score
64.291,1178,class69,0.556,0.278,DISCARD,low_score
64.291,1178,class73,0.257,0.128,DISCARD,low_score
64.346,1179,class69,0.736,0.368,DISCARD,low_score
64.401,1180,class69,0.606,0.303,DISCARD,low_score
64.455,1181,class69,0.596,0.298,DISCARD,low_score
64.509,1182,class69,0.72,0.36,DISCARD,low_score
64.509,1182,class73,0.39,0.195,DISCARD,low_score
64.509,1182,class73,0.283,0.141,DISCARD,low_score
64.509,1182,class39,0.278,0.139,DISCARD,low_score
64.563,1183,class69,0.604,0.302,DISCARD,low_score
64.563,1183,class39,0.354,0.177,DISCARD,low_score
64.617,1184,class69,0.498,0.249,DISCARD,low_score
64.671,1185,class71,0.335,0.167,DISCARD,low_score
64.671,1185,class69,0.331,0.166,DISCARD,low_score
64.725,1186,class69,0.518,0.259,DISCARD,low_score
64.725,1186,class39,0.26,0.13,DISCARD,low_score
64.778,1187,class69,0.667,0.334,DISCARD,low_score
64.778,1187,class73,0.345,0.173,DISCARD,low_score
64.833,1188,class69,0.49,0.245,DISCARD,low_score
64.833,1188,class39,0.299,0.15,DISCARD,low_score
64.833,1188,class71,0.252,0.126,DISCARD,low_score
64.887,1189,class69,0.453,0.227,DISCARD,low_score
64.887,1189,class71,0.379,0.19,DISCARD,low_score
64.941,1190,class69,0.722,0.361,DISCARD,low_score
64.994,1191,class69,0.784,0.392,DISCARD,low_score
65.048,1192,class69,0.6,0.3,DISCARD,low_score
65.048,1192,class71,0.294,0.147,DISCARD,low_score
65.102,1193,class69,0.784,0.392,DISCARD,low_score
65.156,1194,class69,0.681,0.34,DISCARD,low_score
65.21,1195,class69,0.589,0.294,DISCARD,low_score
65.21,1195,class71,0.326,0.163,DISCARD,low_score
65.264,1196,class69,0.628,0.314,DISCARD,low_score
65.264,1196,class60,0.276,0.138,DISCARD,low_score
65.318,1197,class69,0.745,0.372,DISCARD,low_score
65.318,1197,class39,0.335,0.167,DISCARD,low_score
65.372,1198,class69,0.74,0.37,DISCARD,low_score
65.426,1199,class69,0.734,0.367,DISCARD,low_score
65.48,1200,class69,0.547,0.273,DISCARD,low_score
65.48,1200,class39,0.321,0.16,DISCARD,low_score
65.48,1200,class39,0.301,0.15,DISCARD,low_score
65.545,1201,class69,0.392,0.196,DISCARD,low_score
65.545,1201,class71,0.367,0.183,DISCARD,low_score
