t,frame,name,conf,score,decision,reason
26.465,391,class57,0.306,0.153,DISCARD,low_score
26.549,392,class16,0.862,0.431,KEEP,priority+bandwidth_ok
26.549,392,class59,0.507,0.253,DISCARD,low_score
26.618,393,class16,0.866,0.433,KEEP,priority+bandwidth_ok
26.618,393,class59,0.467,0.233,DISCARD,low_score
26.618,393,class57,0.312,0.156,DISCARD,low_score
26.686,394,class16,0.711,0.355,KEEP,priority+bandwidth_ok
26.686,394,class59,0.399,0.199,DISCARD,low_score
26.686,394,class57,0.303,0.152,DISCARD,low_score
26.748,395,class16,0.862,0.431,KEEP,priority+bandwidth_ok
26.748,395,class59,0.302,0.151,DISCARD,low_score
26.811,396,class16,0.873,0.437,KEEP,priority+bandwidth_ok
26.874,397,class16,0.863,0.432,KEEP,priority+bandwidth_ok
26.874,397,class59,0.351,0.176,DISCARD,low_score
26.938,398,class16,0.717,0.359,KEEP,priority+bandwidth_ok
26.938,398,class15,0.27,0.135,DISCARD,low_score
27.004,399,class16,0.833,0.417,KEEP,priority+bandwidth_ok
27.004,399,class59,0.423,0.212,DISCARD,low_score
27.07,400,class16,0.852,0.426,KEEP,priority+bandwidth_ok
27.07,400,class57,0.258,0.129,DISCARD,low_score
27.136,401,class16,0.847,0.423,KEEP,priority+bandwidth_ok
27.136,401,class57,0.564,0.282,DISCARD,low_score
27.202,402,class16,0.587,0.293,DISCARD,low_score
27.202,402,class57,0.267,0.133,DISCARD,low_score
27.268,403,class16,0.688,0.344,DISCARD,low_score
27.335,404,class16,0.84,0.42,KEEP,priority+bandwidth_ok
27.401,405,class16,0.818,0.409,KEEP,priority+bandwidth_ok
27.401,405,class57,0.295,0.148,DISCARD,low_score
27.469,406,class16,0.428,0.214,DISCARD,low_score
27.469,406,class17,0.317,0.159,DISCARD,low_score
27.568,407,class16,0.793,0.397,KEEP,priority+bandwidth_ok
27.63,408,class16,0.912,0.456,KEEP,priority+bandwidth_ok
27.697,409,class16,0.889,0.444,KEEP,priority+bandwidth_ok
27.763,410,class16,0.87,0.435,KEEP,priority+bandwidth_ok
27.829,411,class16,0.847,0.423,KEEP,priority+bandwidth_ok
27.897,412,class16,0.886,0.443,KEEP,priority+bandwidth_ok
27.964,413,class16,0.862,0.431,KEEP,priority+bandwidth_ok
28.055,414,class16,0.762,0.381,KEEP,priority+bandwidth_ok
28.126,415,class16,0.893,0.447,KEEP,priority+bandwidth_ok
28.232,416,class16,0.882,0.441,KEEP,priority+bandwidth_ok
28.331,417,class16,0.908,0.454,KEEP,priority+bandwidth_ok
28.428,418,class16,0.916,0.458,KEEP,priority+bandwidth_ok
28.526,419,class16,0.91,0.455,KEEP,priority+bandwidth_ok
28.612,420,class16,0.909,0.455,KEEP,priority+bandwidth_ok
28.737,422,class16,0.903,0.451,KEEP,priority+bandwidth_ok
28.864,424,class16,0.776,0.388,KEEP,priority+bandwidth_ok
28.994,426,class16,0.878,0.439,KEEP,priority+bandwidth_ok
29.126,428,class16,0.709,0.355,KEEP,priority+bandwidth_ok
29.126,428,class21,0.374,0.187,DISCARD,low_score
29.25,430,class16,0.893,0.447,KEEP,priority+bandwidth_ok
29.367,432,class16,0.904,0.452,KEEP,priority+bandwidth_ok
29.367,432,class57,0.436,0.218,DISCARD,low_score
29.487,434,class16,0.905,0.452,KEEP,priority+bandwidth_ok
29.487,434,class59,0.446,0.223,DISCARD,low_score
29.487,434,class57,0.402,0.201,DISCARD,low_score
29.595,436,class16,0.909,0.455,KEEP,priority+bandwidth_ok
29.595,436,class59,0.288,0.144,DISCARD,low_score
29.706,438,class16,0.894,0.447,KEEP,priority+bandwidth_ok
29.813,440,class16,0.916,0.458,KEEP,priority+bandwidth_ok
29.813,440,class59,0.45,0.225,DISCARD,low_score
29.932,442,class16,0.91,0.455,KEEP,priority+bandwidth_ok
29.932,442,class59,0.525,0.263,DISCARD,low_score
