t,frame,name,conf,score,decision,reason
29.656,540,class56,0.308,0.154,DISCARD,low_score
29.711,541,class56,0.852,0.426,DISCARD,low_score
29.711,541,class56,0.502,0.251,DISCARD,low_score
29.711,541,class56,0.444,0.222,DISCARD,low_score
29.711,541,class60,0.429,0.215,DISCARD,low_score
29.711,541,class56,0.428,0.214,DISCARD,low_score
29.711,541,class56,0.347,0.173,DISCARD,low_score
29.711,541,class56,0.28,0.14,DISCARD,low_score
29.766,542,class56,0.867,0.434,DISCARD,low_score
29.766,542,class56,0.606,0.303,DISCARD,low_score
29.766,542,class56,0.496,0.248,DISCARD,low_score
29.766,542,class60,0.463,0.231,DISCARD,low_score
29.766,542,class56,0.451,0.226,DISCARD,low_score
29.766,542,class56,0.333,0.166,DISCARD,low_score
29.766,542,class56,0.311,0.155,DISCARD,low_score
29.821,543,class56,0.822,0.411,DISCARD,low_score
29.821,543,class56,0.677,0.339,DISCARD,low_score
29.821,543,class56,0.581,0.291,DISCARD,low_score
29.821,543,class60,0.45,0.225,DISCARD,low_score
29.821,543,class56,0.427,0.214,DISCARD,low_score
29.821,543,class56,0.368,0.184,DISCARD,low_score
29.821,543,class56,0.307,0.153,DISCARD,low_score
29.876,544,class56,0.855,0.427,DISCARD,low_score
29.876,544,class56,0.516,0.258,DISCARD,low_score
29.876,544,class56,0.494,0.247,DISCARD,low_score
29.876,544,class60,0.397,0.199,DISCARD,low_score
29.876,544,class56,0.383,0.192,DISCARD,low_score
29.876,544,class60,0.323,0.161,DISCARD,low_score
29.876,544,class56,0.284,0.142,DISCARD,low_score
29.931,545,class56,0.897,0.448,DISCARD,low_score
29.931,545,class60,0.61,0.305,DISCARD,low_score
29.931,545,class56,0.596,0.298,DISCARD,low_score
29.931,545,class56,0.473,0.236,DISCARD,low_score
29.931,545,class56,0.434,0.217,DISCARD,low_score
29.931,545,class56,0.396,0.198,DISCARD,low_score
29.931,545,class56,0.335,0.167,DISCARD,low_score
29.931,545,class56,0.316,0.158,DISCARD,low_score
29.986,546,class56,0.898,0.449,DISCARD,low_score
29.986,546,class56,0.523,0.262,DISCARD,low_score
29.986,546,class60,0.516,0.258,DISCARD,low_score
29.986,546,class56,0.498,0.249,DISCARD,low_score
29.986,546,class56,0.357,0.178,DISCARD,low_score
29.986,546,class56,0.352,0.176,DISCARD,low_score
29.986,546,class56,0.252,0.126,DISCARD,low_score
30.043,547,class56,0.869,0.434,DISCARD,low_score
30.043,547,class56,0.653,0.327,DISCARD,low_score
30.043,547,class56,0.6,0.3,DISCARD,low_score
30.043,547,class60,0.403,0.201,DISCARD,low_score
30.043,547,class56,0.272,0.136,DISCARD,low_score
30.043,547,class60,0.261,0.131,DISCARD,low_score
30.098,548,class56,0.876,0.438,DISCARD,low_score
30.098,548,class56,0.651,0.326,DISCARD,low_score
30.098,548,class56,0.608,0.304,DISCARD,low_score
30.098,548,class56,0.539,0.269,DISCARD,low_score
30.098,548,class59,0.401,0.2,DISCARD,low_score
30.098,548,class60,0.362,0.181,DISCARD,low_score
30.098,548,class56,0.281,0.141,DISCARD,low_score
30.153,549,class56,0.894,0.447,DISCARD,low_score
30.153,549,class56,0.743,0.372,DISCARD,low_score
30.153,549,class56,0.669,0.334,DISCARD,low_score
30.153,549,class56,0.535,0.268,DISCARD,low_score
30.153,549,class60,0.496,0.248,DISCARD,low_score
30.153,549,class60,0.252,0.126,DISCARD,low_score
30.208,550,class56,0.878,0.439,DISCARD,low_score
30.208,550,class56,0.689,0.345,DISCARD,low_score
30.208,550,class56,0.622,0.311,DISCARD,low_score
30.208,550,class56,0.56,0.28,DISCARD,low_score
30.208,550,class60,0.491,0.246,DISCARD,low_score
30.208,550,class60,0.367,0.184,DISCARD,low_score
30.263,551,class56,0.789,0.395,DISCARD,low_score
30.263,551,class56,0.42,0.21,DISCARD,low_score
30.263,551,class56,0.394,0.197,DISCARD,low_score
30.263,551,class56,0.337,0.169,DISCARD,low_score
30.263,551,class60,0.309,0.155,DISCARD,low_score
30.332,552,class56,0.877,0.438,DISCARD,low_score
30.332,552,class56,0.66,0.33,DISCARD,low_score
30.332,552,class56,0.521,0.261,DISCARD,low_score
30.332,552,class56,0.307,0.154,DISCARD,low_score
30.332,552,class56,0.262,0.131,DISCARD,low_score
30.387,553,class56,0.846,0.423,DISCARD,low_score
30.387,553,class56,0.715,0.358,DISCARD,low_score
30.387,553,class56,0.633,0.317,DISCARD,low_score
30.387,553,class56,0.368,0.184,DISCARD,low_score
30.442,554,class56,0.833,0.417,DISCARD,low_score
30.442,554,class56,0.693,0.346,DISCARD,low_score
30.442,554,class56,0.553,0.276,DISCARD,low_score
30.442,554,class56,0.368,0.184,DISCARD,low_score
30.442,554,class56,0.319,0.16,DISCARD,low_score
30.497,555,class56,0.893,0.446,DISCARD,low_score
30.497,555,class56,0.761,0.38,DISCARD,low_score
30.497,555,class56,0.564,0.282,DISCARD,low_score
30.497,555,class56,0.381,0.191,DISCARD,low_score
30.497,555,class60,0.367,0.183,DISCARD,low_score
30.497,555,class56,0.347,0.173,DISCARD,low_score
30.497,555,class59,0.258,0.129,DISCARD,low_score
30.551,556,class56,0.863,0.432,DISCARD,low_score
30.551,556,class56,0.572,0.286,DISCARD,low_score
30.551,556,class56,0.434,0.217,DISCARD,low_score
30.551,556,class59,0.42,0.21,DISCARD,low_score
30.551,556,class56,0.384,0.192,DISCARD,low_score
30.551,556,class60,0.288,0.144,DISCARD,low_score
30.551,556,class56,0.267,0.133,DISCARD,low_score
30.607,557,class56,0.89,0.445,DISCARD,low_score
30.607,557,class56,0.681,0.34,DISCARD,low_score
30.607,557,class56,0.6,0.3,DISCARD,low_score
30.607,557,class60,0.442,0.221,DISCARD,low_score
30.607,557,class56,0.387,0.193,DISCARD,low_score
30.607,557,class59,0.265,0.133,DISCARD,low_score
30.661,558,class56,0.854,0.427,DISCARD,low_score
30.661,558,class56,0.56,0.28,DISCARD,low_score
30.661,558,class56,0.558,0.279,DISCARD,low_score
30.661,558,class56,0.488,0.244,DISCARD,low_score
30.661,558,class56,0.471,0.235,DISCARD,low_score
30.661,558,class60,0.305,0.152,DISCARD,low_score
30.716,559,class56,0.812,0.406,DISCARD,low_score
30.716,559,class56,0.57,0.285,DISCARD,low_score
30.716,559,class56,0.504,0.252,DISCARD,low_score
30.716,559,class60,0.396,0.198,DISCARD,low_score
30.771,560,class56,0.89,0.445,DISCARD,low_score
30.771,560,class56,0.651,0.326,DISCARD,low_score
30.771,560,class60,0.547,0.273,DISCARD,low_score
30.771,560,class56,0.512,0.256,DISCARD,low_score
30.771,560,class56,0.264,0.132,DISCARD,low_score
30.826,561,class56,0.89,0.445,DISCARD,low_score
30.826,561,class56,0.667,0.334,DISCARD,low_score
30.826,561,class60,0.489,0.245,DISCARD,low_score
30.826,561,class56,0.416,0.208,DISCARD,low_score
30.88,562,class56,0.887,0.444,DISCARD,low_score
30.88,562,class56,0.677,0.339,DISCARD,low_score
30.88,562,class60,0.494,0.247,DISCARD,low_score
30.88,562,class56,0.442,0.221,DISCARD,low_score
30.934,563,class56,0.905,0.453,DISCARD,bandwidth
30.934,563,class56,0.74,0.37,DISCARD,low_score
30.934,563,class60,0.554,0.277,DISCARD,low_score
30.934,563,class56,0.506,0.253,DISCARD,low_score
30.989,564,class56,0.917,0.459,DISCARD,bandwidth
30.989,564,class56,0.762,0.381,DISCARD,low_score
30.989,564,class60,0.593,0.296,DISCARD,low_score
30.989,564,class56,0.446,0.223,DISCARD,low_score
31.044,565,class56,0.9,0.45,DISCARD,low_score
31.044,565,class56,0.694,0.347,DISCARD,low_score
31.044,565,class60,0.615,0.308,DISCARD,low_score
31.044,565,class56,0.41,0.205,DISCARD,low_score
31.099,566,class56,0.882,0.441,DISCARD,low_score
31.099,566,class56,0.583,0.292,DISCARD,low_score
31.099,566,class60,0.573,0.286,DISCARD,low_score
31.099,566,class56,0.307,0.154,DISCARD,low_score
31.099,566,class56,0.263,0.131,DISCARD,low_score
31.154,567,class56,0.893,0.447,DISCARD,low_score
31.154,567,class56,0.6,0.3,DISCARD,low_score
31.154,567,class60,0.557,0.279,DISCARD,low_score
31.154,567,class56,0.51,0.255,DISCARD,low_score
31.208,568,class56,0.772,0.386,DISCARD,low_score
31.208,568,class60,0.528,0.264,DISCARD,low_score
31.208,568,class56,0.369,0.185,DISCARD,low_score
31.208,568,class59,0.318,0.159,DISCARD,low_score
31.208,568,class56,0.309,0.155,DISCARD,low_score
31.208,568,class56,0.307,0.153,DISCARD,low_score
31.263,569,class56,0.908,0.454,DISCARD,bandwidth
31.263,569,class56,0.518,0.259,DISCARD,low_score
31.263,569,class60,0.456,0.228,DISCARD,low_score
31.263,569,class56,0.396,0.198,DISCARD,low_score
31.263,569,class59,0.366,0.183,DISCARD,low_score
31.318,570,class56,0.903,0.451,DISCARD,bandwidth
31.318,570,class56,0.755,0.377,DISCARD,low_score
31.318,570,class60,0.532,0.266,DISCARD,low_score
31.318,570,class56,0.371,0.186,DISCARD,low_score
31.318,570,class56,0.3,0.15,DISCARD,low_score
31.318,570,class59,0.252,0.126,DISCARD,low_score
31.372,571,class56,0.906,0.453,DISCARD,bandwidth
31.372,571,class60,0.592,0.296,DISCARD,low_score
31.372,571,class56,0.581,0.291,DISCARD,low_score
31.372,571,class56,0.421,0.21,DISCARD,low_score
31.427,572,class56,0.93,0.465,DISCARD,bandwidth
31.427,572,class56,0.753,0.377,DISCARD,low_score
31.427,572,class60,0.499,0.25,DISCARD,low_score
31.427,572,class56,0.446,0.223,DISCARD,low_score
31.427,572,class56,0.323,0.162,DISCARD,low_score
31.427,572,class56,0.308,0.154,DISCARD,low_score
31.482,573,class56,0.914,0.457,DISCARD,bandwidth
31.482,573,class56,0.808,0.404,DISCARD,low_score
31.482,573,class60,0.623,0.312,DISCARD,low_score
31.538,574,class56,0.903,0.451,DISCARD,bandwidth
31.538,574,class56,0.776,0.388,DISCARD,low_score
31.538,574,class60,0.598,0.299,DISCARD,low_score
31.538,574,class56,0.407,0.204,DISCARD,low_score
31.538,574,class56,0.262,0.131,DISCARD,low_score
31.593,575,class56,0.855,0.427,DISCARD,low_score
31.593,575,class56,0.768,0.384,DISCARD,low_score
31.593,575,class60,0.544,0.272,DISCARD,low_score
31.647,576,class56,0.877,0.439,DISCARD,low_score
31.647,576,class56,0.768,0.384,DISCARD,low_score
31.647,576,class60,0.58,0.29,DISCARD,low_score
31.647,576,class59,0.277,0.139,DISCARD,low_score
31.701,577,class56,0.844,0.422,DISCARD,low_score
31.701,577,class56,0.812,0.406,DISCARD,low_score
31.701,577,class60,0.57,0.285,DISCARD,low_score
31.701,577,class59,0.253,0.127,DISCARD,low_score
31.756,578,class56,0.869,0.434,DISCARD,low_score
31.756,578,class56,0.761,0.38,DISCARD,low_score
31.756,578,class60,0.525,0.263,DISCARD,low_score
31.81,579,class56,0.871,0.436,DISCARD,low_score
31.81,579,class56,0.755,0.377,DISCARD,low_score
31.81,579,class59,0.504,0.252,DISCARD,low_score
31.81,579,class60,0.443,0.221,DISCARD,low_score
31.865,580,class56,0.821,0.411,DISCARD,low_score
31.865,580,class56,0.628,0.314,DISCARD,low_score
31.865,580,class59,0.595,0.297,DISCARD,low_score
31.865,580,class60,0.448,0.224,DISCARD,low_score
31.919,581,class56,0.882,0.441,DISCARD,low_score
31.919,581,class56,0.698,0.349,DISCARD,low_score
31.919,581,class60,0.604,0.302,DISCARD,low_score
31.973,582,class56,0.901,0.45,DISCARD,bandwidth
31.973,582,class56,0.672,0.336,DISCARD,low_score
31.973,582,class60,0.48,0.24,DISCARD,low_score
31.973,582,class59,0.464,0.232,DISCARD,low_score
32.028,583,class56,0.92,0.46,DISCARD,bandwidth
32.028,583,class56,0.709,0.355,DISCARD,low_score
32.028,583,class60,0.666,0.333,DISCARD,low_score
32.028,583,class59,0.36,0.18,DISCARD,low_score
32.083,584,class56,0.893,0.446,DISCARD,low_score
32.083,584,class60,0.703,0.351,DISCARD,low_score
32.083,584,class56,0.531,0.266,DISCARD,low_score
32.083,584,class59,0.343,0.172,DISCARD,low_score
32.137,585,class56,0.895,0.447,DISCARD,low_score
32.137,585,class60,0.763,0.382,DISCARD,low_score
32.137,585,class56,0.556,0.278,DISCARD,low_score
32.191,586,class56,0.904,0.452,DISCARD,bandwidth
32.191,586,class60,0.766,0.383,DISCARD,low_score
32.191,586,class56,0.438,0.219,DISCARD,low_score
32.191,586,class59,0.323,0.161,DISCARD,low_score
32.246,587,class56,0.889,0.444,DISCARD,low_score
32.246,587,class60,0.586,0.293,DISCARD,low_score
32.246,587,class56,0.471,0.235,DISCARD,low_score
32.246,587,class59,0.324,0.162,DISCARD,low_score
32.3,588,class56,0.842,0.421,DISCARD,low_score
32.3,588,class60,0.484,0.242,DISCARD,low_score
32.3,588,class59,0.461,0.231,DISCARD,low_score
32.3,588,class56,0.453,0.227,DISCARD,low_score
32.355,589,class56,0.882,0.441,DISCARD,low_score
32.355,589,class56,0.446,0.223,DISCARD,low_score
32.355,589,class59,0.413,0.207,DISCARD,low_score
32.355,589,class56,0.357,0.178,DISCARD,low_score
32.41,590,class56,0.862,0.431,DISCARD,low_score
32.41,590,class56,0.49,0.245,DISCARD,low_score
32.41,590,class56,0.396,0.198,DISCARD,low_score
32.41,590,class59,0.355,0.177,DISCARD,low_score
32.41,590,class56,0.263,0.131,DISCARD,low_score
32.465,591,class56,0.814,0.407,DISCARD,low_score
32.465,591,class56,0.57,0.285,DISCARD,low_score
32.465,591,class56,0.301,0.15,DISCARD,low_score
32.465,591,class60,0.293,0.146,DISCARD,low_score
32.465,591,class56,0.28,0.14,DISCARD,low_score
32.52,592,class56,0.837,0.418,DISCARD,low_score
32.52,592,class56,0.525,0.263,DISCARD,low_score
32.52,592,class56,0.492,0.246,DISCARD,low_score
32.52,592,class28,0.336,0.168,DISCARD,low_score
32.52,592,class60,0.28,0.14,DISCARD,low_score
32.574,593,class56,0.794,0.397,DISCARD,low_score
32.574,593,class56,0.349,0.174,DISCARD,low_score
32.574,593,class56,0.317,0.159,DISCARD,low_score
32.574,593,class60,0.29,0.145,DISCARD,low_score
32.629,594,class56,0.779,0.389,DISCARD,low_score
32.629,594,class56,0.566,0.283,DISCARD,low_score
32.629,594,class56,0.344,0.172,DISCARD,low_score
32.683,595,class56,0.803,0.402,DISCARD,low_score
32.683,595,class56,0.566,0.283,DISCARD,low_score
32.683,595,class56,0.35,0.175,DISCARD,low_score
32.737,596,class56,0.841,0.42,DISCARD,low_score
32.737,596,class56,0.611,0.306,DISCARD,low_score
32.791,597,class56,0.792,0.396,DISCARD,low_score
32.791,597,class56,0.366,0.183,DISCARD,low_score
32.791,597,class56,0.339,0.169,DISCARD,low_score
32.845,598,class56,0.83,0.415,DISCARD,low_score
32.845,598,class56,0.608,0.304,DISCARD,low_score
32.845,598,class56,0.331,0.166,DISCARD,low_score
32.845,598,class56,0.281,0.14,DISCARD,low_score
32.9,599,class56,0.839,0.419,DISCARD,low_score
32.9,599,class56,0.434,0.217,DISCARD,low_score
32.955,600,class56,0.891,0.446,DISCARD,low_score
33.009,601,class56,0.883,0.442,DISCARD,low_score
33.064,602,class56,0.898,0.449,DISCARD,low_score
33.118,603,class56,0.903,0.451,DISCARD,bandwidth
33.118,603,class36,0.349,0.174,DISCARD,low_score
33.172,604,class56,0.89,0.445,DISCARD,low_score
33.172,604,class36,0.676,0.338,DISCARD,low_score
33.226,605,class56,0.901,0.451,DISCARD,bandwidth
33.226,605,class56,0.384,0.192,DISCARD,low_score
33.28,606,class56,0.896,0.448,DISCARD,low_score
33.28,606,class56,0.341,0.17,DISCARD,low_score
33.334,607,class56,0.74,0.37,DISCARD,low_score
33.334,607,class56,0.343,0.172,DISCARD,low_score
33.334,607,class28,0.323,0.161,DISCARD,low_score
33.388,608,class56,0.712,0.356,DISCARD,low_score
33.388,608,class56,0.293,0.147,DISCARD,low_score
33.443,609,class56,0.461,0.231,DISCARD,low_score
33.443,609,class56,0.385,0.192,DISCARD,low_score
33.443,609,class28,0.264,0.132,DISCARD,low_score
33.497,610,class56,0.621,0.31,DISCARD,low_score
33.497,610,class28,0.359,0.18,DISCARD,low_score
33.551,611,class56,0.854,0.427,DISCARD,low_score
33.551,611,class28,0.413,0.207,DISCARD,low_score
33.605,612,class56,0.839,0.419,DISCARD,low_score
33.605,612,class28,0.331,0.166,DISCARD,low_score
33.659,613,class56,0.726,0.363,DISCARD,low_score
33.659,613,class56,0.266,0.133,DISCARD,low_score
33.713,614,class56,0.881,0.44,DISCARD,low_score
33.767,615,class56,0.862,0.431,DISCARD,low_score
33.767,615,class56,0.346,0.173,DISCARD,low_score
33.821,616,class56,0.648,0.324,DISCARD,low_score
33.821,616,class56,0.274,0.137,DISCARD,low_score
33.875,617,class56,0.882,0.441,DISCARD,low_score
33.928,618,class56,0.646,0.323,DISCARD,low_score
33.928,618,class56,0.255,0.127,DISCARD,low_score
33.983,619,class56,0.722,0.361,DISCARD,low_score
33.983,619,class56,0.292,0.146,DISCARD,low_score
34.036,620,class56,0.809,0.405,DISCARD,low_score
34.036,620,class28,0.404,0.202,DISCARD,low_score
34.09,621,class56,0.72,0.36,DISCARD,low_score
34.144,622,class56,0.781,0.391,DISCARD,low_score
34.198,623,class56,0.755,0.377,DISCARD,low_score
34.253,624,class56,0.807,0.403,DISCARD,low_score
34.253,624,class12,0.35,0.175,DISCARD,low_score
34.307,625,class56,0.779,0.389,DISCARD,low_score
34.36,626,class56,0.733,0.366,DISCARD,low_score
34.414,627,class56,0.745,0.372,DISCARD,low_score
34.468,628,class56,0.688,0.344,DISCARD,low_score
34.468,628,class56,0.365,0.182,DISCARD,low_score
34.522,629,class56,0.777,0.389,DISCARD,low_score
34.576,630,class56,0.598,0.299,DISCARD,low_score
34.576,630,class28,0.264,0.132,DISCARD,low_score
34.63,631,class56,0.523,0.262,DISCARD,low_score
34.63,631,class28,0.473,0.236,DISCARD,low_score
34.63,631,class56,0.254,0.127,DISCARD,low_score
34.684,632,class56,0.514,0.257,DISCARD,low_score
34.684,632,class28,0.432,0.216,DISCARD,low_score
34.738,633,class56,0.502,0.251,DISCARD,low_score
34.738,633,class56,0.5,0.25,DISCARD,low_score
34.792,634,class56,0.51,0.255,DISCARD,low_score
34.792,634,class56,0.475,0.237,DISCARD,low_score
34.846,635,class56,0.51,0.255,DISCARD,low_score
34.846,635,class56,0.469,0.234,DISCARD,low_score
34.9,636,class28,0.496,0.248,DISCARD,low_score
34.954,637,class28,0.587,0.293,DISCARD,low_score
35.008,638,class28,0.572,0.286,DISCARD,low_score
35.061,639,class56,0.553,0.276,DISCARD,low_score
35.061,639,class28,0.541,0.27,DISCARD,low_score
35.061,639,class56,0.504,0.252,DISCARD,low_score
35.116,640,class56,0.726,0.363,DISCARD,low_score
35.116,640,class56,0.4,0.2,DISCARD,low_score
35.116,640,class28,0.39,0.195,DISCARD,low_score
35.17,641,class56,0.853,0.426,DISCARD,low_score
35.17,641,class56,0.48,0.24,DISCARD,low_score
35.224,642,class56,0.704,0.352,DISCARD,low_score
35.224,642,class56,0.633,0.317,DISCARD,low_score
35.224,642,class28,0.383,0.192,DISCARD,low_score
35.278,643,class56,0.72,0.36,DISCARD,low_score
35.278,643,class56,0.637,0.319,DISCARD,low_score
35.278,643,class28,0.463,0.231,DISCARD,low_score
35.344,644,class56,0.598,0.299,DISCARD,low_score
35.344,644,class28,0.589,0.294,DISCARD,low_score
35.344,644,class56,0.577,0.289,DISCARD,low_score
35.398,645,class56,0.684,0.342,DISCARD,low_score
35.398,645,class56,0.398,0.199,DISCARD,low_score
35.452,646,class56,0.676,0.338,DISCARD,low_score
35.452,646,class56,0.414,0.207,DISCARD,low_score
35.506,647,class56,0.789,0.395,DISCARD,low_score
35.56,648,class56,0.82,0.41,DISCARD,low_score
35.615,649,class56,0.814,0.407,DISCARD,low_score
35.669,650,class56,0.679,0.34,DISCARD,low_score
35.723,651,class56,0.749,0.375,DISCARD,low_score
35.723,651,class56,0.331,0.166,DISCARD,low_score
35.777,652,class56,0.828,0.414,DISCARD,low_score
35.777,652,class56,0.383,0.192,DISCARD,low_score
35.831,653,class56,0.789,0.395,DISCARD,low_score
35.831,653,class56,0.553,0.276,DISCARD,low_score
35.885,654,class56,0.759,0.38,DISCARD,low_score
35.885,654,class56,0.465,0.232,DISCARD,low_score
35.885,654,class0,0.344,0.172,DISCARD,low_score
35.939,655,class56,0.761,0.38,DISCARD,low_score
35.939,655,class56,0.314,0.157,DISCARD,low_score
35.993,656,class56,0.688,0.344,DISCARD,low_score
35.993,656,class0,0.356,0.178,DISCARD,low_score
35.993,656,class56,0.339,0.169,DISCARD,low_score
36.047,657,class56,0.699,0.35,DISCARD,low_score
36.047,657,class0,0.41,0.205,DISCARD,low_score
36.047,657,class56,0.401,0.2,DISCARD,low_score
36.101,658,class56,0.752,0.376,DISCARD,low_score
36.101,658,class0,0.256,0.128,DISCARD,low_score
36.101,658,class56,0.251,0.125,DISCARD,low_score
36.155,659,class56,0.706,0.353,DISCARD,low_score
36.155,659,class0,0.289,0.145,DISCARD,low_score
36.209,660,class56,0.637,0.319,DISCARD,low_score
36.209,660,class56,0.467,0.233,DISCARD,low_score
36.209,660,class0,0.335,0.167,DISCARD,low_score
36.264,661,class56,0.617,0.308,DISCARD,low_score
36.264,661,class56,0.484,0.242,DISCARD,low_score
36.264,661,class0,0.315,0.157,DISCARD,low_score
36.319,662,class56,0.553,0.276,DISCARD,low_score
36.319,662,class0,0.463,0.231,DISCARD,low_score
36.319,662,class56,0.379,0.19,DISCARD,low_score
36.374,663,class56,0.566,0.283,DISCARD,low_score
36.374,663,class0,0.466,0.233,DISCARD,low_score
36.374,663,class56,0.446,0.223,DISCARD,low_score
36.428,664,class56,0.568,0.284,DISCARD,low_score
36.428,664,class0,0.462,0.231,DISCARD,low_score
36.428,664,class56,0.408,0.204,DISCARD,low_score
36.483,665,class56,0.648,0.324,DISCARD,low_score
36.483,665,class56,0.492,0.246,DISCARD,low_score
36.483,665,class0,0.286,0.143,DISCARD,low_score
36.483,665,class56,0.251,0.125,DISCARD,low_score
36.537,666,class56,0.449,0.225,DISCARD,low_score
36.537,666,class56,0.405,0.203,DISCARD,low_score
36.537,666,class0,0.332,0.166,DISCARD,low_score
36.591,667,class56,0.502,0.251,DISCARD,low_score
36.591,667,class56,0.272,0.136,DISCARD,low_score
36.645,668,class56,0.525,0.263,DISCARD,low_score
36.645,668,class56,0.368,0.184,DISCARD,low_score
36.699,669,class56,0.506,0.253,DISCARD,low_score
36.699,669,class56,0.256,0.128,DISCARD,low_score
36.752,670,class56,0.479,0.239,DISCARD,low_score
36.806,671,class56,0.604,0.302,DISCARD,low_score
36.806,671,class56,0.469,0.234,DISCARD,low_score
36.86,672,class56,0.422,0.211,DISCARD,low_score
36.914,673,class56,0.512,0.256,DISCARD,low_score
36.969,674,class56,0.492,0.246,DISCARD,low_score
36.969,674,class56,0.349,0.174,DISCARD,low_score
37.023,675,class56,0.496,0.248,DISCARD,low_score
37.077,676,class56,0.282,0.141,DISCARD,low_score
37.13,677,class56,0.368,0.184,DISCARD,low_score
37.13,677,class56,0.294,0.147,DISCARD,low_score
37.184,678,class56,0.354,0.177,DISCARD,low_score
37.184,678,class56,0.289,0.144,DISCARD,low_score
37.238,679,class56,0.355,0.177,DISCARD,low_score
37.238,679,class56,0.278,0.139,DISCARD,low_score
37.756,689,class74,0.686,0.343,DISCARD,low_score
37.756,689,class14,0.428,0.214,DISCARD,low_score
37.81,690,class74,0.296,0.148,DISCARD,low_score
39.939,731,class27,0.394,0.197,DISCARD,low_score
39.993,732,class27,0.681,0.34,DISCARD,low_score
40.047,733,class27,0.275,0.138,DISCARD,low_score
40.152,735,class27,0.389,0.194,DISCARD,low_score
